"Cresceva Jacopo [Fo] e lavorava come un matto. Si dice che il DNA non è acqua e devo ammettere che è un’espressione azzeccata, giacché nostro figlio ama la pittura con la stessa passione di suo padre, ma, almeno da ragazzo, quando gli offrivamo di entrare in compagnia con noi per recitare ruoli che Dario avrebbe scritto appositamente per lui, scantonava come un furetto: «Per carità! Vi ringrazio, ma non voglio godermi lo stress che prende a voi ogni volta che debuttate e stare tesi come corde di violino per tutta una stagione, leggervi belle critiche ma anche infamità rognose, per non parlare poi del vivere tutto il tempo con la censura attaccata alle spalle e sui glutei come le zecche ai cavalli...»Alla fine come professione scelse i fumetti e le vignette satiriche e pubblicò i suoi disegni su numerose riviste underground.",0.9222318690735847,0.04742587357759476,7.605943430633033e-09,5.234364608419639e-10,6.243338068756543e-10,0.010986941866576672,5.503274919105294e-11,0.08509904146194458,0.016914913430809975,2.024526206401145e-11,7.140809471506415e-11,1.8590182548905432e-07,1.5105104667068048e-10,1.7244253247561403e-10,9.546980095365143e-09,0.010328153148293495,2.575431257145766e-10,0.00011412239109631628,0.10669060051441193,1.0279354450970501e-10
"È il 25 aprile, la guerra è finita. A Varese per la piazza Impero sfilano i partigiani. Fra loro ci sono ragazzi che conosco. Erano del primo gruppo di combattenti che si era formato sulle montagne della Val Cuvia appena dopo l’8 settembre. Si erano arroccati sul Monte Grino e sul Cuvignone. I tedeschi li avevano attaccati sparando con artiglierie pesanti, un vero massacro, in pochi si erano salvati attraverso le gallerie scavate nella prima guerra mondiale; erano quasi tutti abitanti della valle, gli unici che conoscevano a menadito il percorso di quegli antichi camminamenti. Per festeggiare la liberazione, per le strade si era rovesciata una marea di gente: a un certo punto dal fondo scorgo venire avanti un gruppo armato. Con loro c’era una donna. Era la madre di uno dei caduti di Monte Grino. In molti la riconoscevano e l’applaudivano. Qualcuno andava ad abbracciarla. A un tratto lei si fermò e si sedette su un muretto, facendo cenno agli altri di proseguire: l’emozione era troppo grande e non ce la faceva più a camminare fra gli applausi e le grida.Il giorno dopo arrivano gli Alleati. Li avevamo visti il pomeriggio transitare per la città sui camion. Erano arrivati anche nella mia strada. Ci buttavano cioccolato e sigarette. Arrossisco al pensiero di essermi buttata con gli altri per tentare di raccogliere qualcosa.  La sera, nel cortile di casa mia, gran festa. Un grammofono, [...]. Poi guardo su, verso la finestra buia del primo piano: casa mia. Più che vederla, l'intuisco: mia madre è lì, ci sta guardando. Conosco i suoi pensieri, il suo tormento: mio fratello, deportato in un campo di concentramento in Germania, non dà notizie da oltre due anni, In un attimo le sono vicina vergognandomi della mia allegria. Mi stringo forte a lei.",1.2046292090089992,0.02931223064661026,0.02931223064661026,0.02931223064661026,0.02931223064661026,0.02931223064661026,0.02931223064661026,0.02931223064661026,0.02931223064661026,0.02931223064661026,0.02931223064661026,0.02931223064661026,0.02931223064661026,0.02931223064661026,0.02931223064661026,0.02931223064661026,0.02931223064661026,0.02931223064661026,0.02931223064661026,0.02931223064661026
"«Dario, credo mi si siano rotte le acque...» «Le acque?!» esclama Dario buttando finalmente il gran giornale. Di corsa un taxi. Ora siamo emozionati tutti e due. Ci stringiamo abbracciati. Occupiamo mezzo sedile. Il taxista è preoccupato che il bimbo nasca lì. Siamo arrivati in un minuto.Clinica Salus. Mi sistemano in una stanza. Dario è accanto a me. Arriva l’ostetrica, le infermiere, tutte gentilissime, un po’ per il mio bambino, un po’ per l’interesse che sollecitano sempre le persone di spettacolo. Poi inizia la litania: «Spinga signora spinga». Io ci metto tutta la mia buona volontà... ma non succede niente. Solo Dario è in movimento, mi posa deciso una mano sulla gola, stringendo e facendo pressione. «Caro, già sto male... vuoi strozzarmi?» Anche l'infermiera: «Ma cosa fa?!» Calmo, padrone della situazione nel suo ruolo di futuro padre, risponde: «Devo stare attento che non le venga il gozzo!» E giù a pigiare la mano.",1.021714563947171,5.682992559741251e-05,9.06281646950724e-11,0.00024298550852108747,2.7146320746851416e-09,0.0003974363789893687,8.000011764153214e-11,0.001674399245530367,1.9190739275476432e-10,4.855437579776023e-11,3.7825725190954174e-11,0.00482972152531147,2.0220410415494605e-11,4.702220030594617e-05,3.5594591736298753e-06,0.00407013762742281,0.0010443859500810504,1.5059063116495963e-05,0.3007456064224243,0.2120688259601593
"Sono stata io a invitarlo dopo le prove a mangiare qualcosa in una trattoria, la prima volta. Dario sembrava non accettare volentieri quell’invito; poi, giacché io insistevo, mi svelò la ragione della sua reticenza: «Non ho un soldo» disse, «per potermi liberare dal lavoro e venire alle prove ho dovuto licenziarmi dallo studio di architettura dove sviluppavo progetti». E io allegra risposi: «Mi fa piacere, adoro nutrire randagi, gatti abbandonati e disoccupati affamati». Andammo in una trattoria lì all’angolo e ordinammo due porzioni di salame, pane e una birra. Per me acqua, sono astemia. Poi ci accompagnammo l’un l’altra a casa. Io abitavo dalle parti di Porta Garibaldi, da mia sorella. Tram non ce n'erano più, quindi ci avviammo a piedi. Ci raccontavamo entrambi delle nostre vite, lui del suo lago, il Maggiore, e dell’Accademia in cui aveva studiato; io della mia compagnia e degli aneddoti più gustosi. Ci scoprimmo a ridere come ragazzini alle reciproche ironie; lo trovavo davvero spassoso, quel lungone, strabordante di racconti assurdi e festosi. In particolare se ne uscì con una frase che mi sorprese: «Mi succede spesso» disse «di parlare con qualcuno e sentirmi a disagio, perché le cose che credo intelligenti e spiritose che vado dicendo, non vengono raccolte, e allora pian piano mi convinco di non possedere né fantasia né spirito. Invece ogni tanto, come stasera, mi capita di sentir apprezzare le immagini che propongo, e di contrappunto ne ricevo altre, da te, che mi incoraggiano a lasciarmi andare nel fantastico».",1.2223588469205424,1.987214091059286e-05,6.95266789989546e-05,4.555041233089696e-09,0.0035936026833951473,0.0010202174307778478,7.669132551235691e-10,1.8129196178051643e-05,0.11920291930437088,1.1458051174528805e-09,2.419886016014061e-07,0.003172682598233223,3.786210928113931e-11,0.9465966820716858,0.18242552876472473,0.9669140577316284,0.9840936064720154,1.964062721526716e-05,0.29421496391296387,0.09534945338964462
"Con l’avvento del cinema sonoro (1929), mio padre, mio zio e tutta la compagnia intuiscono che «il teatro delle marionette» sarà presto messo in crisi, schiacciato da questo nuovo straordinario e anche un po’ magico mezzo di spettacolo. Con grande dolore del nonno Pio, decidono un cambiamento radicale del loro programma e della loro condizione: «Reciteremo noi i nostri spettacoli, entreremo in scena noi, al posto delle marionette». Così le due famiglie dei Rame si sostituiscono ai pupazzi di legno (vere e proprie sculture snodate, tre delle quali sono ancora oggi esposte al Museo della Scala di Milano). Hanno scelto i testi, li hanno provati e riprovati, si sono procurati i costumi e grandi fondali dipinti per loro da un amico scenografo della Scala e debuttano in un teatro normale: il teatro di «persona», e lei, la mia mamma, diventa la prima attrice. Un’attrice che di giorno tirava su i figli, li aiutava a studiare, si occupava della casa, teneva l’amministrazione della compagnia come fosse quella di un normale ménage familiare. E alla sera, salendo sul palcoscenico, eccola trasformarsi in Giulietta e Tosca, e la Suora Bianca dei Figli di nessuno, e la Fantina dei Miserabili, tutti ruoli che via via anche noi figlie e cugine, una appresso all’altra, avremmo poi interpretato. Mi vedo a percorrere l’apprendistato dei teatranti interpretando tutti i ruoli che crescendo erano adatti alla mia età, maschili o femminili che fossero.",1.2033843839308247,0.0006312434561550617,0.00046371284406632185,1.659916648577564e-07,8.530320883437525e-06,0.022977370768785477,0.0008626077906228602,0.011508148163557053,2.0744615540024824e-05,5.848789008666699e-09,0.000626334105618298,0.006903838831931353,4.2868056326916815e-11,1.2073260791112261e-07,2.954649025443956e-11,0.005060331895947456,0.005139611195772886,6.52826638543047e-05,0.027585282921791077,0.007937993854284286
"Ero disperata perché non avevo seni. Allora ho chiesto a mia madre: «Mamma, perché non ho i seni?!» E lei: «Eh, perché, come dire, insomma, la natura certe volte, cioè, ecco... però stai tranquilla: alla fine tutto si equilibra... almeno spero!» A dir la verità non è stato un gran dialogo! Poi mi fa: «Prega santa Rita da Cascia che è la santa degli impossibili!» Io ho pregato che non sapete quanto... evidentemente con non sufficiente intensità, e mi è spuntato un seno, uno solo, ma bello, una pera... una bella pera William... Di qua niente! La mia mamma mi metteva il reggiseno e mi imbottiva con i fazzoletti la parte mancante. Quelle due sporgenze sul petto mi facevano sentire proprio quasi una donna! Ero anche meno imbarazzata coi corteggiamenti dei maschi, tanto che spesso quelli prendevano coraggio. Uno di quei moscardini arrivò perfino a mettermi una mano sul seno: gli arrivò un «lavadenti» da knock out.«Cretino, come ti permetti?» Non ero arrabbiata tanto per il gesto, quanto per il fatto che mi aveva toccato il seno sbagliato! Quello imbottito di pezza! Finalmente mi è spuntato anche il mancante... rotondo! Avevo una bella pera William e una mela regina.«Mamma, perché ho una pera William e una mela regina?!» Mia madre mi tranquillizzava: «Avere i seni tutt’e due quasi identici è indice di una mancanza di originalità, di un’indole banale».«Ah sì?»«E poi lo dice anche una canzone: ""La mia morosa è di Villafranca, c’ha una tettina nera e un’altra bianca, un pirolino a punta e l’altro tondo, la mia morosa è bella un finimondo!""»«Be’, allora brindiamo!»",1.2295664730481803,0.622459352016449,0.13296423852443695,0.622459352016449,0.7310585379600525,0.9324532747268677,0.29421496391296387,0.2018132209777832,0.10669060051441193,0.18242552876472473,0.46879062056541443,0.2018132209777832,0.4378235340118408,0.037326887249946594,0.060086652636528015,0.4843800365924835,0.01798621006309986,0.22270013391971588,0.531209409236908,0.7310585379600525
"A un certo punto della mia vita mi sono accorta che il lavoro di attrice non mi faceva impazzire, che non lo amavo poi così tanto. La gente non ci crede, pensano che siano bugie. Invece è vero, non avrei mai scelto questa professione, che richiede un tipo di carattere che io non ho: presenzialismo, arroganza e buoni gomiti. Quando mi sono accorta che non amavo questo mestiere, era troppo tardi, ero già sposata con Dario e avevamo la nostra compagnia. Se non fossi stata indirizzata a questa professione dalla mia famiglia, mi sarei impegnata nel sociale, avrei potuto anche essere un avvocato o un medico.",0.8311082860454917,0.011508148163557053,3.4455617026196705e-08,5.503004718576676e-10,1.5563047384148376e-07,0.004007289186120033,4.8550673897862495e-11,0.24508501589298248,4.139319553786436e-09,7.114706740418697e-11,5.80500284286245e-07,0.00012243441597092897,4.7550319237643635e-09,8.988284783129075e-09,2.0267051925593194e-11,0.0010322310263291001,1.9518843485943904e-10,1.1818392522400245e-06,0.14033624529838562,0.0021657671313732862
"Il cinema mi annoiava a morte. La mattina presto ti alzavi, ti venivano a prendere alle cinque, alle sei e dieci eri già pronta, alle undici e un quarto si presentava finalmente il regista. Non si butta via il tempo così. Non lo rimpiango, il cinema. In teatro, il tuo pubblico è lì davanti.",0.8468277310021222,5.023811127102817e-07,3.625517108751808e-10,5.332393415713454e-10,2.555908906742843e-07,8.853436156641692e-05,3.6180011764308517e-10,1.1669788468893216e-09,1.0407800488110297e-07,6.942876273896559e-10,1.0580450293673493e-08,4.331903619458899e-05,1.5130016683961856e-10,1.2153600348341342e-10,2.0265815067754822e-11,0.0003006163169629872,1.740922822568436e-10,1.0864759047990447e-07,0.037326887249946594,0.6513549089431763
"Le minacce le ho ricevute io, quando ero già senatrice. Frasi terribili, come «spaccarti tutti i denti a bastonate». Ho avuto molta paura, anche perché avevo settantasette anni e tornavo a casa da sola alle tre di notte, dopo ore di riunione alla Commissione Bilancio (che Dio l’abbia in gloria).",0.8964371590409428,1.8858878902960896e-09,0.0004728544445242733,8.494599512687273e-08,1.2095060064609697e-08,0.08269733935594559,1.599447045919078e-07,5.082273801804149e-08,8.003491619446024e-11,0.0003889921063091606,6.280623243704042e-11,6.04891829425469e-06,0.7981867790222168,3.589285979543888e-09,6.570769102431928e-12,0.1127954050898552,2.2333288995923795e-08,9.518146981690734e-08,0.9399133324623108,2.9434666509731144e-11
"Se dovessi rinascere, ma spero proprio che non mi succeda, non cambierei una sola virgola di quanto ho fatto nella mia vita. Con Dario ho vissuto una vita esageratamente felice, l’unica cosa che all’inizio mi disturbava era la sgradevole sensazione di essere trasparente, specialmente con le altre donne. Quante volte arrivavano in Palazzina Liberty le famose femministe, leaderine del movimento, quelle che sanno tutto, che ti parlano dall’alto in basso. Entravano, magari vedevano che stavo pulendo il grande locale con una scopa (ruolo insolito per una prima attrice), non è che se ne accorgessero e dicessero almeno: «Ciao». No, mi chiedevano solo: «Dov’è Dario?». «La peggior nemica della donna... è la donna». Non c’è commedia dove non abbia ribadito il concetto.",0.8568401370430365,2.526131481772609e-07,9.878664553042427e-10,1.1726908333287156e-09,4.974249279143805e-08,0.029760092496871948,4.281265272854107e-11,1.3287156097607777e-10,2.799830089994515e-10,1.1725874438095474e-10,2.1439001329781604e-07,0.005469274241477251,4.176484225126842e-08,0.017176708206534386,3.3473408073136923e-11,0.01590639166533947,0.2568320035934448,4.339894076110795e-06,0.3073579967021942,0.7772998809814453
"Quando prese il premio Nobel, Marta Marzotto m’inviò un cesto con cinquecento rose rosse. Il biglietto d’accompagnamento diceva: «Dietro a un grande uomo c’è sempre una grande donna». L’ho chiamata al telefono per ringraziarla, ma le ho anche detto: «Marta, non mettermi dietro, mi fa impressione, è come se arrancassi per tenere il suo passo. Ponimi al fianco. Mi troverei meglio». È strano che una donna intelligente e spiritosa come lei sia caduta in tanta banalità.",0.8911991469794884,6.229333666851744e-05,2.669937160248992e-09,2.1291790552879775e-09,5.692723448191828e-07,7.120403097360395e-06,1.652145087405188e-09,1.3839996704234636e-08,7.093026860305329e-11,2.2518219233713666e-10,3.7110158501718615e-08,1.81622237960255e-06,2.8564709708689406e-08,1.2411496754793916e-05,8.272314389046187e-09,0.00012731103925034404,2.5162830752378795e-07,1.0727698196433266e-07,0.008577484637498856,4.1604830691710504e-10
"Di Pietro mi contattò per chiedermi se volevo candidarmi alle elezioni nazionali del 2006. Avevo tanti impegni, tante cose da fare, mi sembrava una follia, e glielo dissi. Ma lui fece girare la notizia e la gente cominciò a telefonare. «Devi andare, devi andare», mi dicevano. Alla fine mi candidai nella lista dell’Italia dei Valori. Presi quasi cinquecentomila voti, che sono tanti. Proprio per rispetto verso i miei elettori, e per un senso di responsabilità, sono rimasta in Senato più a lungo di quanto avrei voluto. Se fosse stato per me, avrei dato le dimissioni almeno sette mesi prima che cadesse il governo. (...) I diciannove mesi più brutti della mia vita. È stato un periodo di grande solitudine, ero circondata da persone asociali. La Finocchiaro mi ha salutata soltanto dopo un anno. Pensavo sempre: «Non sono quella che arriva dalla Sicilia e si chiama Luisa Rovigotti. Ho recitato nei teatri di tutta Italia, non puoi fare finta di non conoscermi!». Era la decana dell’Unione e, come donna, avrebbe dovuto prendere noi povere femmine disgraziate, che non sapevamo niente, e affidarci a qualcuno che ci insegnasse qualche cosa. La Finocchiaro passava davanti a me come se fossi trasparente, poi quando ha avuto bisogno di me: «Francuzza, Francuzza». In quel Senato ho fatto l’inimmaginabile.",1.1435192920034751,1.2002726634818828e-07,3.667134096385638e-10,1.2702189167157485e-07,9.98806459762136e-09,0.09534945338964462,7.394665146875923e-08,9.9963304300843e-10,2.177916458290241e-10,7.091079806675893e-11,6.1202208598842844e-06,0.13296423852443695,0.9099069833755493,1.3705497181604187e-08,2.948254140822115e-11,0.05033063143491745,0.0003150386910419911,8.3653303590836e-06,0.9688562154769897,0.04742587357759476
"Ovviamente hai appoggiato le campagne per il divorzio e per l’aborto. Scherziamo, il divorzio e l’aborto. Certo, ne abbiamo fatte di tutti i colori.",0.8388920689467341,1.6309934380842606e-07,8.439931913073462e-12,5.4198205923228215e-09,2.505963214716189e-10,1.6767746302548403e-08,3.406425321372808e-06,5.926406920764293e-09,3.791761002402971e-11,1.5279844056692582e-09,5.513697484693658e-11,4.0210085217040614e-07,5.173918452783255e-06,1.5974090938897234e-09,3.513485726316934e-12,4.1335399146191776e-05,1.597647703022176e-08,1.1312435432841994e-08,5.326969585439656e-07,1.3517374997107368e-09
"Non ho mai studiato “l’arte della recitazione”, e quando sento “l’arte della recitazione”, già il termine mi innervosisce. Sono nata in una famiglia di attori. Sono andata in scena a otto giorni in braccio alla mia mamma. Quella sera non parlavo tanto... [...] Recitavamo a soggetto, seguendo il canovaccio. Gli attori tradizionali, quando venivano nella nostra compagnia, erano costretti a stare molto attenti, qualcuno già alle prove se ne andava dicendo: «Scusate ma ho sempre recitato seguendo un testo scritto. Con voi non so mai quando tocchi a me dire la mia battuta. Non ce la faccio». Peccato, se fossero rimasti con noi avrebbero fatto un’esperienza in grado di cambiargli la vita.",0.8959396120626479,1.3184366025598138e-06,0.006589771714061499,8.982556920500429e-10,7.252717182382185e-07,0.23370636999607086,2.4746524274199544e-10,0.14033624529838562,0.027585282921791077,7.105376009786113e-11,2.600846471523255e-08,0.00013765462790615857,3.7933812341295337e-11,2.6074685813282095e-11,1.0848833983945205e-11,0.004982269834727049,2.953116570725278e-11,2.453558408888057e-06,0.4532618522644043,0.14804719388484955
"Lo sfruttamento era dappertutto, anche all’interno della famiglia. Il femminismo, se inteso nel suo vero significato, è un concetto molto alto, di un valore inestimabile. Le cosiddette femministe, leaderine di allora, si rivolgevano alle donne modeste, alle operaie, con un linguaggio altisonante e privo di senso, imbevuto di ideologie. Io, invece, cercai di mettere in atto la mia concezione di femminismo portando i nostri spettacoli nelle fabbriche. Dopo ogni rappresentazione, come ad esempio Legami pure che tanto io spacco tutto lo stesso, si discuteva, e l’operaia capiva. Capiva, se usavi il giusto linguaggio, altrimenti era come fare un buco nell’acqua.",0.8666117229731753,9.66610878094798e-06,7.067962187745636e-11,1.5182746726516427e-10,3.875090897054179e-06,0.0019418168812990189,2.6067027647513896e-06,0.006692850962281227,2.8134058971396314e-10,3.34764715947955e-11,1.9920834426478962e-10,5.275964213069528e-06,1.0677027830752195e-06,6.879137259829804e-08,6.301742461189974e-11,0.018546566367149353,8.092757343547419e-05,8.332717698067427e-06,0.005179712548851967,0.011687257327139378
"Gli attori che conosco fanno una cosa bizzarra: prima di andare in scena mi vengono a toccare le mani, perché sono talmente emozionati che hanno le mani gelate, o sudate. Un attore non lo confesserebbe mai, però è proprio così. Non riescono a spiegarsi come mai a me questo non capiti. Io non ho mai le mani sudate, non ho mai le mani fredde, perché questo è il mio lavoro. Ti sembrerà un po’ greve, ma è come se il salumiere, affettando il prosciutto, provasse una grande emozione. L’ha fatto tante volte, è nato tagliando il prosciutto. E io sono nata in teatro. È lì che ho accumulato il bagaglio, che mi ha poi permesso di interpretare tutti i ruoli.",0.8480473980307579,1.2629850516532315e-06,3.7822262682896124e-11,0.00010889690747717395,1.392546664646943e-06,0.009708477184176445,2.5970852204904027e-11,1.511432645706634e-10,5.614587195168497e-08,5.522706944538491e-11,5.53823445437196e-11,0.00019871552649419755,1.785507158791333e-11,1.5784719017974957e-11,3.7892161630637133e-11,0.010169658809900284,4.2983332171342425e-11,7.920139978523366e-06,0.29421496391296387,0.9953904151916504
"A me succede così: come vedo una persona, dopo sette minuti capisco se mi fregherà o meno. Così come, quando leggo un testo teatrale, sento subito dove sta l’errore. Addirittura sui miei copioni scrivo: «Risata, qui ci deve essere una risata». E la risata arriva. Sarà il DNA. Sarà che ho passato la vita a recitare. Recitavo già nel ventre di mia madre.",0.8377927429974079,4.1237978365415984e-08,3.801957706994763e-11,1.0069397831102833e-06,2.4432692313780535e-08,0.0029810327105224133,2.9456458106036365e-11,4.2803412725334056e-07,5.7598276725912e-07,3.340656223871363e-11,2.0333584815901418e-10,7.9673009167891e-05,4.9128964785261076e-11,6.798992302492479e-08,1.0802887118188664e-06,0.00032503585680387914,5.539172320823127e-07,4.298194107832387e-05,0.007518718484789133,0.2018132209777832
"Con Lo svitato abbiamo commesso un grandissimo errore. D’altro canto, non avevamo i mezzi per fare di meglio. Avremmo dovuto ritirarlo e girare di nuovo le scene, mancava il ritmo. Il pubblico di allora non poteva apprezzare un film del genere. Adesso, invece, lo guardi e dici: «Ah, che bel film». Carlo Lizzani, poi, non era un regista da film comico. E un mio caro amico, ho ammirazione per lui, ma non era il suo genere di film. Si sono messi in sei a scrivere Lo svitato (forse un po’ troppi), con il povero Dario [Fo] che cercava di intervenire ma veniva zittito: «Questo non è teatro, noi stiamo facendo un film». Dario e io non abbiamo avuto la forza di ritirarlo o di rifare le scene.",0.8663801640504971,1.9217794999804028e-07,3.258432967889746e-10,6.287101506075032e-09,1.9233706183285904e-08,8.716188312973827e-05,1.8691570513595934e-09,8.022259939677312e-11,3.334544793065497e-11,1.3631345609610435e-05,9.461262379772961e-05,2.5957717753044562e-08,2.8925342121510766e-09,1.1142491374016572e-08,2.7367856245130717e-12,0.016914913430809975,2.2944913330436023e-11,0.0002591582597233355,0.29421496391296387,1.4964246508597512e-10
"Io non porto rancore a Dario [Fo], perché alla base c’è il mio più grande difetto: quello di non avere ambizione. Non è che Dario abbia mai pensato: «Franca mi dà delle idee e io faccio il furbone!». No, non gli è proprio venuto in mente. Se non fossi stata sua moglie, se fossi stata un’altra, avrebbe dovuto, per forza di cose, mettere anche il mio nome come autrice. Einaudi ha pubblicato numerosi testi di Dario curati da me e inizialmente non figurava neanche la dicitura «a cura di Franca Rame». Quando chiesi a Roberto Cerati la spiegazione di questo, mi rispose: «Non ci avevamo pensato». Il guaio è che sono la moglie, e la moglie, talvolta, è un mobile di casa, un quadro alla parete, qualcosa che ti sta vicino ma che non vedi. Conosco centinaia di sfoghi di donne sull’argomento. Se dovessi rinascere, ma spero proprio che non mi succeda, non cambierei una sola virgola di quanto ho fatto nella mia vita. Con Dario ho vissuto una vita esageratamente felice, l’unica cosa che all’inizio mi disturbava era la sgradevole sensazione di essere trasparente, specialmente con le altre donne. Quante volte arrivavano in Palazzina Liberty le famose femministe, leaderine del movimento, quelle che sanno tutto, che ti parlano dall’alto in basso. Entravano, magari vedevano che stavo pulendo il grande locale con una scopa (ruolo insolito per una prima attrice), non è che se ne accorgessero e dicessero almeno: «Ciao». No, mi chiedevano solo: «Dov'è Dario?». «La peggior nemica della donna... è la donna». Non c'è commedia dove non abbia ribadito il concetto.",1.20161485101562,0.00022782185988035053,0.0002401553647359833,5.436533001557109e-08,4.710908797278535e-06,0.06371499598026276,9.07343644662717e-11,0.0427221953868866,1.0279197631968273e-10,1.333427535055165e-10,0.0003951153776142746,0.01912403479218483,1.6515401268790697e-09,0.1919327825307846,3.345502694318547e-11,0.17328819632530212,0.29421496391296387,0.00021995337738189846,0.9099069833755493,0.008061991073191166
