"[...] con i soldi guadagnati  un milione di lire , mammina, Maria e io ci trasferimmo in un appartamento più grande in via Balzani e io potei finalmente riscattare l’onore di mia sorella. Mio padre, se mai per un attimo c’era stato, era definitivamente sparito dalla mia vita, non cercavo più di amarlo. Proprio per questo non mi fu diffìcile girargli il cachet di Aida ottenendone in cambio un cognome: per me un guscio vuoto, per mia sorella la salvezza. Maria Villani divenne Maria Scicolone e potè finalmente voltare pagina, tornare a scuola, incominciare a vivere. Inutile forse soffermarsi sul seguito della triste vicenda. Io, comunque, ero salva. Con i miei mezzi, come potevo, avevo ri percorso la nostra storia famigliare, per capire ciò che da bambina mi appariva troppo grande da affrontare. Ed ero arrivata alle mie conclusioni. Non tutti gli uomini erano come Riccardo Scicolone, non tutte le vicende dovevano per forza ripetersi. Al mio fianco volevo una persona diversa, che potesse rendermi davvero felice. Ancora non lo sapevo con certezza, ma la vita presto mi avrebbe dimostrato che io, il mio uomo ideale, l’avevo già incontrato.",1.0659151769941673,0.562176525592804,0.00017298903549090028,8.762939707196438e-09,1.1253515452835927e-07,0.010328153148293495,5.92841664648347e-10,0.034618835896253586,0.00457386439666152,1.1681584866085615e-10,2.178264912799932e-05,0.018264278769493103,4.85958842610934e-11,0.04023794084787369,1.2278061380099903e-11,0.009412589482963085,8.597225132689346e-06,7.997863576747477e-06,0.2120688259601593,0.0012351677287369967
"Fu durante le riprese di Una giornata particolare che Riccardo Scicolone morì. Una mattina, mia sorella mi telefonò sul set, in lacrime: «Sofì’, vieni subito, papà sta male». Corsi all’ospedale e intorno al suo letto trovai le donne della sua vita. Mammina, Maria, la sua ultima compagna tedesca. Mi avvicinai e gli strinsi la mano. Lui mi fissava. E io sostenevo il suo sguardo, come paralizzata. Gli sorrisi, poi mi allontanai verso la finestra dove c’era Maria che piangeva. Guardai fuori. Visti dall’alto, macchine, passanti, biciclette sembravano nient’altro che giocattoli. Cercai di piangere anch’io ma non ne fui capace.",0.8717410640092567,4.466938818836752e-09,9.090411062784298e-11,5.755035090260208e-06,5.9673518990166485e-05,0.003429603995755315,5.236441280587201e-10,0.042087726294994354,1.4955230109858775e-10,9.87806059171703e-10,4.7206227463902906e-05,6.761842087144032e-05,3.789909705509409e-11,2.7961726800640463e-07,4.6267727427107275e-09,0.005641908384859562,0.01912403479218483,2.1275297967804363e-06,0.5774953961372375,3.060350639572107e-09
"Carlo [Ponti ndr.] aveva saputo che Stanley Kramer, il produttore di Mezzogiorno di fuoco, era in Spagna, dove si stava preparando a girare un dramma in costume sulle guerre napoleoniche. All’inizio, dovevano esserci Brando e la Gardner. Ma Marlon si era tirato indietro, era subentrato Sinatra, che però era in rotta con Ava... insomma, il solito pasticcio hollywoodiano. L’unica certezza era Cary Grant, il quale, tuttavia, per contratto aveva il diritto di approvazione dei partner e non si sarebbe certo accontentato di avere a fianco una quasi sconosciuta, per di più italiana. Carlo, come al solito, non si fece scoraggiare: diede un colpo di telefono a Kramer e lo invitò a Roma per mostrargli La donna del fiume. E il regista, appena finita la proiezione, lo anticipò, prendendolo di sorpresa. «Cosa ne dice di duecentomila dollari per Miss Loren? Penso che sarebbe perfetta per la parte.» Carlo non si scompose, lasciò passare una manciata di secondi e poi replicò fìngendo un certo distacco: «Interessante, mi ci lasci pensare, devo verificare i suoi prossimi impegni, ma in linea di massima direi di sì, si può fare». «È stata la decisione più facile della mia vita» commentò quella sera aspettando che Stanley ci raggiungesse per cena. Era un cachet da star. Ora si trattava di guadagnarselo.",1.1154640440363437,1.9145697933709016e-06,1.3707541768326337e-07,3.0590220490012143e-07,5.4999168414004984e-11,0.0027791904285550117,4.405445110933215e-07,1.49866397070042e-10,1.3202275384038842e-10,1.3280669619586405e-10,2.0238930323324134e-11,0.004133968148380518,1.3227076378630187e-10,9.701137315687447e-08,2.023476178281136e-11,0.1127954050898552,2.278052306792233e-06,0.0001713081874186173,0.02161533385515213,0.007345826830714941
"La prima a credere in me per Peccato che sia una canaglia fu Suso Cecchi D’Amico, l’unica donna nel parterre dei grandi sceneggiatori dell’epoca. «La quercia che ha fatto fiorire tra i suoi rami tanto cinema italiano» come la definisce Lina Wertmüeller. Leggendo i Racconti Romani di Moravia, Suso si era imbattuta in una bella vicenda che stava proprio all’inizio della novella Il fanatico.Ricordo che ci incontrammo un giorno sul treno. Dopo aver mi intravisto alla stazione, venne nel mio scompartimento e si sedette accanto a me, con una confidenza che mi mise subito a mio agio.«Ho in mente un soggetto che fa per te» disse semplicemente, guardandomi dritta negli occhi.«Perché no?!» replicai subito con il mio solito slancio. Suso aveva lavorato alla storia con Flaiano, Moravia e Continenza, e l’avevano proposta a Blasetti, che all’epoca cercava il soggetto per un film. La prima scelta della produzione era stata la LoIlo, che allora era considerata la numero uno. Ma Suso mi aveva visto a Cinecittà, mentre lavoravo con Bolognini a Ci troviamo in galleria, ed era rimasta colpita dalla mia allegria. Nel film ballavo il mambo, che avrei continuato a ballare nella Donna del fiume e in Pane, amore e..., con il mio sfavillante vestito rosso.Dopo quel nostro breve incontro ferroviario Suso, appoggiata da Flaiano e dallo stesso Blasetti, insistette con i produttori finoa ottenere la parte per me.",1.1186371740186587,0.00040290519245900214,2.4664909004101787e-10,2.8158875231554248e-09,1.503657615087306e-10,0.06754669547080994,2.344511784713177e-08,4.857957092152532e-11,1.164341401072022e-10,1.325354270775847e-10,5.5022254114023283e-11,0.002822832902893424,4.285431731698708e-11,2.295919102834887e-06,1.785302808365863e-11,0.3345894515514374,2.616520475839934e-07,0.000159678646014072,0.028870904818177223,0.9099069833755493
"“Fiducia” sembra quasi una parola d’ordine. Con il tempo imparai che la vera sfida nel nostro mestiere, e forse non solo nel nostro, sta nel trasformare la fiducia degli altri in autostima. E lì che comincia l’esperienza, nel momento in cui impari a credere in te stessa, a far tesoro dei tuoi successi e dei tuoi errori.",0.8632362140342593,5.084292570245452e-05,1.0832539726335355e-11,1.0050166254771398e-09,0.027585282921791077,3.6397807434696006e-07,1.575049465851741e-11,6.184174283774269e-10,2.8358179693377394e-10,3.79419169693751e-11,6.27985649592766e-11,0.0005442132824100554,6.342603331432883e-09,5.8840377903379704e-08,3.293222639033644e-10,0.0010649627074599266,5.896417860640213e-07,1.5446310499100946e-05,0.07159119844436646,1.5779617115185829e-06
"In Peccato che sia una canaglia, io e Marcello [Mastroianni] ci incontrammo per la prima volta in uno splendido bianco e nero e ci innamorammo subito l’uno dell’altra. Cinematograficamente, s’intende. Ricordo ancora la prima volta che lo vidi. Stavo sulla scala del palazzo in cui avremmo girato e lui, da qualche piano più su, mi guardava. «Ciao» mi salutò come fosse per aria. «Ciao» risposi, timida ed emozionata.La nostra fu una sintonia immediata, che rimase intatta sino alla fine, senza mai un’incrinatura. In quel primo set im parammo a conoscerci sullo sfondo della Roma allegra e luminosa del Dopoguerra, dove la gente aveva ripreso a viaggiare, ad andare al mare, a fare il bagno, ad amarsi e a divertirsi. Stavamo bene insieme, Marcello e io. Che coppia! Semplice, bella, vera.",0.8908575470559299,3.644819723813697e-10,6.725981438471251e-10,4.6484416316161514e-10,2.8168423149566024e-10,0.004905405919998884,0.03308597952127457,4.2857915133476254e-11,1.1647144360082962e-10,4.6314499457800196e-10,7.083076486447126e-11,4.888302669314726e-07,2.5985319798693673e-11,0.008577484637498856,9.551627717929723e-12,0.03622005507349968,2.7712916406130716e-08,7.426380761899054e-05,0.8670357465744019,0.977022647857666
"Mi diedero una cella singola  che aveva, come sottolineò il presidente della Repubblica Pertini, perfino il lusso del televisore  e mi consigliarono di non frequentare le altre detenute: mi trovavo infatti in una situazione delicata che poteva diventare pericolosa. Cercai comunque di trasmettere a quelle ragazze sfortunate affetto, gentilezza, speranza, e quando uscii le salutai una per una. Avevo provato in prima persona, anche se per poco, ciò che alcune di loro avrebbero dovuto vivere per anni e, con l’aiuto delle nove splendide suore che si occupavano di noi, volli che sapessero che non le avrei mai dimenticate. E così è stato. In carcere scoprii che il tempo cambia passo, si gonfia di pensieri bui, diventa amaro. Cercavo di addomesticarlo leggendo, osservando, talvolta cucinando. E soprattutto scrivendo.",0.886687892023474,1.9869530660798773e-06,1.319472309191383e-10,1.8914210198062165e-09,0.46879062056541443,0.002199798123911023,2.7893545961887867e-07,9.114856786007763e-11,1.0285708396118309e-10,6.601707180919902e-09,0.016914913430809975,0.02262919954955578,7.71817809663844e-09,4.537282993766212e-09,2.6688529032981023e-05,0.007815888151526451,0.0017961491830646992,0.32082128524780273,0.9820137619972229,3.187812236404852e-10
"Oggi, rispetto ai miei tempi, le donne probabilmente sono più fortunate, vengono giudicate sulla base di quello che sanno fare più che sul loro aspetto. Ma, aumentando la possibilità di scegliere, aumentano anche le difficoltà nel bilanciare famiglia e lavoro. Il mondo è più complesso, più esigente, e richiede alle ragazze grandi sacrifìci, proporzionati alle soddisfazioni. Eppure, alla fine, si torna sempre allo stesso punto e ognuna di noi fa i conti con se stessa. [...] L’ho detto tante volte, e lo ripeto anche oggi: sono loro, i miei figli, i miei film migliori. Ed è la loro felicità il premio che mi onora di più.",0.8525386109249666,0.0005976693937554955,8.153237018859727e-08,4.703523126536879e-10,2.8240274332347326e-06,8.463937774649821e-06,3.6246319834454255e-10,0.2120688259601593,6.891557102761681e-09,5.307211559113512e-09,4.1480308965446966e-08,0.00048029719619080424,5.032133376658976e-09,1.156202356078495e-09,1.3482401306497138e-10,0.0036499870475381613,0.01590639166533947,1.3871175497115473e-06,0.08509904146194458,0.9399133324623108
"Lombardo era stato il responsabile del mio battesimo artistico. “Lazzaro” non gli piaceva, e tanto meno “Scicolone”. Gli serviva un cognome corto, facile da pronunciare, che avesse una certa qual allure. Fu così che, fissando un manifesto appeso alle sue spalle in cui campeggiava la bella attrice svedese Marta Torén, fece un giro dell’alfabeto fino a fermarsialla “elle”: «Soren, Toren, Loren... Sì, ci siamo: Sofia Loren!». Già che mi stava ribattezzando, sostituì la “effe” di Sofia con il “ph”, et voilà, un nome da star internazionale. Peccato che a Pozzuoli mi avrebbero chiamato per sempre “Sopìa”, non capendo il perché di questo inutile cambiamento.",0.8616146390559152,1.1251530818157107e-09,2.501378826291756e-10,1.0298428776422952e-10,2.503517115837184e-10,0.00482972152531147,1.165914725875794e-10,2.7070949926155663e-08,0.02595735713839531,6.245264028148512e-11,5.460180640959322e-10,3.1627594125893665e-06,3.7839582162080276e-11,3.421577909890061e-09,3.9840964728699024e-12,0.003172682598233223,1.0429696430946933e-06,5.150486686034128e-07,0.00043224150431342423,1.116759790420474e-06
"Mi presentai, tutta trafelata, all’indirizzo che Ponti mi aveva dato e mi trovai di fronte a un comando dei carabinieri. Mi caddero le braccia: l’istintiva diffidenza, che forse mi aveva instillato proprio mammina, mi fece subito pensare a un brutto scherzo. “Ecco qua, mi ha preso in giro. Quello fa il produttore come io la ballerina!” Sentivo montare la rabbia mista a un senso amaro di umiliazione. “Come ho potuto credergli! Stupida stupida stupida!” Il pensiero corse subito a mio padre, e ai mezzucci con cui aveva attirato Romilda nelle sue spire. Grazie al cielo, però, non sempre le storie devono ripetersi uguali, e la mia era tutta ancora da scrivere. Ci pensò il giovane carabiniere di leva a rassicurarmi. «Se cerca la casa di produzione PontiDe Laurentiis, è il portone a fianco.» Mi sentii sciocca e infantile, ringraziai con un grande sorriso e mi apprestai a entrare nel cuore del cinema italiano. Di lì a qualche giorno avrei compiuto diciassette anni.",1.0119508060161024,3.147490934551911e-09,4.103917490283493e-06,6.569551569413079e-09,4.119157459570033e-09,0.00034870431409217417,4.629895078434032e-10,0.020023440942168236,1.365612320114451e-06,1.6983901784950461e-10,1.4314229801470901e-08,0.00023050670279189944,3.337497639366305e-11,2.6890529625234194e-07,5.7934651000179915e-12,0.0030278346966952085,1.1544620974746067e-06,0.0022170129232108593,0.9626730680465698,0.002199798123911023
"Durante le riprese, Carlo mi chiamò per darmi una brutta notizia. Ero in albergo, avevamo finito da poco di girare. «Sophia...» «Che c’è? Perché quella voce?» ...... è morta Marilyn, si è saputo ora. Barbiturici. Parlano di suicidio.»Rimasi muta, appesa al telefono, senza sapere cosa dire, tanto che Carlo si inquietò. Sapeva bene che dietro quella mia facciata rigorosa e determinata si nascondeva una donna emotiva. «Sophia, ci sei?»«Sì, sì, come no, dove vuoi che vada...»Quella morte così precoce, così ambigua, mi turbò nell’intimo e mi fece molto riflettere. Mi lasciai invadere da mille immagini vorticose e confuse. Pensai al senso della bellezza, alla solitudine, al bisogno di sentirsi amati che è nel cuore di ognuno di noi. Rividi quel suo sorriso seducente, velato di nostalgia. Non basta essere la donna più bella del mondo per essere felice. Marilyn era una grande attrice, rimasta schiacciata dal peso del proprio talento, da uomini che le avevano chiesto tutto senza dare niente in cambio, o che avevano preteso di trasformarla secondo i loro gusti. Non era riuscita a trovare la sua strada. Sentii un brivido, come se un’ombra si posasse tutto intorno. Il nostro è un mondo crudele, che si alimenta, si accontenta dell’apparenza e raramente si chiede che cosa ci sia sotto. Per questo sta a noi tenere la favola ancorata alla vita, per non di menticarci chi siamo, da dove veniamo. II fascino di Marilyn aveva finito per distruggerla riducendola a un sex Symbol senza gioia.",1.1905135749839246,0.0004765612829942256,1.1060710125576634e-09,1.1199186701560393e-05,0.005220125429332256,7.311254739761353e-05,1.7390528128657934e-08,1.4463132913533627e-09,9.99877181051545e-10,1.4949297355570934e-10,0.4843800365924835,0.11920291930437088,6.23574247793357e-11,0.00039821304380893707,1.1748081674145538e-10,0.1561049073934555,0.000337979436153546,0.00015843621804378927,0.9840936064720154,0.9755768775939941
"Sogno che mi trovo su una spiaggia, al tramonto, e il mare è calmissimo, immenso, liscio, simile a uno sterminato raso azzurro. Il sole è rosso come il fuoco e sta andando giù. Io a un tratto mi metto a correre sulla spiaggia e corro corro corro. Poi, sempre correndo, mi sveglio. Moravia lo legge così, «alla maniera dei maghi caldei che in terpretano i sogni di Nabucodonosor»: il mare è la normalità, che cerco invano di raggiungere. Il sole è il mio successo. Io potrei star ferma a guardare la tranquillità del mare e invece voglio rincorrere il mio sole. E, come tutti quelli che vogliono raggiungere il sole, ho da percorrere molta strada, ma lo faccio perché quel sole, pur essendo lontano, mi conforta e mi illumina nella mia corsa.",0.8887768549611792,0.02931223064661026,2.2062468518768696e-10,2.578472049208358e-07,0.07159119844436646,0.0005484792054630816,1.165968155358854e-10,1.5154971721997867e-10,5.5708952118038724e-08,8.90963303135095e-09,0.04672495648264885,0.0019267346942797303,2.212375171950498e-09,1.2289182222957606e-06,0.09009299427270889,0.020332353189587593,3.632678442500037e-07,0.00010720880527514964,0.6926419734954834,1.7305878952100784e-09
"Quando, alla fine del febbraio 1962, era arrivata la nomination, non ci volevo credere. «L’Oscar? Il Premio Oscar?» Rileggevo i nomi delle altre candidate, mi passavano davanti Audrey Hepburn e Natalie Wood, Piper Laude e Geraldine Page, e tra me e me dicevo: “Ma che, scherziamo? In più La ciociara è un film italiano, recitato in italiano, quando mai si è visto?”. Eppure, ero lusingata all’idea, mi faceva sentire bene, mi illudevo che essere arrivata a tanto potesse bastarmi. Dentro di me, però, sapevo che non era vero, ogni gradino che salivo, sotto sotto, mi faceva sognare sempre più la vittoria. Forse stavo osando troppo, ma non c’era niente da fare. La speranza e l’ambizione erano parte di me, anche se sapevo che la delusione stava dietro l’angolo e il trionfo era destinato a pochi. Dopo molto tergiversare, avevo deciso di non andare alla pre miazione. Se avessi perso, sarei svenuta. E se avessi vinto, sarei svenuta lo stesso. Non potevo permettermelo, davanti a quella platea, sotto lo sguardo del mondo intero. “Me ne sto a Roma, sul mio divano”, così mi ero detta, e così feci.",1.1039636259665713,0.006241259165108204,0.0009110511746257544,5.142182502027026e-08,1.1499611218823702e-06,0.01342825498431921,2.3135856963563128e-07,1.0168634823060074e-09,2.7961158388656315e-10,1.9307934417955863e-10,3.3428158019432885e-08,0.009708477184176445,5.504114872212362e-11,3.7053826673627555e-10,2.9484338581742264e-11,0.006003595422953367,2.069838274110225e-07,9.496346820014878e-07,0.9859364032745361,0.10669060051441193
"Fu Vittorio [De Sica], ancora una volta, a guidarmi in questa avventura: «Cesira è una mamma a tutto tondo. È umile, ha sempre lavorato e vive per la figlia. Il suo approccio alle cose è semplice e diretto. Hai già provato tutto questo sulla tua pelle, Sofì’. Sai benissimo di cosa stiamo parlando. Reciterai senza trucco, e senza trucchi. Sii te stessa, diventa tua madre, e andrà tutto bene». Dopo tanti anni di Hollywood, La ciociara mi riportava a casa, alla durezza della mia infanzia. La guerra, che era rimasta a lungo sepolta dentro di me, ora tornava fuori per dare voce a questa donna ferita, alla sua sofferenza, al suo coraggio. Pensavo a mammina, a come aveva combattuto per difenderci, per procurarci l’acqua e il cibo. A come si doveva sentire quelle notti in cui i soldati marocchini accampati nell’androne bussavano ubriachi alla nostra porta. A come sorvegliava in silenzio, senza farsi notare, i giovani marines americani che venivano nel nostro salotto a bere il brandy. Perché sapeva che il pericolo si annidava ovunque, in qualunque momento, anche dove ci si crede al sicuro. Quando mi presentarono Eleonora Brown, la ragazzina che avevano scelto per fare Rosetta, mi sentii subito responsabile per lei, per noi. Aveva una faccia timida e intelligente e insieme ci aspettava un duro lavoro. Come potevo diventare sua madre? Soffrire per lei? Come potevo aiutarla a fidarsi di me? Il mio istinto mi spinse a guardarla con la dolcezza con cui mi ero sentita guardata da piccola, con l’amore da cui ero stata protetta e accarezzata. E funzionò.",1.2094427280826494,5.074372165836394e-05,0.0010403185151517391,5.850531579199014e-07,1.7810936014939216e-06,0.0008559006964787841,8.204151527024806e-05,0.008061991073191166,9.11601455300115e-06,1.6958265347533086e-10,2.178264912799932e-05,0.053403329104185104,2.943623816920038e-11,4.098731909429887e-10,1.7863382648086734e-11,0.10669060051441193,0.00027586790383793414,7.18386800144799e-05,0.9603611826896667,0.8354835510253906
"Il 1954 era stato un anno denso di cambiamenti, di sorprese, di crescite veloci e irreversibili. Avevo conosciuto De Sica e Marcello [Mastroianni], ero stata diretta da Blasetti e da Soldati, avevo cantato e recitato con grandi maestri, ero passata dal comico al tragico senza perdere la mia identità e avevo consolidato la mia relazione con Carlo. Stavo diventando una star, e il mondo cominciava a parlare di me. In primavera ero stata per la prima volta a Cannes per presentare Carosello napoletano, l’unico grande film di Ettore Giannini, considerato il solo musical italiano in grado di competere con quelli americani, nel quale avevo fatto una piccola parte cantando, doppiata, ’O surdato ’nnammurato.In giugno ero stata anche a Berlino, dove una foto famosa mi ritrae a fianco di Gina Lollobrigida, insieme a Yvonne De Carlo. A ottobre, al ritorno da Comacchio, fu la volta di Londra, dov fui invitata per il Festival del cinema italiano.",0.9361409810371697,9.176818333012093e-11,1.1703352176262172e-10,8.288486341712087e-09,5.534854866096062e-11,0.9830850958824158,9.569406955733939e-08,1.1681228206938954e-10,2.796841369612224e-10,2.023275297302618e-11,1.3906285845077804e-11,0.01615283451974392,3.338516268991398e-11,0.24508501589298248,7.438786565894251e-12,0.0014779430348426104,6.004892139088724e-10,1.3549851018979098e-06,0.0002269338583573699,0.4532618522644043
"Noi ci appartammo un momento, cercando un rifugio dove parlare lontano dai riflettori. Lì, in quell’angolo riparato del set, Marcello mi guardò malizioso, come un ragazzino che l’ha pensata grossa. Io lo fissavo divertita, temendo il peggio. «Che dici, Sophia, rifacciamo il nostro spogliarello?» «Sei proprio una canaglia...» risposi fingendomi scioccata. In realtà, l’idea mi stuzzicava assai. Mi ero lasciata alle spalle l’insicurezza di una volta, non avevo più bisogno degli esperti del Crazy Horse, la lezione di De Sica la portavo ormai dentro di me. Quanto al passare degli anni, avevo imparato con l’esperienza a fare del tempo il mio alleato migliore: non lo contrastavo, non lo subivo, vivevo ogni giorno per quello che era, lasciando, come Monna Lisa, che la mia bellezza maturasse in pace. Io e Marcello tornammo da Altman con la certezza di essere sulla strada giusta. Lui ci guardò, capì e gridò: «Azione!». Nonostante il destino ci avesse separati nel lavoro, nella geografia, nelle consuetudini, tutto questo per incanto svanì nel momento di girare. Fummo per qualche ora di nuovo giovanissimi, pronti a mordere la vita, a volerci bene. Lo spogliarello di Mara in Ieri, oggi, domani, rifatto un trentennio dopo sulle stesse languide note di Abatjour, accoglie con un sorriso lo scorrere dell’età e scopre nella vulnerabilità di ognuno di noi il vero succo dell’esistenza.",1.1927335869986564,2.341201934541459e-06,2.465042336918799e-10,1.750292540236842e-05,3.9284345803025644e-06,0.0008559006964787841,8.631325099095477e-10,8.007829122025356e-11,5.228856236882962e-10,0.014281935058534145,6.776251781914766e-10,0.01590639166533947,1.7841794014428203e-11,0.023330770432949066,5.51411832860893e-11,0.02843603305518627,0.0014214044203981757,4.400118632474914e-05,0.8670357465744019,0.8267117738723755
"«Si infili questo» mi disse il tecnico tendendomi un costume da bagno, con modi così bruschi che mi lasciarono senza fiato. E pensare che ero lì con il produttore. “Chissà come mi tratterebbero se fossi qui da sola” mi chiesi con orrore. Mi cambiai dietro il paravento e tornai davanti a loro. Mi sentivo nuda, e la mia timidezza bruciava come una ferita. Indifferenti, i cameramen mi allungarono una sigaretta, ordinandomi di accenderla e poi di camminare avanti e indietro, guardando l’obiettivo. Non avevo mai fumato, né mi ero mai trovata da sola davanti a una macchina da presa. Mi sembrava di essere del tutto inadeguata, e l’operatore pareva d’accordo con me. «Dotto’, è impossibile da fotografare. Ha un viso troppo corto, una bocca troppo larga, un naso troppo lungo!» Come sempre, apparivo di nuovo “troppo”. Eppure ero così, che colpa ne avevo?",0.9723371750442311,2.475693605674678e-08,4.856696989019582e-11,2.0064519503648626e-06,1.012899097929676e-09,1.805851934477687e-05,2.2910279576238146e-11,2.5996819280615924e-11,1.8776182830748667e-09,4.852956578260681e-11,1.376119200813264e-07,0.002757622394710779,3.790719474427995e-11,5.600061303567827e-09,7.444350691443447e-12,0.004365325905382633,2.671639798279557e-08,3.5485274452184967e-07,0.9830850958824158,0.9553191661834717
