"La separazione è lo scempio di tutti i desideri fioriti e coltivati accanto a. Ma, sotto sotto, la parte che ha iniziato il suo distacco profondo, sovrintende con soddisfazione alle pratiche del trasloco da. Il trasloco vero e proprio dalla nostra prima e ultima casa, dove avevamo cercato di coniugare le nostre vite, lo attuarono i miei genitori, col pretesto che ero in tournée, mai li ho ringraziati abbastanza per avermi risparmiato quella pena; riuniti i pochi mobili da qualche parte, riparavo a casa loro, nella mia stanza di ragazza a guardare il soffitto e a rimuginare. «È sano lasciarci», mi ripeteva Renato [Mambor], sarà, ma che fatica staccarsi dal quel nostro ‘spazio bianco interamente ricoperto’. Avevo la consapevolezza di avercela messa proprio tutta. Avevo ventisei anni, mi sentivo vecchia, e non prendevo neppure in considerazione che davanti a noi c’era un futuro, anche se non insieme.",1.90176270599477,0.010986941866576672,0.9525741338729858,0.0003799845289904624,4.006369272246957e-05,0.9875683188438416,5.539172320823127e-07,0.4378235340118408,1.9525883544702083e-05,0.2689414322376251,0.9840936064720154,0.00033535013790242374,3.689884806590271e-07,6.786734729757882e-07,6.786734729757882e-07,0.0024726230185478926,1.0188092574026086e-06,0.00023050670279189944,0.9980732202529907,5.896417860640213e-07
"Io non riesco a capire i pittori che, pur dicendosi interessati ai problemi moderni, si pongono a tutt’oggi di fronte al quadro come se questo fosse una superficie da riempire di colori e di forme, secondo un gusto più o meno apprezzabile, più o meno orecchiato. Tracciano un segno, indietreggiano, guardano il loro operato inclinando il capo e socchiudendo un occhio, poi balzando di nuovo in avanti, aggiungono un altro segno, un altro colore della tavolozza, e continuano in questa ginnastica finché non hanno riempito il quadro, coperto la tela; il quadro è finito; una superficie d’illimitate possibilità è ora ridotta a una specie di recipiente in cui sono sforzati e compresi colori innaturali, significati artificiali. Perché non vuotare questo recipiente? Perché non scoprire il significato illimitato in uno spazio totale, di una luce pura e assoluta?",1.9191856110701337,0.0007321811863221228,9.349120091428631e-07,2.7969301299890503e-05,0.01798621006309986,2.561282371971174e-06,9.204175626109645e-07,8.851569646139978e-07,2.6425857413414633e-06,3.3405392514396226e-06,2.355261858610902e-05,2.7969301299890503e-05,7.934496011330339e-07,1.5779617115185829e-06,0.14804719388484955,0.014063628390431404,2.037748458860733e-07,0.00016346470511052758,0.022977370768785477,5.80500284286245e-07
"Mi vedo spesso bimba, ubbidiente, educata, rispettosa, preoccupata di essere, ben voluta. Alternavo periodi di allegria sfrenata ad altri di malinconia da cappella di famiglia. Insomma: lunatica, come mi chiamavano a casa. Ricordo certe scarpe che mia mamma comperava al mercato: un sandaletto di camoscio blu, con un bordino bianco e un filo di suola in sughero. Due numeri in più del mio piede: «Le scarpe costano tanto, i bimbi crescono». È mia madre che parla.",1.9168362310156226,6.962256520637311e-06,0.4378235340118408,0.005220125429332256,2.6425857413414633e-06,0.9924227595329285,2.829133336490486e-07,0.9902915358543396,0.9914224743843079,0.9324532747268677,0.9399133324623108,0.0011695103021338582,1.3574330637311505e-07,2.496701370091614e-07,9.610241977497935e-05,0.008577484637498856,1.11894303245208e-06,0.0015011823270469904,0.9947799444198608,3.632678442500037e-07
"Della mia infanzia ricordo fatti e situazioni molto confuse, ma di un particolare ho memoria chiara. Tenevo costantemente un lungo livido in cima alla fronte, appena sotto l’attaccatura dei capelli. La causa di quel segno era il sonno: ogni sera seguivo la compagnia per recitare piccoli e grandi ruoli, figlie di re, bimbi mocciosi, protagonisti di storie pietose... Fatto sta che mi toccava restare sveglia fino a tardi. Spesso, appena potevo, come ho già raccontato, mi sdraiavo dentro una cassa dei costumi e mi facevo un sonnellino. Più di una volta mia madre mi teneva addormentata fra le sue braccia mentre si tornava con la Balorda a casa. Ma quando al mattino mi svegliavano perché mi preparassi per andare a scuola, ero in debito di sonno al punto che, andando al bagno ciondolando, mi sedevo sul water e dopo un attimo, immancabilmente, cadevo in avanti con la testa che batteva sul bordo del lavello. Per questo portavo la frangetta: per nascondere il livido.",1.915938482969068,1.414475946148741e-06,0.000552778656128794,0.22270013391971588,3.156125956138567e-07,0.9924227595329285,1.0407800488110297e-07,0.00020342698553577065,0.9914224743843079,4.5921356672806724e-07,1.6028110394472606e-06,0.008577484637498856,1.1793583354346993e-07,1.3363880668748607e-07,4.5921356672806724e-07,0.0011695103021338582,3.5763591199611255e-07,4.539786823443137e-05,0.000552778656128794,0.4378235340118408
"Mi vedo a quindici anni (1944) a un banco del liceo (che non ho terminato), con i fascisti che entrano in classe, in silenzio ci guardano una a una. Poi mi chiamano, dicono proprio il mio nome e cognome, e mi portano nello studio del preside. Non so di che colore fosse la mia faccia, ma avevo paura che tutti potessero sentire il battito del mio cuore. Pensavo, ora mi portano a Villa Triste. Villa Triste era una villetta all’inizio della strada che portava alla mia scuola, dove  tutti in città lo sapevano  venivano interrogati e torturati i partigiani. Ma io non ero una partigiana. Non ero niente. «Stai tranquilla» mi dicevo, «stai tranquilla...» Poi di colpo, alla prima domanda ho capito tutto. E il cuore giù, a battere più veloce. Adesso mi prende il coccolone e vado giù. «Conosci Enrico Mazzucchetti?» mi scuote il graduato.  «Sì.» «Dov’è?» «Non lo so.» Enrico, detto Bubi, era il mio amore dei quindici anni: il primo. «Non Io vedo da un po’.» Sapevo che era andato nei partigiani, ma qualche giorno prima l’avevo visto, era venuto sotto casa mia a darmi un bacio e un biglietto che avrei dovuto consegnare a qualcuno che, per farsi riconoscere, mi avrebbe detto: come sta Bubi? Dio mio, che era successo? «Allora?» Erano minacciosi. «Non lo vedo più...» e rimango lì, a bocca aperta come un’allocca. Giunti nello studio del preside mi hanno frugato in tasca. Poi mi hanno lasciata andare. La mia aria innocente li aveva convinti. Non ricordo altro. Mi sono ritrovata in classe con la testa staccata dal corpo e le mani sudate. Mi parlavo immaginando la voce di mia madre: «Sei  un’incosciente, sei una disgraziata. Se lo viene a sapere tuo padre ti ammazza, e fa bene». E facendo il segno della cro ce benedicevo l’idea che avevo avuto di stracciare in piccoli pezzi il biglietto con la missiva dopo essermela imparata a memoria, parola per parola. Quando una mattina andando a scuola sono stata contattata da una ragazza che non avevo mai visto, alla sua domanda, pronunciata con grande determinazione: «E Bubi come sta?» ho tirato un profondissimo respiro, poi ho detto tutto d’un fiato quel che dovevo dire e sono svenuta. Ma come si fa a essere così fragili ed emotivi? Non avrei mai potuto diventare una partigiana; neanche una staffetta...",1.9141092100180686,0.0029810327105224133,0.0029810327105224133,0.0029810327105224133,0.0029810327105224133,0.0029810327105224133,0.0029810327105224133,0.0029810327105224133,0.0029810327105224133,0.0029810327105224133,0.0029810327105224133,0.0029810327105224133,0.0029810327105224133,0.0029810327105224133,0.0029810327105224133,0.0029810327105224133,0.0029810327105224133,0.0029810327105224133,0.0029810327105224133,0.0029810327105224133
"""Mia madre era troppo severa con noi figli. Lo dico con massima obiettività. Nella mia vita, quando ho formato con Dario la mia famiglia, ho sempre cercato di parlare con mio figlio e con le nipotine Gaia e Enrica cresciute con noi, badando bene di non aggredire coi gesti e la voce, e di convincerli dialogando, non imponendo. All’inizio è faticoso. Sono chiusi come ricci. Ma quando lentamente ti guadagni la loro fiducia, dimostrando che non sei mai preconcetta e che sai ammettere i tuoi torti, cessi di essere il loro precettore naturale e diventi un’amica alla pari. Qualsiasi cosa succeda tu sei con loro, e loro lo sanno"".",1.9098426980199292,0.14804719388484955,1.7231572201126255e-05,0.7310585379600525,0.00033535013790242374,0.851952850818634,3.17420010276237e-08,0.9968273043632507,0.9241418242454529,2.1444948288262822e-05,1.1015954441973008e-06,0.09534945338964462,4.1163639252772555e-07,1.0571699249339872e-07,1.514326015694678e-07,0.014063628390431404,0.008577484637498856,0.00407013762742281,0.9840936064720154,1.4908485468367871e-07
"Sono tornata, con grande infelicità e senza entusiasmo, a fare il mio lavoro di sempre, l’attrice: era destino. D’altra parte lo zio Tommaso lo andava ripetendo di continuo: si nasce tutti con i cerchioni ai piedi, c’è chi calza ruote da bicicletta, chi da macchina e chi da vettura ferroviaria. Tutti vanno di qua e di là, ma chi si muove sui cerchioni di ferro non può sterzare per altra strada: è costretto dalle rotaie a tirare sempre dritto nella sua unica direzione. Okay. È andata così. Sono un tram. Forse da grande farò la locomotiva. Pazienza.",1.9158111379947513,1.5206839634629432e-05,4.6644510121041094e-07,0.04742587357759476,5.144220995134674e-05,0.9953904151916504,4.6644510121041094e-07,1.2878952020400902e-06,0.0007096704212017357,0.003172682598233223,0.9914224743843079,0.0011695103021338582,5.203571049605671e-07,6.681516424578149e-07,4.5921356672806724e-07,0.037326887249946594,3.156125956138567e-07,0.00043055712012574077,0.9796676635742188,0.9859364032745361
"Nei primi diciotto anni della mia vita, non ho mai letto un giornale, eppure ne circolavano nella mia casa, li leggevano mio zio, mio fratello, mio padre... ma erano cose da maschi. E questo che c’entra? Nulla, ma serve a sottolineare la metamorfosi che si è maturata in me dal momento in cui sono arrivata a Milano. In quegli anni ho scoperto che significa vivere da persona informata, cosciente di ogni situazione: scoprire che esistevano lotte per la dignità e la giustizia, scoprire che la politica non è roba da congrega e nemmeno un fatto di opinioni diverse, ma è la chiave fondamentale di ogni emancipazione civile.",1.918133925064467,0.008577484637498856,0.022977370768785477,0.00013552077871281654,7.484622619813308e-05,0.9902915358543396,0.022977370768785477,0.0004442183708306402,0.9859364032745361,0.0009110511746257544,1.4908485468367871e-07,0.003172682598233223,0.9959298968315125,0.0015011823270469904,2.496701370091614e-07,0.9964063763618469,4.539786823443137e-05,0.0015011823270469904,0.32082128524780273,1.7429786680622783e-07
"Inutile spendere parole: ho abortito. Trentamila lire (denari che abbiamo racimolato tra tutte le persone che conoscevamo) più la paura, e qualcosa addosso e negli occhi, che per mesi non m’ha lasciato. Di quell’ora passata in una specie di ambulatorio, non certo attrezzato per un intervento chirurgico, ricordo il freddo, il buio che c’era fuori, era notte, l’indifferenza e la tensione del medico e dell’infermiera. «Non gridi per favore, altrimenti non la opero.» C’era paura in quella stanza, la loro e la mia. In quel periodo per l’aborto si finiva in carcere. Oltre a quella paura c’era il terrore per l’intervento che affrontavo senza saperne assolutamente niente. L’unica cosa che sapevo con certezza è che non avrei avuto l’anestesia. Per me, e tutto per me, c’era anche il peso di quello che stavo facendo. Stesa sul lettino freddo pensavo a mia madre, e ho veramente desiderato di morire. «Se ha paura se ne vada. Se grida, smetto e la caccio via.» Per anni quel «la caccio via» m’è rimbombato nel cervello facendomi arrossire e maledire la mia timidezza. Non ho gridato. Dolore. Zitta. Sentivo le lacrime scivolarmi tra i capelli... non un lamento m’è uscito. Guardavo il medico... un pezzo di ghiaccio indifferente, che faceva il suo lavoro fischiettando sotto tono... «È uno cattivo» ho pensato. Sicuramente ho inondato di lacrime Dario, che stava ad aspettarmi davanti al portone chiuso. M’ha abbracciata stretta stretta. Stavamo male come due cani che avevano perso la strada di casa, in più io mi sentivo così colpevole, d’essere certa che non avrei più osato guardare negli occhi mia madre. Duemila anni di pregiudizi erano il pane quotidiano che molta gente ha mangiato. Io, con mia madre onestamente cattolica osservante e convinta, ne ho fatto indigestione. Per Dario era diverso. Ho incontrato altre volte quel medico. Non ci siamo mai nemmeno salutati. Lui è diventato famoso. Ricchissimo. Dopo la legalizzazione dell’aborto ha fatto pure obiezione di coscienza. A parole. Nel suo studio faceva aborti a tutto spiano, nulla era cambiato nella sua attività abortista. Solo la tariffa: un milione.",1.905512353987433,0.00017952796770259738,0.00017952796770259738,0.00017952796770259738,0.00017952796770259738,0.00017952796770259738,0.00017952796770259738,0.00017952796770259738,0.00017952796770259738,0.00017952796770259738,0.00017952796770259738,0.00017952796770259738,0.00017952796770259738,0.00017952796770259738,0.00017952796770259738,0.00017952796770259738,0.00017952796770259738,0.00017952796770259738,0.00017952796770259738,0.00017952796770259738
"Non ne parlo volentieri. Sono passati tanti anni, ma mi basta un niente per ritrovarmìci dentro di colpo. Nessuna donna che abbia subito violenza sessuale potrà mai staccarsi completamente da quel momento orribile. Ancora oggi, proprio per l’imbecille mentalità corrente, una donna convince veramente di aver subito violenza carnale se ha la «fortuna» di presentarsi alle autorità competenti pestata e sanguinante, se si presenta morta è meglio! Un cadavere con segni di stupro e sevizie dà più garanzie.",1.9157829229952767,5.896417860640213e-07,1.1979305725162703e-07,0.060086652636528015,3.3931446523638442e-06,0.622459352016449,5.594337835646002e-06,2.829133336490486e-07,2.058049176412169e-06,1.2167951979336067e-07,0.003172682598233223,8.714338832760404e-07,2.1444948288262822e-05,5.955139386060182e-06,9.042454962582269e-08,0.0015011823270469904,3.647853736765683e-05,6.854317234683549e-06,0.7772998809814453,4.840077139078858e-08
"Ogni tanto succede a me e Dario di sfogliare pubblicazioni illustrate da foto sul nostro lavoro e quasi all’unisono esclamiamo: «Abbiamo fatto cose da pazzi! Ma dove trovavamo il tempo per dormire?!» In mezzo a tanta baraonda di spettacoli, partecipazione a dibattiti e manifestazioni, interventi nelle fabbriche occupate e nelle università, rappresentazioni all’estero, c’è da chiederci com’è che non si sia esplosi come i palloncini di Carnevale troppo pompati. A ogni modo, non c’era né festa né periodo di vacanza che ci facesse prender fiato: dagli anni Settanta agli anni Ottanta non erava mo dentro una vita, ma piuttosto in una specie di giostra con finale da montagne russe. Oltre a mettere in scena questi spettacoli di satira politica, personalmente io recitavo testi sul tema delle donne in chiave quasi sempre spassosa e altre volte drammatica; Dario continuava a raccogliere e scrivere testi tratti dalla Bibbia, dagli scritti eretici, dai Vangeli apocrifi: il Mistero buffo ormai era recitato a puntate.",1.892306410940364,0.00015843621804378927,1.3497025292963372e-06,2.1444948288262822e-05,6.814872176619247e-05,0.9669140577316284,2.5071596610359848e-05,1.4367506082635373e-06,6.681516424578149e-07,1.4593761079595424e-06,9.042454962582269e-08,0.060086652636528015,0.7772998809814453,3.632678442500037e-07,1.315669351242832e-07,0.006692850962281227,0.000552778656128794,0.008577484637498856,0.02931223064661026,0.00026947917649522424
"Negli anni ’70 abbiamo vissuto «bizzarramente»... Personalmente ho avuto qualche problema con i fascisti... ci hanno messo bombe di qua e di là, così che nessuno a Milano voleva più affittarci una casa. Eravamo tre sbandati che stavano un po’ in albergo, un po’ da mia sorella Pia e un po’ da mia madre a Cernobbio. Con una simile vita allo sbando, da «angoscia perenne», Jacopo [Fo] incominciò a non sentirsi a suo agio nel mondo.",1.9165955840144306,0.005220125429332256,0.02931223064661026,0.0019267346942797303,0.0015011823270469904,0.9933071732521057,0.2689414322376251,0.32082128524780273,0.2689414322376251,1.7231572201126255e-05,0.9796676635742188,0.005220125429332256,0.02931223064661026,2.058049176412169e-06,1.6028110394472606e-06,0.014063628390431404,1.11894303245208e-06,0.00017952796770259738,0.9947799444198608,1.414475946148741e-06
"C’è uno strano chiarore che entra di soppiatto dalla finestra. Non avevo mai assistito a un’alba tanto assurda a Milano. È settembre. Da fuori viene un’aria ancora tiepida. Fra poco sarà giorno. Mia madre sta morendo. Sono qui seduta su una poltrona, la testa appoggiata a un cuscino, ma non riesco a dormire. Gli occhi mi bruciano, ma non ho sonno. Sono rientrata da quattro ore. Stasera in teatro ho recitato senza seguire quello che andavo dicendo... gesti, battute, parole uscivano come registrate: la mia mente stava qui in questa stanza. Mi appoggio meglio alla poltrona. Ho posato in grembo il latte detergente per lo strucco. I kleenex. Me lo passo sul viso; da soli mi escono sospiri lunghi, dolorosi. Di quelli che ti sconquassano la mente. Sto vivendo questo momento come se non capitasse a me. La guardo. Lei è lì che sta faticando a morire.Un rantolo costante da giorni ci segue in ogni stanza. La sua mano che tengo più che posso nella mia, è tiepida... se non fosse per quel respiro strozzato che le esce e le labbra spaccate per l’arsura, potrebbe sembrare una bellissima anziana signora addormentata.",1.9038638420170173,7.571149467366922e-07,0.037326887249946594,0.6513549089431763,0.00012339458044152707,0.9953904151916504,5.7477343773371103e-08,0.04742587357759476,2.496701370091614e-07,0.562176525592804,0.9465966820716858,0.562176525592804,2.3588652808825827e-08,6.214782644065053e-08,2.6425857413414633e-06,0.9149009585380554,2.006155881417726e-07,0.037326887249946594,0.9982993006706238,0.00012339458044152707
"Accidenti, ma perché? «Dovrei essere contenta!» mi dico. «SENATRICE! Ma ti rendi conto che onore t’è capitato?»«Sì, sì... senatrice!!!» e mi rifaccio il verso. Non ho mai pensato di arrivare a una carica tanto prestigiosa, non era proprio nei miei programmi! «Onorata, onorata» per carità... Mi sono trovata eletta senza aver mosso un dito. Non mi sento all’altezza... sono spaventata, anche se non lo dico a nessuno. «Non ti senti all’altezza? E allora, quelli che hanno votato per te, t’hanno scelta così, a caso? Proviamo con un’attrice... piazziamoci un bel personaggio decorativo, in quel mausoleo di tromboni! Piantala con 'sta solfa ! Ricordati di tutto il lavoro che hai tirato in piedi nelle carceri, l’organizzare le difese dei ragazzi arrestati per reati politici... sbattuti in galera, torturati... carceri speciali modello tedesco... le centinaia di spettacoli in sostegno delle fabbriche in lotta che hai fatto con Dario...» «Sì, ecco, ecco... adesso gonfiamoci di orgoglio...» «È solo per rinfrescarti la memoria, darti un po’ di sicurezza! Insomma! Ti sei sbattuta per anni solo per darti un tono...?! Come a fare un po’ di footing? Dovresti essere orgogliosa: pensa in quanti ti hanno votata! In quanti hanno avuto fiducia in te. È tutta gente che ti ha scelta con cognizione di causa. Non per caso. Forza!» «Ma vai al diavolo, tu e le tue leccate di gratifica!» Così, in conflitto con me stessa, salgo nell’appartamento.Mi guardo allo specchio: più tirata di così non potrei essere.«Che bello sfottermi con quel sorrisino... mi sento fuori posto... non all’altezza... non adeguata... in più sono vecchia per affrontare una vita nuova.» Be’, non esageriamo... Adesso, a guardarmi bene a tutto campo nello specchio, non mi vedo proprio da buttare! «Oh, per la miseria, alla tua età dovresti sbatter la coda per la gioia, cara senatrice! E anche voltolare su te stessa come in una danza?!» Facciamo conto di dover entrare in scena... sono figlia d’arte e noi della professione montando sul palcoscenico non si trema mai.",1.901959998998791,0.0003799845289904624,0.0003799845289904624,0.0003799845289904624,0.0003799845289904624,0.0003799845289904624,0.0003799845289904624,0.0003799845289904624,0.0003799845289904624,0.0003799845289904624,0.0003799845289904624,0.0003799845289904624,0.0003799845289904624,0.0003799845289904624,0.0003799845289904624,0.0003799845289904624,0.0003799845289904624,0.0003799845289904624,0.0003799845289904624,0.0003799845289904624
"Immancabilmente uno dei due chiede: «Che sogno hai fatto?» Se chiedo io, lui mi risponde con una voce che solo io conosco. Assonnata. Piccola. Tenera, come fosse, non l’omone di ottantatré anni che è... ma un bimbo. Questa voce «mia» mi scioglie di tenerezza. Devo dire che Dario [Fo] fa dei sogni incredibili. Più volte ho avuto il dubbio che... sì, che ci fosse una base reale, ma che lui, da abile sceneggiatore qual è, li arricchisse un po’. Nei suoi sogni ci sono spesso io... siamo giovani... non riesce a telefonarmi, non si ricorda il numero del mio cellulare, di casa... non mi trova... non trova la nostra abitazione. Vaga disperato chiamandomi. Poi gli si avvicina un uomo a metà fra il reale e il meccanico che vola... lui si aggrappa e l’uomo volante si libra nel cielo e via che lo porta da me... che sono seduta sopra un rinoceronte... Ecco, a ’sto punto del racconto inizio a ridere... «Basta, basta... smettila... è troppo lungo e ora stai inventando.» Non ricordo più chi diceva che i sogni sono la trasposizione fantastica dei nostri desideri, delle nostre paure e gioie. Ecco, sento la sua voce che insiste: «No, ti giuro! Ho sognato proprio così!»",1.906112486962229,0.00020342698553577065,0.07585817575454712,0.01798621006309986,0.18242552876472473,0.562176525592804,1.5057016753416974e-06,0.0002611903182696551,0.7310585379600525,0.010986941866576672,0.000552778656128794,0.5,2.5759553068382957e-07,0.00020342698553577065,0.006692850962281227,0.562176525592804,5.338155460776761e-06,0.005220125429332256,0.9890130758285522,2.6688529032981023e-05
"Cresceva Jacopo [Fo] e lavorava come un matto. Si dice che il DNA non è acqua e devo ammettere che è un’espressione azzeccata, giacché nostro figlio ama la pittura con la stessa passione di suo padre, ma, almeno da ragazzo, quando gli offrivamo di entrare in compagnia con noi per recitare ruoli che Dario avrebbe scritto appositamente per lui, scantonava come un furetto: «Per carità! Vi ringrazio, ma non voglio godermi lo stress che prende a voi ogni volta che debuttate e stare tesi come corde di violino per tutta una stagione, leggervi belle critiche ma anche infamità rognose, per non parlare poi del vivere tutto il tempo con la censura attaccata alle spalle e sui glutei come le zecche ai cavalli...»Alla fine come professione scelse i fumetti e le vignette satiriche e pubblicò i suoi disegni su numerose riviste underground.",1.9130837719421834,0.32082128524780273,3.3931446523638442e-06,0.00020342698553577065,6.339210358419223e-06,0.9796676635742188,4.683888619183563e-05,0.622459352016449,0.9525741338729858,3.535625000949949e-05,0.00020342698553577065,0.006692850962281227,3.3931446523638442e-06,1.6028110394472606e-06,6.681516424578149e-07,0.0024726230185478926,7.571149467366922e-07,0.006692850962281227,0.9525741338729858,6.681516424578149e-07
"È il 25 aprile, la guerra è finita. A Varese per la piazza Impero sfilano i partigiani. Fra loro ci sono ragazzi che conosco. Erano del primo gruppo di combattenti che si era formato sulle montagne della Val Cuvia appena dopo l’8 settembre. Si erano arroccati sul Monte Grino e sul Cuvignone. I tedeschi li avevano attaccati sparando con artiglierie pesanti, un vero massacro, in pochi si erano salvati attraverso le gallerie scavate nella prima guerra mondiale; erano quasi tutti abitanti della valle, gli unici che conoscevano a menadito il percorso di quegli antichi camminamenti. Per festeggiare la liberazione, per le strade si era rovesciata una marea di gente: a un certo punto dal fondo scorgo venire avanti un gruppo armato. Con loro c’era una donna. Era la madre di uno dei caduti di Monte Grino. In molti la riconoscevano e l’applaudivano. Qualcuno andava ad abbracciarla. A un tratto lei si fermò e si sedette su un muretto, facendo cenno agli altri di proseguire: l’emozione era troppo grande e non ce la faceva più a camminare fra gli applausi e le grida.Il giorno dopo arrivano gli Alleati. Li avevamo visti il pomeriggio transitare per la città sui camion. Erano arrivati anche nella mia strada. Ci buttavano cioccolato e sigarette. Arrossisco al pensiero di essermi buttata con gli altri per tentare di raccogliere qualcosa.  La sera, nel cortile di casa mia, gran festa. Un grammofono, [...]. Poi guardo su, verso la finestra buia del primo piano: casa mia. Più che vederla, l'intuisco: mia madre è lì, ci sta guardando. Conosco i suoi pensieri, il suo tormento: mio fratello, deportato in un campo di concentramento in Germania, non dà notizie da oltre due anni, In un attimo le sono vicina vergognandomi della mia allegria. Mi stringo forte a lei.",1.8903592160204425,0.00407013762742281,0.00407013762742281,0.00407013762742281,0.00407013762742281,0.00407013762742281,0.00407013762742281,0.00407013762742281,0.00407013762742281,0.00407013762742281,0.00407013762742281,0.00407013762742281,0.00407013762742281,0.00407013762742281,0.00407013762742281,0.00407013762742281,0.00407013762742281,0.00407013762742281,0.00407013762742281,0.00407013762742281
