"I was desperate because I had no breasts. So I asked my mother: ""Mom, why don't I have breasts?!"" And she: ""Eh, because, as if to say, in short, nature certain times, that is, here ... but you are quiet: in the end everything is balanced ... at least I hope!"" To tell the truth was not a great dialogue! Then he makes me: ""Pray Santa Rita da Cascia who is the saint of impossible!"" I prayed that you don't know how much ... obviously with not sufficient intensity, and a breasts, one, but beautiful, a pear ... a beautiful pera William ... here nothing! My mom put my bra and pitched me with the handkerchiefs the missing part. Those two protrudes on my chest made me feel almost a woman! I was also less embarrassed with the courtesy of the males, so much so that often those took courage. One of those Moscardini even came to put a hand on my breasts: a ""washing"" came from Knock Out. ""Cretino, how do you allow yourself?"" I was not angry for the gesture, as for the fact that he had touched my wrong breasts! The one padded with pezza! Finally I also got the missing ... round! I had a beautiful pera William and a queen apple. ""Mom, why do I have a pear William and a queen apple?!"" My mother reassured me: ""Having the breasts and two almost identical is an indication of a lack of originality, of a banal indole."" ""Ah yes?"" ""And then a song also says it:"" My girlfriend is about Villafranca, there is a black tenet and another white, a pointed pyrolino and the other round, my girlfriend is beautiful a end! """" ""Well, then we toast!""",0.18272984749637544,0.07649831473827362,0.6279260516166687,0.9644503593444824,0.8553333282470703,0.943186342716217,0.10045391321182251,0.982056200504303,0.8469585180282593,0.6235560178756714,0.49757909774780273,0.8228507041931152,0.11873408406972885,0.974141538143158,0.9813771843910217,0.879928469657898,0.8908718228340149,0.44780173897743225,0.9529656171798706,0.17367154359817505
"At some point in my life I realized that the work of actress did not drive me crazy, that I didn't like it so much. People don't believe it, they think they are lies. Instead it is true, I would never have chosen this profession, which requires a type of character that I do not have: attendance, arrogance and good elbows. When I realized that I didn't like this job, it was too late, I was already married to Dario and we had our company. If I had not been addressed to this profession by my family, I would have committed myself to the social, I could also have been a lawyer or a doctor.",0.18272984749637544,0.6428974866867065,0.594297468662262,0.10062822699546814,0.24985679984092712,0.9946984648704529,0.5573782920837402,0.9918393492698669,0.19702431559562683,0.872820258140564,0.46539923548698425,0.6390935778617859,0.0008236832218244672,0.8838618397712708,0.10662401467561722,0.968211829662323,0.8057152628898621,0.0009132639388553798,0.9382666945457458,0.9717547297477722
"Cinema bored me to death. Early in the morning you got up, they came to take you at five, at six and ten you were ready, at the eleven and a quarter the director was finally presented. Time is not thrown away. I don't regret it, cinema. In the theater, your audience is in front of it.",0.18272984749637544,0.7188885807991028,0.00014440140512306243,0.011492451652884483,0.04551050439476967,0.4595072567462921,0.004089240450412035,0.038855232298374176,0.02989615499973297,0.8452717661857605,0.0994819700717926,0.006352532655000687,5.0699658459052444e-05,0.8569122552871704,0.00553769338876009,0.9195299744606018,0.05789564549922943,0.0003437897248659283,0.3838328421115875,0.0009746558498591185
"I received the threats, when I was already senator. Terrible phrases, like ""splitting all your teeth with beating"". I was very afraid, also because I was seventy -seven years old and I returned home alone at three in the morning, after hours of meeting to the Budget Committee (which God has it in glory).",0.18272984749637544,0.7525994181632996,0.9446722269058228,0.5605490207672119,0.9276778101921082,0.9963311553001404,0.9965795874595642,0.0006803744472563267,0.00031622362439520657,0.998071014881134,0.8570132851600647,0.9741624593734741,0.9967070817947388,0.986139178276062,0.6149386763572693,0.9939088225364685,0.013893328607082367,0.4693039357662201,0.9978669881820679,0.0004053291922900826
"If I had to be reborn, but I really hope it doesn't happen to me, I would not change a single comma of what I did in my life. With Dario I lived an exaggeratedly happy life, the only thing that at the beginning disturbed me was the unpleasant feeling of being transparent, especially with other women. How many times the famous feminists, leaders of the movement, those who know everything, who speak to you from above, came to the Liberty building. They entered, maybe they saw that I was cleaning the great place with a broom (unusual role for a first actress), it is not that they realized and said at least: ""Hello"". No, they only asked me: ""Where is Dario?"" ""The worst enemy of the woman ... is the woman."" There is no comedy where he did not reiterate the concept.",0.18272984749637544,0.9014761447906494,0.40174153447151184,0.3805716335773468,0.8184607028961182,0.996945321559906,0.330502450466156,0.3973080813884735,0.5668704509735107,0.5354436039924622,0.7002960443496704,0.9877467751502991,0.23083826899528503,0.000811670848634094,0.2348680943250656,0.9758297801017761,0.9984403252601624,0.7867730259895325,0.9781469106674194,0.8539310693740845
"When he took the Nobel Prize, Marta Marzotto invented a basket with five hundred red roses. The accompanying ticket said: ""Behind a great man there is always a great woman."" I called her on the phone to thank her, but I also said to her: ""Marta, don't put me behind, it makes me impression, it's as if you arrange to keep her step. Bridges alongside. I would find myself better ». It is strange that an intelligent and witty woman like her has fallen into such banality.",0.18272984749637544,0.3462813198566437,0.589069664478302,0.4476090371608734,0.8752781748771667,0.937228798866272,0.4969989061355591,0.7751367092132568,0.007684700191020966,0.8378055095672607,0.8240842223167419,0.9422194957733154,0.2806042432785034,0.5841490626335144,0.35019537806510925,0.9802706241607666,0.9933785200119019,0.6674700975418091,0.9670537710189819,0.17019836604595184
"Di Pietro contacted me to ask me if I wanted to apply for the 2006 national elections. I had many commitments, so many things to do, it seemed madness to me, and I told him. But he made the news shoot and people began to call. ""You have to go, you have to go,"" they told me. In the end I applied to the list of Italy of values. I took almost five hundred thousand votes, which are many. Precisely out of respect for my voters, and for a sense of responsibility, I remained in the Senate longer than I would have liked. If it had been for me, I would have resigned at least seven months before the government falls. (...) The nineteen badly months of my life. It was a period of great solitude, I was surrounded by asocial people. Finocchiaro greeted me only after a year. I always thought: «I am not the one that comes from Sicily and is called Luisa Rovigotti. I starred in theaters from all over Italy, you can't pretend not to know me! ». It was the decane of the Union and, as a woman, we should have taken poor unfortunate females, who we knew nothing, and rely on someone who teach us something. Finocchiaro passed in front of me as if I were transparent, then when he needed me: ""Francuzza, Francuzza"". In that Senate I made the unimaginable.",0.18272984749637544,0.8833204507827759,0.44505733251571655,0.8216288685798645,0.8760315179824829,0.9985182881355286,0.9944013357162476,0.05509358271956444,0.17663346230983734,0.9500623941421509,0.8140679597854614,0.9553226232528687,0.99858158826828,0.9584309458732605,0.0939401313662529,0.9875314235687256,0.9859314560890198,0.9307489395141602,0.9786878228187561,0.776670515537262
"Obviously you have supported the campaigns for divorce and abortion. We joke, divorce and abortion. Of course, we have made all the colors.",0.1805936712771654,0.11138201504945755,0.1410052478313446,0.16614070534706116,0.001400795648805797,0.8301379084587097,0.1295797973871231,0.029598569497466087,0.025230340659618378,0.0017002400709316134,0.32670271396636963,0.944979727268219,0.9024183750152588,0.10808771848678589,0.9354321360588074,0.8947528004646301,0.8786520957946777,0.7607678771018982,0.7671504616737366,0.0447944775223732
"I have never studied ""the art of acting"", and when I hear ""the art of acting"", the term already nervous me. I was born in a family of actors. I staged my mom eight days in my arms. That evening I didn't speak so much ... [...] we recited the subject, following the canvas. The traditional actors, when they came to our company, were forced to be very careful, someone was already saying to the tests: «Sorry but I always recited following a written text. With you I never know when I touch me to tell me my joke. I can't do it ». Too bad, if they had remained with us they would have had an experience capable of changing their lives.",0.1805936712771654,0.24395285546779633,0.3355676531791687,0.5837751030921936,0.2771802544593811,0.9048450589179993,0.16680769622325897,0.9969001412391663,0.7707757949829102,0.4508512318134308,0.6068194508552551,0.7246708869934082,0.1564452350139618,0.07488752156496048,0.10872483998537064,0.9469637870788574,0.9800412058830261,0.8400424718856812,0.43730610609054565,0.7040019035339355
"The exploitation was everywhere, even within the family. Feminism, if understood in its true meaning, is a very high concept, of an invaluable value. The so -called feminists, leaders of the time, turned to modest women, workers, with an high -sounding and meaningless language, imbued with ideologies. Instead, I tried to implement my conception of feminism by bringing our shows to the factories. After each representation, such as ties that I split all the same, there was discussing, and the worker understood. He understood, if you used the right language, otherwise it was like making a hole in the water.",0.1805936712771654,0.6643878817558289,0.25515279173851013,0.19091375172138214,0.007227110210806131,0.9066733121871948,0.8983021974563599,0.9400468468666077,0.16956952214241028,0.001102786511182785,0.49563249945640564,0.873013973236084,0.3730902671813965,0.013501115143299103,0.3244987428188324,0.9873997569084167,0.9914578795433044,0.019364140927791595,0.014612489379942417,0.5011958479881287
"The actors I know make a bizarre thing: before going on stage they touch my hands, because they are so excited that they have frozen, or sweaty hands. An actor would never confirms it, but it is just like that. They can't explain why this is not understood to me. I never have sweaty hands, I never have cold hands, because this is my job. It will seem a little greve, but it is as if the delicatessen, slicing ham, felt a great emotion. He did it many times, he was born by cutting the ham. And I was born in the theater. It is there that I accumulated the luggage, which then allowed me to interpret all the roles.",0.1805936712771654,0.9115193486213684,0.0002929962647613138,0.5551406741142273,0.6644539833068848,0.9474067091941833,0.0050432984717190266,0.912578284740448,0.09396467357873917,0.0015840257983654737,0.4184507131576538,0.5405858755111694,9.561748447595164e-05,0.9813055396080017,0.10829818993806839,0.9654083847999573,0.001417782623320818,0.0003462543827481568,0.9748762249946594,0.0047872234135866165
"It happens to me like this: as I see a person, after seven minutes I understand if it will give a damn or not. Just as, when I read a theatrical text, I immediately feel where the mistake is. Even on my scripts I write: ""Laughter, here there must be a laugh."" And laugh comes. It will be DNA. Maybe I spent my life acting. I was already reciting in my mother's belly.",0.1805936712771654,0.9180024862289429,0.034411728382110596,0.19432510435581207,0.476291298866272,0.9749184846878052,0.000667244428768754,0.9868540167808533,0.6808884143829346,0.3053591251373291,0.48123717308044434,0.968454897403717,0.00678504491224885,0.6044682264328003,0.6454606652259827,0.9796715974807739,0.8876132965087891,0.9981552958488464,0.9909904599189758,0.9611732363700867
"With the unwatched we made a great mistake. On the other hand, we didn't have the means to do better. We should have collected it and turn the scenes again, the rhythm was missing. The audience of that time could not appreciate such a film. Now, however, you look at him and say: ""Ah, what a good movie"". Carlo Lizzani, then, was not a comic film director. And a dear friend of mine, I have admiration for him, but it was not his kind of movie. Six to write the unwatty (perhaps a little too many), with the poor Dario [fo] trying to intervene but was silent: ""This is not theater, we are making a film"". Dario and I have not had the strength to withdraw it or redo the scenes.",0.1805936712771654,0.3114210367202759,0.26075634360313416,0.18128091096878052,0.4636220633983612,0.9682445526123047,0.7233195900917053,0.7775614261627197,0.32174476981163025,0.9433777332305908,0.9098392724990845,0.8601549863815308,0.0012592923594638705,0.9940454959869385,0.08265950530767441,0.9832801818847656,0.18858031928539276,0.9980423450469971,0.9868642091751099,0.0012142808409407735
"I do not bring Rancore to Dario [fo], because at the base there is my greatest defect: that of not having ambition. It is not that Dario has ever thought: ""Franca gives me ideas and I am a caught!"". No, he just didn't come to mind. If I had not been his wife, if I had been another, he would have had to, necessarily, also put my name as an author. Einaudi has published numerous texts by Dario edited by me and initially did not even appear the wording ""edited by Franca Rame"". When I asked Roberto Cerati the explanation of this, he replied: ""We didn't think about it."" The trouble is that I am the wife, and the wife, sometimes, is a home furniture, a picture on the wall, something that is close to you but that you don't see. I know hundreds of outbursts of women on the subject. If I had to be reborn, but I really hope it doesn't happen to me, I would not change a single comma of what I did in my life. With Dario I lived an exaggeratedly happy life, the only thing that at the beginning disturbed me was the unpleasant feeling of being transparent, especially with other women. How many times the famous feminists, leaders of the movement, those who know everything, who speak to you from above, came to the Liberty building. They entered, maybe they saw that I was cleaning the great place with a broom (unusual role for a first actress), it is not that they realized and said at least: ""Hello"". No, they asked me only: ""Where's Dario?"" ""The worst enemy of the woman ... is the woman."" There is no comedy where he has not reiterated the concept.",0.1805936712771654,0.6440222263336182,0.8478409647941589,0.3079929053783417,0.6653214693069458,0.9841123819351196,0.29458555579185486,0.8762235641479492,0.4032239019870758,0.47452545166015625,0.7365168333053589,0.9651129841804504,0.10359203815460205,0.007372602354735136,0.24246425926685333,0.9655206203460693,0.9973311424255371,0.9846627116203308,0.9606761932373047,0.8402103185653687
"At seven or eight years of age I reproached me to become a man. The female world did not seem attractive to me, free and fun as male. Apart from Pia, the only woman I wanted to be. I have never forgiven my father to have pulled away from school only my brother the day that the Soviets announced the success of a man's first mission in space. My brother not me and my sister too! My father, excited and moved, had rushed to our school to announce the historic event to my brother and his companions. Then he brought Roberto home with him, not even being able to imagine spending that day without his son. My sister and I were left in class to finish the daily routine. We were girls. I felt anger and fury. I didn't want to be a female. I wanted to be a male.",0.1805936712771654,0.9855378270149231,0.8511761426925659,0.9184126257896423,0.8080052733421326,0.996722936630249,0.9968822598457336,0.9983597993850708,0.9968643188476562,0.926307201385498,0.9110264778137207,0.9915039539337158,0.47976619005203247,0.9676965475082397,0.7977223992347717,0.9882849454879761,0.9956427812576294,0.9851230978965759,0.9974458813667297,0.13859733939170837
"With this book I intend to answer the many questions that are always asked and I never know how to reply. But who ask me ""How do you manage to keep your private life separate from the professional one?"", I know what to say. Don't separate them. In fact, nothing but anything. I never even separate from anyone. Everything for me intertwines and mixes as in a single minestrone. Not only do not separate my private life from the public one, but my two professions also mix: model and actress are the same job for me. I can't split childhood from adulthood and, worse still, the living from the dead.",0.1851005016360432,0.9654929041862488,0.49006983637809753,0.5201371312141418,0.47090011835098267,0.9274294972419739,0.05521111935377121,0.8610445857048035,0.1719358116388321,0.6762629151344299,0.6983240246772766,0.850134551525116,0.022926900535821915,0.5209159851074219,0.4091416299343109,0.9848820567131042,0.8441465497016907,0.939433753490448,0.40424323081970215,0.9746233224868774
"My daughter has the same problems as I have with my parents. My photos appeared in the massive advertising campaign of Lacôme all over the world for fourteen years in a row. When Elettra was born, my image was already in magazines, TV, posters and billboards. One day, at kindergarten, the teacher taught children what to do in case they get lost: looking for a policeman, learning their address and telephone number, and other such solutions by heart. Then he began to question the children. My daughter asked: ""What would you do if you get lost in an airport?"" And she: ""I would look for the advertising billboard with my mom and wait for help below."" In fact, Elettra thought that all the people in advertisements were mothers and fathers who were exhibited everywhere, in airports, roads and highways, in the event that the children were lost and needed help.",0.1851005016360432,0.2405155599117279,0.8473052978515625,0.8161302804946899,0.5851571559906006,0.9802910089492798,0.02582278661429882,0.9897202849388123,0.9774971604347229,0.47011736035346985,0.7940253019332886,0.8617817163467407,0.035854533314704895,0.04189230501651764,0.1120469868183136,0.9818044900894165,0.9848774671554565,0.1774778515100479,0.9637429118156433,0.12569500505924225
"When we were children (we were seven), one of our favorite games was to throw us on dad. He, lying on his side, made the sow and us the pigs. My father is always sorry to have not been able to breastfeed, although at a certain point I believed that he was pregnant. I had come to this belief because I had misunderstood the confused explanations on the birth of the children of my babysitter, and also because of certain scandalist articles on my family. The articles talked about the divorce of my parents and a mysterious and exotic woman (only later I understood that it was my stepmother, sonali, considered exotic, I imagine, because it comes from Calcutta) and of an ""extramarital"" child. This word, extrematimonial, made me think of extraterrestrials. Perhaps for this reason, the press dealt so much about us. ""Extramatrimonial"" also made me think of paranormal phenomena, and my father had a great belly, just like a nine -month -old woman. I liked it like that, fat or robust that you want to say. The people who advised him diets irritated me - I didn't want to lose even a little dad my dad. It was soft to embrace, it was a lot, and I wanted it all.",0.1851005016360432,0.9756118059158325,0.8604550361633301,0.9921723008155823,0.9402242302894592,0.9964886903762817,0.5417654514312744,0.9967033267021179,0.9866223931312561,0.0865119993686676,0.5633867383003235,0.8770230412483215,0.00035511385067366064,0.8681675791740417,0.8512976765632629,0.9823217988014221,0.9743142127990723,0.8740666508674622,0.9897987842559814,0.003949783276766539
"You are right. I apologize if I appeared bored or annoyed and if I was abrupt with all those who pointed it out to me. I really look like ingrid Bergman. Really. So ... what should I do? What do you want from me? Having admitted the similarity, I have the impression that you expect that I do something, but what? Do you want me to declare something? What? Being their daughter, I could look like my mom or dad - I think I have to say I was lucky to have taken from her. And ... tell me, isn't it normal to look like a parent? You want me to agree with that woman who wrote to ""Vogue"", after reading an article on me: ""Isabella Rossellini has the presumption of believing that her career is the result of her talent, instead of her extraordinary similarity to the mother"". Ouch! Genre statements hurt! But is it all here? Are they just the approximate copy of Ingrid Bergman? A kind of imposture?",0.1851005016360432,0.06935318559408188,0.6787398457527161,0.982033371925354,0.06889059394598007,0.7758045792579651,0.0071349977515637875,0.9898830056190491,0.6054313778877258,0.3394455015659332,0.7332011461257935,0.8923336863517761,0.013060463592410088,0.008256875909864902,0.01925787143409252,0.9916185140609741,0.9969913363456726,0.9788743853569031,0.8587126135826111,0.9281006455421448
"The objects that decorate my apartment have a story, they are not only for beauty. There is the miniature of the Naples market, which makes me think of a city that I love so much but that I see rarely. Around my sink, there are stones each from a significant place for me. One is by Dannholmen, the Swedish island where with mom we spent every summer holiday and where she wanted her ashes to be scattered. There is a black stone of the Volcanica Stromboli, where my parents met, fell in love and shot the film with that title. There is the Sampietrino of Rome, which makes me think of my hometown, and the movement of '68, when the cobblestones were launched against the police. [...] On the bedside table near my bed there are Madonne, Cristi, Vishnù, Crucifixes, devils, burning souls, horns and Buddha: all together, maybe one protects me more than another, and also to celebrate the coexistence of religions . There is the ""Bee Board"", the ""bee panel"", which David Lynch made for me baptizing one by one the bees that had found death near an end: Hank, Bob, Dave ... etc. , a tribute to my love for animals and its ""chicken kit"", chicken kit, with instructions on how to put a slaughtered chicken together, like those who buy the supermarket.",0.1851005016360432,0.9551230669021606,0.9983115196228027,0.014295660890638828,0.9952517747879028,0.9721992015838623,0.5221564173698425,0.9909695982933044,0.8550986051559448,0.30058205127716064,0.6805946826934814,0.7857341766357422,0.0003743667621165514,0.02184933051466942,0.9980985522270203,0.9962377548217773,0.036660220474004745,0.5265055298805237,0.9430630207061768,0.0864356979727745
"My mother, on the other hand, had great physical energy. He walked quickly and when he was not engaged on the set to shoot a movie, he cleaned and reordered the meticolosamentte house. Mom loved to act and clean. Act more than anything else in the world. It took me some time to resign myself. I wanted to be in the first place. When he wondered mom who was the most important thing for her, he blushed and became nervous, but not knowing how to lie, nor be diplomatic, he replied ""acting"", although I knew that, for our good, he would have liked to be able to answer ""mine family"". Once in his dressing room, he said to me: «If for any reason I could not be an actress, I would still work for the theater. I would do, that I know ... the seamstress, or any other profession that would allow me to work in the theater ». This was the only time I heard my mother mention an alternative to acting, in case she had not had luck as an actress, but obviously this risk never existed, so much her career was extraordinary from the beginning. The alternative of seamstress makes the idea of ​​how a few times mom has taken into consideration the concrete alternatives to acting. There is this saying among the American cowboys: ""I want to die with my boots on"", I want to die wearing the boots, that is, on horseback, still young and strong, pierced by a bullet, rather than aging. Mom repeated it often. He worried about not being able to work until the last moment of his life. He frightened her the idea of ​​losing health, energy and, consequently, of not being able to recite. To the question ""What is the most important requirement for an actress?"" He always replied: ""Good health"". To the question ""What is the most important requirement for a happy life?"" He replied: ""Good health and little memory"".",0.1851005016360432,0.8058221340179443,0.8557609915733337,0.9547744393348694,0.4361015856266022,0.8837550282478333,0.06667729467153549,0.651338517665863,0.18956013023853302,0.21606819331645966,0.4874248802661896,0.6001377105712891,0.007315187714993954,0.34874099493026733,0.9198411703109741,0.9753763675689697,0.9912164211273193,0.13495945930480957,0.8917141556739807,0.9500964283943176
