"Maybe I had learned to act. [...] But for sure I had not yet learned to be a diva; My behavior continued to be shy, shy, that of a girl looking for work stubbornly but with humility. [...] At the projection room where I tried to go unnoticed and almost to hide in one of the last rows. Too bad, because I also ran the. Risk of spoiling the effect (and spending) of the dress that the Gori sisters of via Condotti had recommended to me: a long black skirt with a tunic with large shaded roses and a jacket of tiny black feathers. [...] I thought of this while I saw myself on the screen [...] the applause on the open scene, in the dark, began. When the lights took on, it seemed to me that the room turned against me: everyone turned their backs on the screen to praise Doris Duranti curled up there at the bottom. [...] There was no critic who finds the film less than gorgeous, but only the American Gloria Wander [...] made me the compliment I was waiting for: ""White or black, you are the sexiest woman in Italy"".",0.08663799334317446,0.9158968329429626,0.944826066493988,0.48017123341560364,0.9559411406517029,0.8658556342124939,0.9936378598213196,0.2841495871543884,0.9273989200592041,0.242409810423851,0.10095378756523132,0.9354895949363708,0.46177902817726135,0.027511119842529297,0.9330084323883057,0.8939705491065979,0.995326817035675,0.9353633522987366,0.9283285737037659,0.8745949864387512
"The men of the troupe, I must say, did not show that they were suitable for the honors and charges of the imperial climate. Ah the landed, they led to complaining about the dust that mixed with their sweat streams, tried to protect their hair glued to the temples with colonial helmets and For the fear of snakes and scorpions they arm themselves with boots inside which their feet bobed. They seemed the caricatures of the misfit, of the bourgeois in chopped slippers in Eritrea. They would have given full satisfaction to the detractors of fascist Italy, instead, with my beach sands type Capri, a cotton handkerchief in the lead and my polka dot clothes, I was very well. At Asmara then, where the air was finer, I felt wonderfully and I was noticed by what I had read on the ""Sunday of the Corriere""; Our asthmara was a garden. [...] We stayed for ten days in a hotel in the chain hello. Hi, very Italian word that has become worldwide just as fascism also indicated the cordiality with which we treated our good indigenous people. Cordiality, reciprocated: I test the test during dinner in the governor's residence where some notable Eritreans, worthy people, who knew Rome, spoke Italian and knew how to stay at the table like us were invited together with us. We had taught something and, at the time of the toast, I said with sincere pride that we actors were also doing something for the empire and the Duce. [...]",0.08663799334317446,0.9152639508247375,0.9841964840888977,0.9600857496261597,0.9508166313171387,0.9619026184082031,0.9773465394973755,0.7324859499931335,0.5705728530883789,0.8599005937576294,0.04487847164273262,0.955539882183075,0.9113455414772034,0.9882518649101257,0.9884414672851562,0.9889460802078247,0.6708605289459229,0.9695064425468445,0.9708192348480225,0.006523891352117062
"At a dance at the Quirinale hotel, in the height of summer, I introduced myself with two large rims to the ears, my hair pulled and stopped with two golden combs, the tanned skin. In dancing, I turned with a light flower dress until I touched a table with the lace hem and I realized that two gentlemen stared at me. [...] ""Now Marrabo is becoming a film,"" he said ""and the protagonist of the book has a face identical to his."" ""She was an Egyptian queen too?"" «No, it's just a negretta, but it will become famous. ACCESS TO TRUE TOMORROW TOMORROW? "" [...] Holy, the maker of Chines, who took care of my appearance was again; But this time it was not a game [...] I had to become a black black one and a chocolate -colored ceron spread on my face, influenced me a very tight suit and placed a very black ispid hair wig. In front of the mirror of the trick I saw Doris Duranti turns into a splendid girl of other breed; But inside me the aspiring actress Doris Duranti, who came to the threshold of the most difficult examination of her life, was not recommended by anxieties and feelings much stronger than the hope of succeeding. [...] Fortunately, the audition contemplated a part that corresponded exactly to what I really could do better at that moment. Against a seabed there was a palm of fabric: I had to reach it, sitting under the ball, take my face in my hands and cry for a long time. I did so well that in the end the chocolate makeup had soaked in a kind of jam.",0.08663799334317446,0.947537362575531,0.9651958346366882,0.9537609219551086,0.9511784911155701,0.956417441368103,0.9610735774040222,0.6955329775810242,0.9009106159210205,0.9643229842185974,0.6978761553764343,0.9309009909629822,0.3716721832752228,0.9561692476272583,0.976443350315094,0.9632471799850464,0.9731159210205078,0.9518290758132935,0.9874535799026489,0.9562287330627441
"On the same night, with candlelight (I thought Angela already asleep) I got up from the cot, I broke the bottle of massage oil against the wall, helping me with a handkerchief so as not to make noise and with the biggest fragment I engraved the wrist twice Left: a sign of the cross that I would have brought for the rest of life. I didn't feel pain: I went back to the cot, my right hand stands eyes, the left abandoned on the floor for the blood to drain. It was then that I saw Angela get up, collect the same fragment and repeat my gesture. We didn't say anything. They were born in spite of those who put me to the world, I had lived against all the arid rules of the society at the time, and in spite of those who wanted to challenge my destiny I was leaving. [...] Those who try cold suicide and use rudimentary means to cut their veins, as I did, usually imagine one after that will come, not always coated in the other world. Think of a thread of blood that flows under the door, a cry of alarm, a gesture of pity in extremis, to a pitiful rescue that promises to all, willingly or nolent, would bring to consciousness the remorse of an early death. In mind that the thread of my blood, good blood, unreachable, stumbled upon the crack under the door, just this I was waiting for anxiety: that a surveillance subordinated was noticed. I was about to leave this world in spite of those who wanted to challenge my destiny. I was born in spite, and, in spite, I wanted to survive.",0.08663799334317446,0.9860029220581055,0.9923179745674133,0.9885653257369995,0.9895920753479004,0.9936964511871338,0.9931783676147461,0.9649215340614319,0.9812315702438354,0.9939227104187012,0.9719192385673523,0.9877861738204956,0.9781902432441711,0.9875228404998779,0.9941321611404419,0.9916762709617615,0.9925678968429565,0.9910878539085388,0.9881458878517151,0.993074893951416
"Nobody would lent me some money to be photographed, so I acted as a thief while promising to return the maltolto (and maintain). The victim was Aunt Evelina. I knew that in the drawer of the dresser he hid a purple malacca box zeep of savings and that the key always brought it with him, to an ivory ring. I made a grimaldel with a stocking needle. I didn't ask myself how I succeeded: the willpower combined with patience and a little acumen manage to blow up any lock: it was certainly not easy, but the money to pay the best photographer of Livorno, miniators, now I had them . [...] I also said a lie to the miniator photographer: he knew mine and if he had known that I meant pose for the cinema he would refused or would have been a spy. I thus invented a story of carnival and miniators also by virtue of my innate skill took taste of what a game believed. Printed the first images, he was so satisfied with not to demand a penny as long as I allowed him to exhibit the photos for the showcase of his study. He did what he preferred: I had the photos by now, the decision to change his life was stronger than ever.",0.08663799334317446,0.9587763547897339,0.9789031744003296,0.9227182269096375,0.9565566182136536,0.9516276121139526,0.9392526149749756,0.6492606401443481,0.8670616745948792,0.9723294973373413,0.6520248055458069,0.951885998249054,0.5942989587783813,0.9643792510032654,0.938426673412323,0.9911536574363708,0.9666013717651367,0.9756021499633789,0.8979203104972839,0.1320960819721222
"Since the film was to be ""true African"", the other actors had to be collected among the indigenous people. If years later, the neorealist cinema invented the actors ""taken from the road"", we preceded it with those ""taken from Busch"". [...] Explaining to these people what cinema was complicated. The interpreters were picked up because, on the most beautiful of the lesson, there was always someone who exploded in an unusual laugh. Others, vice versa, listened to impassive, closed in a severe expression, like reproaching. There was to despair that they became actors. (Later we would notice with wonder that they recited so well, so intensely, that the professionals are annoyed).",0.08401442295871675,0.3201635479927063,0.9936501383781433,0.9594611525535583,0.9507735967636108,0.8542382717132568,0.9865031242370605,0.9829315543174744,0.9867475032806396,0.8477281928062439,0.9543251395225525,0.8591160774230957,0.007080429699271917,0.9757077097892761,0.9928668141365051,0.06827451288700104,0.8661379814147949,0.9954769611358643,0.9871393442153931,0.17381949722766876
"The scream with which I had deleted operators, electricians, actors and director on the set of Geneva degli Almieri echoed long enough in the Chines environments, influenced Golfi di Napoli of papier -mâché, crossed ease of fabric, natural halouche camels of natural size oscillating on swing species, touched the eardrums of the director to live!, Guido Brignone, who offered me one participation in the film. [...] I had a more consistent contract for shooting white Amazons by Gennaro Righelli, protagonist Paola Barbara, a diva. I became friendly by showing her my admiration with humility and I discovered that her divine forms enclosed a very simple and kind soul, [...] I behaved as shy, I seemed clumsy and not very communicative, ready for redness, served with everyone and not anxious at all to arrive.",0.08401442295871675,0.9302150011062622,0.9944785237312317,0.8940826654434204,0.9618147015571594,0.9932364225387573,0.9974100589752197,0.8734153509140015,0.8935752511024475,0.06066819652915001,0.9285670518875122,0.994520366191864,0.12057698518037796,0.9413767457008362,0.9885149002075195,0.8904943466186523,0.9972399473190308,0.9948234558105469,0.992864727973938,0.8438572287559509
"When the war broke out I was six years old, when eleven ended. My eyes were full of images that I could no longer delete. If I think of the first memories, the bombs, the sound of the anti -aircraft siren, the bites of hunger, restores. And then the cold, the darkest darkness. Every now and then, suddenly, I get afraid. It seems incredible, but still today I sleep with the light on. The Germans came first, who at the beginning were our allies. In the morning they marched in the house, tall, blondes, with blue eyes, and I observed them from the window, kidnapped, divided between fear and excitement. At my gaze as a child they did not seem bad or dangerous, but the grandparents, who sometimes happened to listen without wanting, spoke of Jews and deportations, of torture and torn nails, of retaliations and betrayals, and gave it a very different image . At that point, I ran to the kitchen and question them, but they denied them. ""Don't say anything,"" they replied impassive. The truth is that we were in the eye of the cyclone and we know how to do it soon. Slowly everything stopped - the school, the cinema theater Sacchini, the concerts of the band in the square -, everything except the bombs.",0.08401442295871675,0.8011298179626465,0.9823880195617676,0.9202677607536316,0.9837040901184082,0.9602776765823364,0.9812906384468079,0.8271104097366333,0.9619902968406677,0.9243695735931396,0.10711692273616791,0.7908036708831787,0.6895493268966675,0.9373085498809814,0.9711209535598755,0.9917865991592407,0.9417147636413574,0.9626663327217102,0.9342408180236816,0.016855113208293915
"If in the cinema I prefer passionate and tragic parts, the strong, emotional characters, in life I would like to be the whole opposite: cold, controlled, introverted. That is, normal. But normality escapes me, my joy of living, my liveliness, my temperament prevent me. Therefore, I try to establish myself through art, interpreting uncommon characters towards whom I feel brought precisely because they are so different from what I would like to be in life. That's all. And it's not a little.",0.08401442295871675,0.9901893138885498,0.9615639448165894,0.22341224551200867,0.21318240463733673,0.9705184102058411,0.019609132781624794,0.03918486833572388,0.47579944133758545,0.017730120569467545,0.400613397359848,0.9919031858444214,0.0017013802425935864,0.6564138531684875,0.10988692939281464,0.40617623925209045,0.5089418292045593,0.7534051537513733,0.9906489253044128,0.05156037583947182
"Fortunately, fate, close to obstacles, often also makes you find a surprise, a trace of wind that reverses the route, the announcement of a solution. And so it was for us. Goffredo Lombardo's wife, the producer who had invented my name of art, had lived an Odyssey similar to mine and had run into the right person. A man before a doctor. His name was Hubert de Watteville and he directed the Gynecology Clinic of the Cantonal Hospital in Geneva. He was a tall and very thin gentleman, in the sixties, the aquiline nose and the aristocratic ways, a little detached. At the beginning I was disappointed, I was looking for a welcoming father more than a professional aseptic. But I was wrong. Knowing him, I would have found in him one of the most affectionate and sensitive men I ever have in contract. He himself without children, had poured his desire for paternity in work, and the children who helped to be born were also a bit of his. After studying my case for a long time, it came to much more optimistic conclusions than I expected. ""There is nothing wrong, she is a normal woman. The next time it will remain pregnant, we will have to monitor it closely to understand exactly how to intervene. He will see, this time everything will be fine. """,0.08401442295871675,0.9802118539810181,0.9854401350021362,0.9657862186431885,0.9859539270401001,0.9874994158744812,0.9904939532279968,0.9938310384750366,0.9899373054504395,0.9839254021644592,0.6883758902549744,0.9793479442596436,0.9432335495948792,0.9858723878860474,0.9570973515510559,0.9939113259315491,0.9945505857467651,0.9782885909080505,0.9629600644111633,0.5816459059715271
"Carlo [Ponti] was thirty -nine years old, twenty -two more than me, and it was already a name, in the middle of his dazzling career. As he went carefully to tell me when he came to present himself at the end of the competition, he had discovered great divers such as Gina Lollobrigida, Sylva Koscina, my beloved Lucia Bosè. ""Let's take a walk in the park? It is an enchanting place, they call it ""the garden of the roses"", he will hear what perfume ... »Meanwhile he made me raise, putting my light organic shawl on my shoulders. ""Here we go,"" I said, preparing me inside me to reject the usual advances. In reality, Carlo was very professional and he earned my trust instantly. He told me about the films he was doing, he asked me about me, he sounded my intentions. «Where does Miss come from? Ah, Pozzuoli? If I'm not mistaken, there is a beautiful Roman amphitheater ... I was there a few years ago. "" ""He is right in front of my house, we see him from our windows,"" I replied, grateful who had found a common point between us. Immediately he communicated me an extraordinary sense of security and familiarity, as if we had always known each other. I had the strange impression that he understood me, that he had read behind my impetuous beauty the traces of a reserved character, of a difficult past, of a great desire to do well, with seriousness and passion. For me it was not a game, it was much more.",0.08401442295871675,0.864657461643219,0.9483330845832825,0.8616670966148376,0.8612810969352722,0.023080771788954735,0.10614795237779617,0.47213631868362427,0.42933526635169983,0.9046135544776917,0.04437803104519844,0.8081768155097961,0.009646694175899029,0.873064398765564,0.7610909938812256,0.9658229351043701,0.9437138438224792,0.7788789868354797,0.3107459545135498,0.13803787529468536
"Three years later Marcello would also disappear [Mastroianni ed.]. The last time I saw him was in Milan. He entered his car to go to the theater to try the last moons, by Furio Bordon. I went up to mine, directed to the airport. Marcello launched me a very long look, perhaps guessing that we would never have seen each other again. I still find it hard to return to the days of his death. The world spoke, declaimed, attended, celebrated. I was closed in my room, surrounded by my modesty. I didn't want to drain my pain to that of others, I didn't want to flag my feelings for the use and consumption of the media. I was alone, looking for a way to fully understand what had happened. On his funeral day I sent an orchid carpet, so that they accompanied him with their delicate freshness. And they brought him my love ever.",0.08401442295871675,0.9794172048568726,0.9956590533256531,0.985203742980957,0.9929226040840149,0.9963377118110657,0.9967215657234192,0.9940236806869507,0.9805464744567871,0.9071000218391418,0.6041187047958374,0.9919967651367188,0.985842764377594,0.9961195588111877,0.9927839636802673,0.9766499400138855,0.9905314445495605,0.9947208762168884,0.9969339370727539,0.45994722843170166
"Meanwhile, I lived my life as I could, hid behind a thin but tenacious veil of shyness. Yes, it is difficult to believe, but I was truly shy, perhaps also because of our condition. My father was not there and my mother was too blonde, tall, alive, and above all unmarried. Its eccentric beauty and over the top put me embarrassed. I dreamed of a normal and reassuring mom, with black hair, the stroped apron, the ruined hands and tired eyes.",0.08401442295871675,0.24736590683460236,0.9770955443382263,0.8647587895393372,0.6034570932388306,0.9966126084327698,0.7269454598426819,0.996052622795105,0.9405032992362976,0.3891516923904419,0.2868674099445343,0.9137985706329346,0.0018717515049502254,0.09392960369586945,0.36425504088401794,0.8850603103637695,0.9892187714576721,0.991580069065094,0.8552471399307251,0.08877667039632797
"While I started relaxing, I let myself be brought an innocent joke. Or maybe not .. «Cary sent me a bouquet of yellow roses before I left. Yellow jealousy? How cute it is ... ""Carlo turned off and printed me a slap, under everyone's eyes. In any case, the white imprint of its fingertips on my red cheek burned with anger and shame. I felt the tears go down one by one on the face. I felt I died, but inside me I knew that somehow I was looking for it. And I don't think about it. At twenty years old he must learn to live, and Cary's love had given me a lot. Perhaps also the courage to fight for a normal life with Carlo. On the other hand, I was young but not stupid. I sensed that that slap, today as today difficult to understand, was the gesture of a man in love, who had seen himself threatened by another man, had risked getting lost and only now was he recovering from fear, sorrow. I cried but not too much because the airplane was full. The hostess approached asking me timidly if I needed something.",0.08545299340039492,0.965928316116333,0.9932712316513062,0.9758263230323792,0.9934578537940979,0.9959770441055298,0.9978043437004089,0.981335461139679,0.991485059261322,0.9795612692832947,0.7937852144241333,0.9884588122367859,0.9932405352592468,0.9926899671554565,0.9912933707237244,0.9952232837677002,0.9885696768760681,0.9949215650558472,0.9930387139320374,0.7786049246788025
"All of a sudden I had become a diva, with a press office dedicated to spreading my image at best, but inside me I was always a shelled girl who wanted to become an actress, a woman who wanted to get married and have children, like all The other women. I lived ups and downs like everyone else, and I worked with passion and discipline, as always. I grew inside my little big fairy tale while I built it day after day, line after line, page after page.",0.08545299340039492,0.9818503856658936,0.9397931098937988,0.6279972195625305,0.9091157913208008,0.9182525277137756,0.989751398563385,0.9809786081314087,0.9638634920120239,0.9771692752838135,0.16356541216373444,0.9870999455451965,0.0050753457471728325,0.0035945044364780188,0.8842184543609619,0.9857969284057617,0.9960896968841553,0.9873942136764526,0.02883066050708294,0.9855300188064575
"The first to believe in me for sin that it is a rogue was Suso Cecchi D’Amico, the only woman in the parterre of the great screenwriters of the time. ""The oak that made a lot of Italian cinema flourish among its branches"" as Lina Wertmüller defines it. Reading the Roman tales of Moravia, Suso had come across a beautiful story that was right at the beginning of the new fanatic. I remember that we met one day on the train. After having glimpsed me at the station, he came to my compartment and sat down next to me, with a confidence that immediately put me at ease. ""I have a subject for you in mind,"" he said simply, looking at me straight in the eyes. ""Why not?!"" I replied immediately with my usual momentum. Suso had worked on the story with Flaiano, Moravia and Persenza, and had proposed it to Blasetti, who at the time was looking for the subject for a film. [...] After our short railway meeting Suso, supported by Flaiano and Blasetti himself, insisted with the producers until the part is obtained for me.",0.08545299340039492,0.8807374835014343,0.9702465534210205,0.7934303283691406,0.980432391166687,0.8691772818565369,0.9931558966636658,0.5118244886398315,0.9493198990821838,0.2954249978065491,0.37032410502433777,0.9428895711898804,0.8334029316902161,0.14630486071109772,0.9541887640953064,0.9621090292930603,0.9951952695846558,0.9833342432975769,0.8988916873931885,0.7505104541778564
"The contractions intensified, as if I were in labor, and I was yellow like a lemon. My mother, who had reached us, lashed out against him [the gynecologist, ed.] With all his strength: «Doesn't he see what face he has? He is losing the child! ». But it was useless. His cocktail could not wait. When the pains ceased at four in the morning suddenly, I understood that it was all over. It was Ines who called him, in front of the accomplished fact. He came calmly, towards six, and he was the one to say the least: ""Madam, she certainly has some beautiful hips, she is a beautiful woman, but she will never have a son"". His words made me feel incapable, arid, deeply inadequate, and annihilated all my hope. Other than a fairy tale. My life was taking a sad and without future drift. To make everything more difficult, the newspapers thought about it, who did not take time to flag our pain to the four winds.  ""Now I can return to the set to finish the film,"" I said to Carlo, as soon as he set foot in my room directly from the airport. I was trying in vain to be brilliant, to take the hard. His smile marked in a grimace, letting all his sense of helplessness leak. Only at that moment did I let myself go, abandoning myself to a crush in Dirotto that did not end anymore.",0.08545299340039492,0.9450139403343201,0.986005961894989,0.9737651348114014,0.969409704208374,0.9873791337013245,0.9880269765853882,0.9906775951385498,0.9518827199935913,0.9683669805526733,0.4422365128993988,0.9643764495849609,0.4611574709415436,0.9860005378723145,0.9729359745979309,0.9832059741020203,0.9787044525146484,0.989119827747345,0.9889469742774963,0.21566736698150635
"[...] With the money earned one million lire, Mommy, Maria and I moved to a larger apartment in via Balzani and I could finally redeem my sister's honor. My father, if ever for a moment there had been, had definitively disappeared from my life, I no longer tried to love him. Precisely for this reason it was not difficult to turn to Aida's cachet by obtaining a surname in return: for me an empty shell, for my sister salvation. Maria Villani became Maria Scicolone and was finally able to turn the page, return to school, start living. It is perhaps useless to dwell on the sequel to the sad story. However, I was saved. With my means, as I could, I had traveled our family history, to understand what as a child appeared too big to face. And I had come to my conclusions. Not all men were like Riccardo Scicolone, not all the events had to repeat themselves. At my side I wanted a different person, who could make me really happy. I still didn't know with certainty, but life soon would show me that I, my ideal man, had already met him.",0.08545299340039492,0.9958680272102356,0.9965488910675049,0.9852151870727539,0.9949243664741516,0.996957004070282,0.9974008202552795,0.9965122938156128,0.9955698251724243,0.9821522831916809,0.9931759238243103,0.9954632520675659,0.9958727359771729,0.996258556842804,0.9961726665496826,0.9961905479431152,0.996330976486206,0.9968104958534241,0.9942284226417542,0.9906097054481506
