"Nel 1957, al Festival del cinema di Venezia, ho visto il mio primo film in sala: e fu Le notti bianche di Luchino Visconti. Mi ricordo perfettamente la premiazione. Quando, a quello di Visconti, fu preferito il film di Satyayit Ray Aparayito, e lui ebbe il Leone d’argento, salì a prenderlo, sul palco, con un paio di battute ironiche: «Preferisco fare l’indiano», e poi citò il Corano: «Il silenzio è d’oro, la parola è d’argento». Io sedevo in platea accanto a Rossana Podestà, a Rino Salviati, a Bozzini e a Salvatore Argento, che all’epoca erano i di rettori dell’UnitaliaFilm, organizzatrice della settimana del cinema italiano a Tunisi, nell’ambito della quale c’era stato il concorso della «più bella italiana di Tunisia» vinto da me in maniera del tutto involontaria e inconsapevole. Tutta questa gente mi aveva adottata, mi trattava come una figlia. Io alloggiavo, con mia madre, in un alberghetto del Lido. E da lì raggiungevo ogni mattina la spiaggia dell’Excelsior, dove c’erano tutti: ricordo Renato Salvatori, una quantità incredibile di registi, produttori. E c’era anche Franco Cristaldi...",0.18716696393676102,0.9912707209587097,0.05711354687809944,0.5448886752128601,0.8319611549377441,0.9981265664100647,0.9886062145233154,0.9909601211547852,0.9763660430908203,0.8558315634727478,0.9115031361579895,0.9813372492790222,0.16383300721645355,0.9963611960411072,0.8680823445320129,0.9884680509567261,0.9478926062583923,0.9267226457595825,0.9646033644676208,0.9130730628967285
"Spesso gli attori sono belli come li si vede sullo schermo. Ma sono molto più infelici di quanto non appaia e non si sappia. Sono infelici in maniera più o meno uguale, gli uomini e le donne. Perché è ugualmente difficile, per gli uni e le altre, convivere con il mito di se stessi: diventare un sex Symbol significa poi, per tutto il resto della vita, fare continuamente i conti con l’angoscia di non essere all’altezza del proprio mito, con la paura di deludere la gente che ti incontrerà per strada, con l’ansia di perdere il proprio potere di seduzione. Dall’angoscia e dall’insicurezza alla nevrosi, fino, in qualche caso, alla malattia e alla paranoia: il passo è relativamente breve.",0.18716696393676102,0.9267227649688721,0.2249290496110916,0.6102075576782227,0.5390815138816833,0.9684093594551086,0.22791822254657745,0.04506304860115051,0.09043195098638535,0.5726097226142883,0.860995888710022,0.974801778793335,0.25576767325401306,0.988618016242981,0.43850234150886536,0.978717565536499,0.9121547341346741,0.2782411575317383,0.9318153262138367,0.27724725008010864
"Grazie al cielo, non mi sono mai confusa con la ragazza che appariva fotografata sui giornali. Altrimenti avrei perso la testa. La gente talvolta si stupisce che il mio amico Alain Delon parli di sé in terza persona. Il fatto è che solitamente si ignora cosa significhi una vita da star; dicerie sul nostro conto, nugoli di cortigiani, servitori che ci fanno vedere il mondo come un vasto satellite. Più veniamo idolatrati, più dobbiamo essere forti per non smarrire la nostra identità di essere umani. Ho avuto la fortuna di essere sempre stata consapevole della mia identità. Quando mi guardo sullo schermo, so che non sono veramente io, ma qualcuno che mi assomiglia. Non ho mai confuso i ruoli. E quando per strada incrocio qualcuno che mi sorride, sono semplicemente felice, come se si complimentasse con me per aver lavorato bene. Non ho mai cercato di sedurre, di mentire, mi sono limitata a cercare di far sognare.",0.18716696393676102,0.976665735244751,0.20967328548431396,0.5924333930015564,0.9559179544448853,0.9874846339225769,0.2701375186443329,0.23587198555469513,0.3235803544521332,0.07259643077850342,0.058116164058446884,0.966696560382843,0.5738212466239929,0.9882614016532898,0.9284173250198364,0.9933144450187683,0.733368992805481,0.17948420345783234,0.9464016556739807,0.8314793109893799
"Nel 1962, Marilyn Monroe si è suicidata. Aveva trentasei anni. Quella notizia esplose come una bomba in quegli anni di dolce vita, come l’annuncio di una maledizione divina, di una punizione lanciata su una donna troppo bella che aveva giocato troppo con il desiderio degli uomini... Sono stata intervistata da alcuni giornalisti al riguardo. Mi hanno chiesto se avevo paura di quel destino d’attrice. Perché quel confronto? Era assurdo. Non avevamo nulla in comune, Marylin e io. Non mi sentivo coinvolta da quella morte più di quanto potesse esserlo qualunque altra ragazza della mia generazione. Ma comprendevo lo smarrimento, la disperazione di Marilyn. Ecco una star che si era perduta. Ma lei non aveva nulla a cui aggrapparsi! Non solo le mancava il grande amore. La presenza di una segretaria, di un medico, di amanti passeggeri, non potevano nulla contro la solitudine e la sofferenza dell’infanzia, l’assenza della famiglia. Era stata gettata in pasto al pubblico senza nessuno che la proteggesse, accrescendo la sua fragilità. Io, al contrario, mi sentivo molto forte, e soprattutto profondamente normale. Lo devo a papà, a mamma, a Blanche, Bruno, Adrien, e Beppo, il nostro cane lupo. La mia famiglia mi dava sicurezza e normalità. A casa, si parlava degli studi di elettronica dei miei fratelli, nello stesso modo in cui si parlava delle riprese di un mio film. Tutti noi avevamo dei sogni, dei desideri, dei lavori. Adrien è diventato cameraman, ma Blanche non ha potuto seguire le mie orme nel cinema. Era difficile imporre un’altra Cardinale. In ogni caso è ciò che sosteneva Cristaldi. Certo, il mio mestiere era un po’ strano, non soltanto perché guadagnavo molto di più rispetto a tutti gli altri, ma perché proseguiva al di fuori del set, durante le serate in abito lungo, le sedute dal fotografo, le interviste. Ma io restavo Claude, la sorella maggiore che aveva un’agenda da ministro, e che altri trattavano come una star. I reporter venivano a intervistarmi su questo, su quello, ma in famiglia la mia opinione non contava più delle altre. Non si parlava neppure della gente famosa che conoscevo. Sarebbe stato già molto se mia madre avesse concesso loro di chiamarli «persone perbene». Avevano troppi soldi ed erano troppo famosi. Fingeva che non esistessero. Quel mondo un po’ equivoco restava fuori dalle mura domestiche.",0.19462327449582517,0.958258867263794,0.9491086006164551,0.8325513005256653,0.9580016136169434,0.9786572456359863,0.9593288898468018,0.9895924925804138,0.9571540951728821,0.9497445821762085,0.9413855671882629,0.9569945335388184,0.9268128871917725,0.9814481139183044,0.8631783127784729,0.9812327027320862,0.985633909702301,0.9146263003349304,0.9630476832389832,0.9772951602935791
"Rita Hayworth era sconvolgente. Viveva la peggior tragedia per una star: una lenta decadenza. Era già ammalata di Alzheimer quando l’ho conosciuta? Lo ignoro. So soltanto che era profondamente infelice. Un giorno, sul set del Circo, l’abbiamo vista arrivare con dei lividi sul viso. Non so chi l’avesse ridotta in quel modo. Ma credo che avesse molti problemi con i figli che non tolleravano di vederla bere. Era straziante incontrare una dea ridotta in quello stato. Mi sentivo quasi a disagio, con i miei ventiquattro anni, il mio sorriso, i miei successi. Avrei voluto abbracciarla, consolarla. Un giorno, ci siamo ritrovate insieme davanti alle luci degli specchi, per un ritocco tra una scena e l’altra. Guardandomi mi ha detto: «Anch’io, sono stata bella». Un complimento che non nascondeva una certa ostilità. Non sono riuscita a trattenermi e ho pianto. La mia emozione l’ha toccata. Davanti a quella luce accecante, che non perdona, abbiamo lasciato cadere la maschera. Io mi sentivo impotente. Non si poteva far altro che arrendersi al destino, e forse, per un attimo, accompagnarla lungo il suo ultimo tratto di strada. Ci si stupirà forse di sapere che sul set le relazioni intime si stringono in questo modo, e che sovente finiscono con l’ultimo ciak. Ma è così. Noi attori, abbiamo una sola famiglia sulla scena: quella che il casting ci ha dato.",0.19462327449582517,0.9364390969276428,0.14188505709171295,0.35275977849960327,0.8547996878623962,0.9463704228401184,0.2408919334411621,0.9858835935592651,0.26347723603248596,0.8929477334022522,0.8235474228858948,0.7913728952407837,0.06308137625455856,0.8901453018188477,0.6017283797264099,0.9612729549407959,0.9453330039978027,0.38269805908203125,0.9416802525520325,0.9129694104194641
"Visconti si divertiva a provocarci. «Claudine, non voglio baci finti, finte carezze...» Ho agito d’astuzia, ho giocato a mia volta, e Luchino mi ha apprezzata di più: non sono caduta nella trappola, dimostrandogli che, malgrado il mio sorriso, la mia sensualità, la mia apparente dolcezza, ero una donna forte. Del resto non poteva che amare le donne di carattere; le Chanel, le Dietrich. Sulla sua scrivania, a Roma, c’era una sola foto, firmata «I love you», l’Angelo azzurro.",0.19462327449582517,0.9151542782783508,0.026125604286789894,0.4979565739631653,0.9024926424026489,0.9533253312110901,0.4825162887573242,0.18961097300052643,0.5021190643310547,0.6299944519996643,0.6755287051200867,0.9799745082855225,0.0030541226733475924,0.9620151519775391,0.739657998085022,0.9849867224693298,0.9960057139396667,0.5026070475578308,0.8937898278236389,0.9053033590316772
"Nessuno in casa ha mai pensato di chiamarmi «Claudia», lo ero Claude, un nome androgino che ben si addiceva alla mia natura di maschiaccio, sempre sudata, chiassosa, scavezzacollo, refrattaria a ogni fronzolo femminile. Sul mio registro di stato civile figurano anche i nomi di Joséphine e Rose  le mie nonne , anch'essi adeguati allo stile coloniale.",0.19462327449582517,0.8396905064582825,0.798761785030365,0.06554125249385834,0.8284336924552917,0.5633035898208618,0.04808570817112923,0.960943341255188,0.19542664289474487,0.475039541721344,0.40828070044517517,0.8632385730743408,0.39301598072052,0.6979836821556091,0.8148991465568542,0.9776334762573242,0.9849823117256165,0.5572925806045532,0.5678938627243042,0.709880530834198
"E io non avevo più incontrato l’amore, quello che sognano le ragazze. Il grande amore. Sui set, per tutti ero la signorina del produttore. Un modello di attrice del tutto comune. Si potevano citare De Laurentiis e Silvana Mangano, David O. Selznick e Jennifer Jones, Carlo Ponti e Sophia Loren... ma anche Franco Cristaldi e Claudia Cardinale. Ero senza dubbio la sola a essere stata sorpresa da questo finale, questa metamorfosi, lenta, progressiva, della nostra relazione. Franco aveva sempre provveduto a tutto, si era sempre occupato di me. A forza di essere come un marito, alla fine lo era diventato. Quasi. Perché era già sposato. Ma al momento del nostro incontro, era separato. Io non ho mai rubato il marito a nessuno. Tuttavia era quella la libertà che sognavo quando, a diciotto anni, avevo deciso di trovare i mezzi per allevare da sola mio figlio? Cristaldi possedeva molte qualità. Era seducente, e io gli ero infinitamente grata di avermi aiutata all’epoca in cui mi sentivo smarrita, ma trascorreva gran parte del suo tempo in un piccolo immobile di tre piani: i suoi uffici. Mi regalava gioielli, pellicce, ma avevo la sensazione che lo facesse più per convenzione che per un autentico slancio emotivo. Continuava a comperarmi. Ed era soprattutto questo a farmi sentire a disagio, così mi davo da fare per dimostrargli che non avevo bisogno di niente, non domandavo mai niente, non incoraggiavo niente. E poi non eravamo quasi mai da soli io e lui.",0.19462327449582517,0.9756155014038086,0.6169984936714172,0.48271602392196655,0.9076444506645203,0.9781177639961243,0.7841300368309021,0.7982998490333557,0.10437514632940292,0.7360009551048279,0.5990750789642334,0.9757871031761169,0.09529616683721542,0.9742664098739624,0.37096428871154785,0.9495579600334167,0.9429901242256165,0.6235253214836121,0.902857780456543,0.9707558751106262
"Cristaldi era stato avvocato prima di diventare produttore. Decine di pagine organizzavano la mia vita professionale, fissavano l'importo del mio salario mensile, determinato preliminarmente e indipendentemente dall’importanza dei miei cachet incassati dai produttori. Pagine che stabilivano i nomi dei sarti che mi vestivano, le spese di cui la Vides si faceva carico, il seguito composto da autista, segretaria, addetto stampa. La mia vita era controllata. Passo dopo passo. Con quegli articoli, quei comma, quei capitoli sui quali avevo posto la mia firma, avevo venduto la mia anima. Il patto mi obbligava a rinunciare al mio libero arbitrio. Non avevo più diritto alla mia immagine. La Vides mi aveva comperata come una merce: colore e lunghezza dei capelli, misure, tutto era scritto senza che io potessi apporre anche la più piccola modifica. Ogni decisione che riguardava la mia vita personale doveva essere presa in accordo con i miei produttori. Cristaldi era buono e generoso, ma non mancava mai di ricordarmi che mi aveva creata e che di conseguenza gli appartenevo. Ancora oggi, tanti anni dopo la nostra separazione, tanti anni dopo la sua morte, non ho dimenticato nulla.",0.19462327449582517,0.16043131053447723,0.7972535490989685,0.9515680074691772,0.9576959013938904,0.9956475496292114,0.9409864544868469,0.9644817113876343,0.7253357768058777,0.9708771705627441,0.888003945350647,0.9708769917488098,0.4967471659183502,0.991692066192627,0.7247396111488342,0.9966778755187988,0.8522120118141174,0.9879608154296875,0.9732006192207336,0.9724700450897217
"Le donne non mi considerano una rivale, gli uomini mi parlano con rispetto, anche se, talvolta, mi chiamano Gina o Sophia. Raramente sono stata aggredita, una volta forse qualcuno mi ha gridato: «Ti trucchi troppo!». Ho messo fine alla conversazione, rispondendo: «Fatti gli affari tuoi!». Probabilmente il fatto di non aver mai avuto paura mi ha protetto, facilitandomi la vita. Oggi, non ho niente da nascondere. Sono come sono.",0.19462327449582517,0.9837292432785034,0.4786930978298187,0.6678432822227478,0.7763285636901855,0.9948309063911438,0.37615469098091125,0.6950427293777466,0.6680930256843567,0.19526949524879456,0.48374438285827637,0.9593494534492493,0.5637093782424927,0.9972884058952332,0.5274366140365601,0.9949256181716919,0.995576024055481,0.8857253193855286,0.8956903219223022,0.8543345332145691
"Per riallacciare con il quotidiano, ciascuno ha i suoi riti. Io ho bisogno di solitudine, di silenzio. Dopo il passaggio in camerino, dopo essermi struccata, come il clown del circo, Claudia ridiventa Claude. E rientro a casa, dove tutto è al suo posto. Tutti coloro che non sono abbastanza forti per ritrovare il cammino di casa, nel terremoto perenne delle nostre carriere, rischiano che le loro vite si tramutino in tragedie.",0.19462327449582517,0.6988239288330078,0.8844244480133057,0.6671118140220642,0.9230918884277344,0.9923211932182312,0.7690043449401855,0.8906899094581604,0.32729819416999817,0.8459506034851074,0.7302743792533875,0.97381991147995,0.06443794071674347,0.984260618686676,0.9060251712799072,0.9987209439277649,0.8822197914123535,0.4680895507335663,0.9403524398803711,0.7580823302268982
"Senza aver bisogno di alcuna confidenza, Visconti aveva capito tutto della violenza che nascondevo. Amava sentire che un’ombra pesava sul passato dei suoi attori, perché aggiungeva quella parte di mistero che dava spessore ai suoi personaggi. I registi sono sempre un po’ medium. Ma nessuno meglio di Valerio Zurlini ha indovinato che cosa faceva di me una ragazza diversa, un’attrice che non rientrava in nessun gruppo, nessuna cricca. È con lui che avrei girato La ragazza con la valigia, il mio primo grande ruolo.",0.1814814223907888,0.9214608669281006,0.06567418575286865,0.38627150654792786,0.9056886434555054,0.8865280151367188,0.2779225707054138,0.010890301316976547,0.3225211203098297,0.8677658438682556,0.8177698254585266,0.9593740105628967,0.10039695352315903,0.9473373293876648,0.3224385380744934,0.9838474988937378,0.5593814849853516,0.22224679589271545,0.7004348635673523,0.9506600499153137
"Quando chiedevano a Mastroianni cosa preferisse di Visconti, che l’aveva fatto debuttare in teatro, o di Fellini, che aveva fatto di lui un grande divo del cinema, rispondeva: «Visconti era il maestro che gli scolari amano e ammirano, Fellini il compagno di classe». Anche per me Visconti è stato un maestro. Ammiravo la sua cultura, la sua curiosità che gli consentivano di essere perfettamente al corrente della moda e del trucco in voga, delle canzoni di Sanremo o dei best seller. Era un appassionato di storia, di letteratura, di musica. Un maestro duro, talvolta sarcastico, ironico, crudele, che non sapeva come manifestarci il suo amore e lo esprimeva con mille piccoli regali. [...] Fellini, al contrario, si trovava a proprio agio improvvisando. Lo chiamavamo «il mago», perché possedeva un genio speciale capace di coinvolgerci nei suoi sogni. Non eludeva i problemi, li metteva davanti ai nostri occhi, come parte integrante della sua fantasticheria.",0.1814814223907888,0.9286264777183533,0.33219772577285767,0.3363804817199707,0.9595566987991333,0.967029869556427,0.38325461745262146,0.27081313729286194,0.14593914151191711,0.43593162298202515,0.599877655506134,0.9829260110855103,0.011662455275654793,0.9952651858329773,0.6723677515983582,0.9717585444450378,0.5047414898872375,0.7791985869407654,0.9215521216392517,0.7889228463172913
"Mio padre aveva due passioni: gli orologi, che smontava e rimontava con meticolosità, e il violino, che suonava per farci addormentare. Crescevo in una famiglia di musicisti: mia sorella si esercitava con il piano e nel canto, Adrien con la chitarra. La grande uscita della famiglia era per il concerto. Ma niente cinema! Dei film americani, conoscevo bene le locandine: come non notare i visi di uomini e donne incatenati in un bacio... eppure, a quindici anni, né io, né tantomeno mia sorella, più giovane di un anno, eravamo autorizzate ad assistere a spettacoli contrari alla morale. Potevamo sognare davanti alle foto affisse sui pannelli all'entrata delle sale. Ma noi ragazze non dovevamo sapere nulla della vita amorosa. E lasciamo stare la vita «sessuale», parola che non avremmo pronunciato senza arrossire. E nemmeno del semplice funzionamento del nostro corpo. A quei tempi, a scuola, si studiava la riproduzione delle amebe... e ricordo il panico che colse Blanche [la sorella] alla sua prima mestruazione, il grido sconvolto che chiamava mio padre in aiuto, e lo schiaffo che le valse quello spavento! A casa nostra era un rituale, un modo sbrigativo di insegnare alle figlie a non parlare di quelle cose là. Ogni mese sentivo mamma dire a papà, con fare mol to misterioso, che «erano sbarcati gli inglesi». Una no tizia che faceva caracollare i miei fratelli alle finestre... io sghignazzavo. A me, non la si faceva...",0.1814814223907888,0.4924139976501465,0.9952950477600098,0.9909114241600037,0.9498880505561829,0.9960975050926208,0.8609450459480286,0.9987251162528992,0.9595897793769836,0.9243859648704529,0.8932148218154907,0.8130826354026794,0.0909174308180809,0.9871342182159424,0.9223384261131287,0.9895609021186829,0.9808435440063477,0.8126127123832703,0.9741213321685791,0.8732237815856934
"In Mayrig (1991), ho trentacinque anni. È l’epoca in cui la famiglia di armeni, sfuggiti al genocidio, arriva a Marsiglia. In 588 rue Paradis, uscito lo stesso anno, ne ho ottantacinque e cammino curva. Il mago dei truccatori, un italiano, era venuto apposta da Los Angeles per lavorare a questa metamorfosi che richiedeva ore di trucco. Alla fine, guardandomi allo specchio, sono rimasta scioccata. Ero davvero io? Un giorno sarei diventata come quella vecchia signora? Non amo voltarmi a guardare il passato, ma non amo neppure immaginare il futuro. Accontentiamoci di vivere il presente!",0.1814814223907888,0.9390023946762085,0.49917110800743103,0.39453479647636414,0.9599021077156067,0.9938411116600037,0.9249918460845947,0.9929023385047913,0.6222406029701233,0.98819500207901,0.8094608783721924,0.9298251271247864,0.42881539463996887,0.970199465751648,0.7086155414581299,0.9924542307853699,0.9239846467971802,0.4541114866733551,0.9681681990623474,0.7878275513648987
"Naturalmente, stare davanti alla macchina da presa cominciava a piacermi, avevo presto compreso che sarebbe stata la mia migliore alleata, tuttavia mi distaccavo con troppa facilità dai miei personaggi, lasciando che le emozioni mi assalissero a ondate, intense ma brevi. Per me il cinema era ancora un lavoro come gli altri. È il film di Germi che mi è servito da rivelazione. Pietro non amava parlare, aveva un carattere ombroso, si esprimeva in modo burbero, bisognava cogliere al volo i suoi suggerimenti. Eppure, ha saputo farmi comprendere che non si poteva arrivare sul set con le mani in tasca e aspettare, limitandosi a obbedire al regista. Bisognava darsi, lasciarsi andare. Vale a dire lasciarsi investire, trasformare, schiavizzare dal proprio ruolo. E a prezzo di questo abbandono che l’attore dà vita a un personaggio. Questo nuovo investimento mi ha forse salvata dalle prove che accumulavo: non c’era posto per le preoccupazioni personali sul set. Un attore deve essere emozionalmente disponibile. Non può lasciarsi sommergere dai problemi, dalla sua storia personale. Si deve arrivare «vergini» e accettare l’avventura: lasciarsi guidare dal regista su una terra sconosciuta, senza temere il pericolo. La fotogenia non mi bastava più. Ma sapevo ascoltare e mi piaceva lavorare. Sulla base di queste due qualità ho costruito una carriera che non avevo scelto.",0.1814814223907888,0.924351155757904,0.46675971150398254,0.3369620144367218,0.8439332246780396,0.9484111666679382,0.6177199482917786,0.3019160330295563,0.34565556049346924,0.6247465014457703,0.7475358247756958,0.9573132395744324,0.23681306838989258,0.9809736013412476,0.6122447848320007,0.9898104071617126,0.533759593963623,0.20580469071865082,0.9572605490684509,0.9687210321426392
"Per me, a quel tempo, le star erano Brigitte Bardot, Sophia Loren, Gina Lollobrigida... Una star era più che un essere umano, era una specie di dea resa sacra dalle luci, i costumi e gli scenari, era qualcuno che viveva su un altro pianeta. Io volevo saltare, correre, e rincasavo spettinata e ricoperta di polvere... Il cinema esigeva delle donne vere, con tanto di unghie lunghe e rossetto sulle labbra. Non avrei mai pensato di subire la trasformazione che mi avrebbe permesso di essere come loro. E poi non avevo fretta di diventare adulta. Il cinema era solo un gioco.",0.1814814223907888,0.7366016507148743,0.0010370416566729546,0.2909819781780243,0.9240971803665161,0.7024290561676025,0.09650016576051712,0.002241153037175536,0.7159476280212402,0.9487775564193726,0.4944251477718353,0.7410051822662354,0.0002853207406587899,0.34090182185173035,0.7916281819343567,0.8967591524124146,0.9838356375694275,0.3152484595775604,0.6919406652450562,0.7473547458648682
"«Vivevano nell'isola due giovani sorelle, Lutka e Liuba, assai diverse l'una dall'altra: Lutka era bellissima, con un volto chiaro e delicato, gli occhi verde smeraldo e lunghi capelli biondi che le cadevano morbidi sulle spalle bianche come il latte; Liuba invece era bruttina, coi lineamenti marcati e la carnagione scura; aveva lunghi capelli neri e arruffati, ma gli occhi erano dolci e il sorriso gentile.  Liuba è tanto buona!  dicevano al villaggio.  Ma... Lutka è così bella!»",0.1814814223907888,0.8197884559631348,0.33061695098876953,0.6444058418273926,0.9482706785202026,0.9874367117881775,0.9513528943061829,0.9664491415023804,0.9376336336135864,0.5186141729354858,0.6983806490898132,0.761613667011261,0.1467076689004898,0.989456295967102,0.8531995415687561,0.9922599196434021,0.9982500672340393,0.9815341830253601,0.9865670800209045,0.7882393002510071
"«Una notte, mentre stava tornando a letto, con due bei baffi di cioccolata sulle guance paffute, vide la mamma che stava parlando nel suo studio con un signore.  Dottore, ma è così grave?  chiese la mamma piangendo.  Sì, sua madre è molto malata  rispose il medico.  Ha bisogno di cure e di quell'incoraggiamento che solo una figlia può dare. Ha chiesto di lei, e solamente il suo affetto e la sua abnegazione potranno forse salvarla.»",0.1814814223907888,0.5601017475128174,0.26157552003860474,0.1907864212989807,0.9875977039337158,0.9976749420166016,0.7502106428146362,0.9985597133636475,0.9365941882133484,0.9027431607246399,0.948072075843811,0.9341367483139038,0.0510098971426487,0.9978162050247192,0.7566779851913452,0.9969862103462219,0.9959719777107239,0.9790787100791931,0.9926130175590515,0.873268723487854
