"Needless to spend words: I have aborted. Thirty thousand lire (denarii that we have racimulated among all the people we knew) plus fear, and something on and in the eyes, which for months did not leave me. Of that hour spent in a kind of clinic, certainly not equipped for surgery, I remember the cold, the darkness that was out, was night, the indifference and tension of the doctor and the nurse. ""Don't shout please, otherwise I don't operate it."" There was fear in that room, their and mine. At that time for abortion it ended up in prison. In addition to that fear there was terror for the intervention I faced without knowing absolutely anything. The only thing I knew with certainty is that I would not have had anesthesia. For me, and all for me, there was also the weight of what I was doing. I was lying on the cold bed, I thought of my mother, and I really wanted to die. “If he is afraid he leaves. If he shouts, stop and the hunt away. "" For years, that ""La Package"" has reversed me in the brain making me blush and curse my shyness. I haven't shouted. Pain. Shut up. I felt the tears slip through my hair ... not a lament came out. I looked at the doctor ... an indifferent piece of ice, who did his job by whistling under tone ... ""He is a bad one"" I thought. I certainly flooded with tears Dario, who was waiting for me in front of the closed door. He hugged me tight close. We were sick like two dogs who had lost the way home, moreover I felt so guilty, that I was sure that I would no longer have dared to look my mother in my eyes. Two thousand years of prejudices were the daily bread that many people ate. I, with my honestly Catholic Mother observant and convinced, I made indigestion of it. For Dario it was different. I met that doctor other times. We never even said goodbye. He became famous. Very rich. After the legalization of abortion, he also made conscientious objection. In words. In his studio he did all of Spello, nothing had changed in his abortic activity. Only the rate: one million.",0.08985940553247929,0.9876611232757568,0.9951124787330627,0.9684335589408875,0.9919715523719788,0.9932354092597961,0.9953253865242004,0.9849537014961243,0.9796692728996277,0.9940836429595947,0.8582663536071777,0.9908876419067383,0.9795817732810974,0.9934894442558289,0.9884782433509827,0.9910812377929688,0.9912461042404175,0.9949058890342712,0.990414023399353,0.25433242321014404
"I don't talk about it willingly. Many years have passed, but nothing is enough for me to find us inside it suddenly. No woman who has undergone sexual violence can ever detach himself completely from that horrible moment. Even today, precisely for the imbecile current mentality, a woman really convinces that she has suffered carnal violence if she has the ""luck"" of presenting herself to the competent and bleeding competent authorities, if she presents herself dead it is better! A corpse with signs of rape and torture gives more guarantees.",0.08985940553247929,0.8637393712997437,0.9942739605903625,0.9605696201324463,0.48019370436668396,0.9766935110092163,0.9892660975456238,0.3922901451587677,0.9394559264183044,0.4153618812561035,0.5116438269615173,0.9811920523643494,0.010214396752417088,0.0071939509361982346,0.011811788193881512,0.6622250080108643,0.9968445897102356,0.9951090812683105,0.9671704173088074,0.5946465134620667
"Every now and then it happens to me and Dario to browse publications illustrated by photos on our work and almost in unison we exclaim: «We did things for crazy! But where did we find the time to sleep?! "" In the midst of so much shades of shows, participation in debates and events, interventions in the factories occupied and in universities, representations abroad, it is to be wondered as it has not exploded as the carnival balloons too pumped. In any case, there was neither party nor holiday period that made us take a breath: from the seventies to the eighties he was not in a life, but rather in a kind of carousel with a russian mountain final. In addition to stageing these shows of political satire, personally I played texts on the theme of women in an almost always fun and other dramatic key; Dario continued to collect and write texts from the Bible, from the heretical writings, from the apocryphal Gospels: the funny mystery was now recited to episodes.",0.08985940553247929,0.801882266998291,0.9884730577468872,0.9561318755149841,0.9943013787269592,0.9942353963851929,0.9973599314689636,0.9301685690879822,0.9920206069946289,0.9267078638076782,0.28498610854148865,0.9656120538711548,0.9945635199546814,0.9917774796485901,0.9855809807777405,0.8465627431869507,0.9974445104598999,0.9894582033157349,0.9894510507583618,0.23724567890167236
"In the 70s we lived ""bizarrely"" ... personally I had some problems with the fascists ... they put bombs here and there, so that no one in Milan wanted to rent a house anymore. We were three stragglers who were a little in the hotel, a little from my sister Pia and a little from my mother in Cernobbio. With such a life in disarray, from ""perennial anguish"", Jacopo [fo] began not to feel comfortable in the world.",0.09490061178803444,0.07775992155075073,0.42638736963272095,0.7570708990097046,0.3383106589317322,0.9963982701301575,0.9972550868988037,0.9969573616981506,0.9885700941085815,0.9954648017883301,0.09217111021280289,0.83143550157547,0.9873959422111511,0.06982140988111496,0.028844725340604782,0.3765825629234314,0.996208667755127,0.9915010929107666,0.8224973678588867,0.028071505948901176
"There is a strange light that enters the window from the window. I had never witnessed such an absurd dawn in Milan. It's September. From the outside there is still a warm air. Soon it will be day. My mother is dying. I am sitting here on an armchair, the head resting on a pillow, but I can't sleep. My eyes burn me, but I'm not sleepy. I have returned for four hours. Tonight in the theater I recited without following what I was saying ... gestures, jokes, words came out as recorded: my mind was here in this room. I lean on the armchair better. I placed the cleansing milk for the lard in the womb. The Kleenex. I pass it on the face; On my own, long, painful sighs come out. Of those who mut down your mind. I'm living this moment as if it didn't happen to me. I look at it. She is there that she is struggling to die. A constant random for days follows us in every room. His hand that I hold as much as I can in mine is lukewarm ... If it weren't for that choked breath that comes out and the lips split for the arsura, it might seem like a beautiful elderly lady asleep.",0.09490061178803444,0.9651119112968445,0.9835386872291565,0.9730930924415588,0.9734735488891602,0.9748730063438416,0.9732115268707275,0.9657567143440247,0.9676104784011841,0.9856916069984436,0.9169902205467224,0.9675200581550598,0.9483023881912231,0.9023799896240234,0.9669672846794128,0.9823647737503052,0.9813153743743896,0.9819586873054504,0.9753302335739136,0.8913641571998596
"Damn, but why? ""I should be happy!"" I tell me. ""Senator! But do you realize that honor happened to you? """" Yes, yes ... senator !!! "" And I make up for the verse. I never thought of getting to such a prestigious charge, it was not exactly in my programs! ""Honored, honored"" for heaven's sake ... I found myself elected without having moved a finger. I don't feel up to it ... I'm frightened, even if I don't tell anyone. ""Don't you feel up to par? So, those who voted for you, did they choose you like this, at random? Let's try with an actress ... let's place a nice decorative character, in that mausoleum of tromboni! Plant it with 'this Solfa! Remember all the work you have lined up in prisons, organizing the defenses of the boys arrested for political crimes ... beaten in jail, tortured ... special prisons German model ... the hundreds of shows in support of the factories In struggle you did with Dario ... """" Yes, here, here ... now let's swell of pride ... """" It's just to refresh your memory, give you some security! In short! You have slammed for years just to give you a tone ...?! How do you do some footing? You should be proud: think about how many have voted for you! In those who have trusted you. They are all people who chose you with knowledge of the facts. Not by chance. Force!"" ""But go to the hell, you and your graphic licks!"" So, in conflict with myself, I get in the apartment. I look at the mirror: more pulled than I could not be. ""How nice to tease myself with that smile ... I feel out of place ... not up to it ... Not adequate ... more I'm old to face a new life. "" Well, let's not exaggerate ... now, to look at me well on the mirror all over, I don't really see myself to throw away! «Oh, for misery, at your age you should slam the tail for joy, dear senator! And also volley on yourself as in a dance?! "" Let's realize that we have to enter the scene ... I am a daughter of art and we of the profession by mounting on the stage never trembles.",0.09490061178803444,0.9854448437690735,0.9934476613998413,0.9117348194122314,0.9888030290603638,0.9919136762619019,0.9956122636795044,0.8264533877372742,0.9629942774772644,0.99229496717453,0.0981273204088211,0.982971727848053,0.9911385774612427,0.9902175068855286,0.9835227727890015,0.9867021441459656,0.9913287162780762,0.9938361048698425,0.9861236810684204,0.9710149765014648
"Unexcably one of the two asks: ""What dream did you do?"" If I ask, he replies with a voice that I only know. Sleepy. Small. Tender, as if it were, not the eighty -three year old man who is ... but a child. This ""mine"" voice melts with tenderness. I must say that Dario [fo] makes incredible dreams. Several times I had the doubt that ... yes, that there was a real base, but that he, as a skilled screenwriter what he is, enriched them a little. In his dreams there is often me ... we are young ... he cannot call me, he does not remember the number of my mobile phone, at home ... he does not find me ... he does not find our home. Vaga desperate by calling me. Then a man approaches him halfway between the real and the mechanic who flies ... he clings and the flying man hovers in the sky and away that takes him to me ... who are sitting on a rhinos ... Here, at this point of the story I start laughing ... ""Enough, just ... Stop it ... it's too long and now you're inventing."" I no longer remember who said that dreams are the fantastic transposition of our desires, our fears and joys. Here, I hear his voice insists: «No, I swear to you! I dreamed of just like that! """,0.09490061178803444,0.9903934001922607,0.9860336184501648,0.9796141982078552,0.9944143295288086,0.9935727119445801,0.9969611763954163,0.9871225357055664,0.9913432598114014,0.9851635694503784,0.8813871145248413,0.992062509059906,0.9707087278366089,0.9947655200958252,0.9951839447021484,0.9948240518569946,0.9714499115943909,0.995880663394928,0.9965447783470154,0.05504842475056648
"Jacopo [fo] grew and worked like crazy. The DNA is not said to be water and I must admit that it is an apt expression, since our son loves painting with his father's same passion, but, at least as a boy, when we offered him to enter the company with us to recite roles that Dario would have written specifically for him, he was unwitting like a ferret: «For heaven's sake! Thank you, but I don't want to enjoy the stress that you take to you every time you debut and be a tense like violin strings for a whole season, read beautiful criticisms but also manician infamousness, not to mention living all the time with the censorship attacked behind and on the buttocks like the ticks to the horses ... »In the end as a profession he chose comics and satirical cartoons and published his drawings on Numerous underground magazines.",0.09490061178803444,0.9618826508522034,0.9948381781578064,0.8407830595970154,0.973119854927063,0.97633957862854,0.9942244291305542,0.9941067099571228,0.9862108826637268,0.290336012840271,0.07658674567937851,0.9784865379333496,0.3207145035266876,0.996846616268158,0.9539235234260559,0.7343146204948425,0.9511312246322632,0.9963319301605225,0.6247552037239075,0.03443024307489395
"It is April 25, the war is over. The partisans parade in Varese for the Empire square. Among them there are guys I know. They were of the first group of fighters who had formed on the mountains of the Cucia Val just after 8 September. They had perceived on Monte Grino and on the Cuvignone. The Germans had attacked them by shooting with heavy artillery, a real massacre, few had saved themselves through the galleries dug in the First World War; They were almost all inhabitants of the valley, the only ones who knew the path of those ancient walkways to the bearer. To celebrate liberation, a lot of people had reversed on the streets: at a certain point I see an armed group come forward from the bottom. With them there was a woman. He was the mother of one of the fallen of Monte Grino. Many recognized it and applauded it. Someone went to hug her. Suddenly she stopped and sat on a wall, nodding others to continue: the emotion was too big and no longer led to walking among the applause and cries. The day after the allies arrive. We had seen them in the afternoon pass through the city on the trucks. They had also arrived in my way. They threw chocolate and cigarettes to us. I blush at the thought of being thrown with others to try to collect something.  In the evening, in the courtyard of my house, great party. A gramophone, [...]. Then I look up, towards the dark window of the first floor: my house. More than seeing her, I understand it: my mother is there, she is looking at us. I know his thoughts, his torment: my brother, deported to a concentration camp in Germany, has not given news for over two years, in a moment I am close to her ashamed of my joy. I get tightened to her.",0.09490061178803444,0.9917405843734741,0.9954769611358643,0.9937371611595154,0.9949997663497925,0.994999885559082,0.9951738715171814,0.9964777231216431,0.9947257041931152,0.995354175567627,0.989891529083252,0.9948672652244568,0.9948503971099854,0.9957014322280884,0.9955608248710632,0.993418276309967,0.996542751789093,0.9948714375495911,0.9962083697319031,0.9867265820503235
"""Dario, I think the waters broke ..."" ""The waters?!"" Dario exclaims by finally throwing the great newspaper. A taxi is running. Now we are both excited. We hug us. We occupy half a seat. The taxi driver is worried that the child is born there. We arrived in a minute. Salus clinic. They arrange me in a room. Dario is next to me. The obstetrician, the nurse, all very kind, a little for my baby, a little for the interest that always urges the shows, arrives. Then Latania begins: ""Pushes Lady pushes"". I put all my goodwill ... but nothing happens. Only Dario is on the move, I get a hand decided on the throat, squeezing and pressing. ""Dear, I'm already sick ... do you want to be Chozza?"" Also the nurse: ""What is it?!"" Calm, master of the situation in his role as a future father, replies: ""I have to be careful that the goiter does not come!"" And down to press your hand.",0.09490061178803444,0.9298596978187561,0.984417736530304,0.9482599496841431,0.9785264134407043,0.9913517832756042,0.9981694221496582,0.9905840754508972,0.978287935256958,0.9106165170669556,0.7268967032432556,0.9815126657485962,0.9741979241371155,0.9769867658615112,0.9697861075401306,0.9744930267333984,0.9955490827560425,0.9940710067749023,0.9848001599311829,0.8870904445648193
"I was the one who invited him after the rehearsals to eat something in a restaurant the first time. Dario seemed not to gladly accept that invitation; Then, since I insisted on, he revealed the reason for his reticence: ""I don't have a penny"" he said, ""to be able to free myself from work and come to evidence I had to fire myself from the architecture study where I developed projects"". And I am cheerful: ""I am pleased, I love to feed strays, abandoned and unemployed cats."" We went to a restaurant there on the corner and ordered two portions of salami, bread and a beer. For me water, they are a row. Then we accompanied each other at home. I lived from the parts of Porta Garibaldi, by my sister. Tram were no longer there, so we started on foot. We both told us about our lives, he of his lake, the eldest, and of the Academy in which he had studied; I of my company and tastiest anecdotes. We discovered to laugh like kids in mutual irony; I found it really amusing, that promenade, overflowing with absurd and festive stories. In particular, he came out with a phrase that surprised me: ""It often happens to me,"" he said ""to speak with someone and feel uncomfortable, because the things that I believe intelligent and witty that I am saying, are not collected, and then slowly I convince myself not to possess neither fantasy nor spirit. Instead every now and then, as tonight, I happen to hear the images I propose, and I receive others, from you, from you, who encourage me to let me go to the fantastic ».",0.09490061178803444,0.03892034664750099,0.20661772787570953,0.3061321973800659,0.7963078618049622,0.02194106951355934,0.060798320919275284,0.05486459657549858,0.06334139406681061,0.1531723439693451,0.027180306613445282,0.03296815976500511,0.0067816185764968395,0.3726748824119568,0.09730387479066849,0.8165484070777893,0.03761928156018257,0.09784626960754395,0.05975900962948799,0.0960695892572403
"With the advent of sound cinema (1929), my father, my uncle and the whole company understand that ""the puppet theater"" will soon be put in crisis, crushed by this new extraordinary and also a little magical means of entertainment. With great pain of grandfather Pio, they decide a radical change in their program and their condition: ""We will recite our shows, we will go on stage, instead of the puppets"". So the two copper families replace the wooden puppets (real articulated sculptures, three of which are still exhibited at the Museum of the Scala in Milan). They chose the texts, they tried and tried them again, they got the costumes and large seabed painted for them by a scenographer of the scale and debut in a normal theater: the theater of ""Person"", and she, my mom, becomes The first actress. An actress who was pulled on his children during the day, helped them study, dealt with the house, kept the company's administration as if it were that of a normal family ménage. And in the evening, climbing on the stage, here he is transformed into Juliet and Tosca, and the white none of anyone's sons, and the fantina dei miserable, all roles that gradually we daughters and cousins, one following, we would then interpret . I see myself traveling the apprenticeship of theatrians interpreting all the roles that growing up were suitable for my age, male or female they were.",0.0865156720392406,0.9860696196556091,0.9770766496658325,0.8971839547157288,0.9710282683372498,0.9877229332923889,0.9944866299629211,0.9916104078292847,0.9930337071418762,0.9889611005783081,0.5076051354408264,0.9894440770149231,0.5550030469894409,0.9911582469940186,0.9848710894584656,0.9885473847389221,0.99040287733078,0.9877457022666931,0.9795926809310913,0.9582329988479614
"I was desperate because I had no breasts. So I asked my mother: ""Mom, why don't I have breasts?!"" And she: ""Eh, because, as if to say, in short, nature certain times, that is, here ... but you are quiet: in the end everything is balanced ... at least I hope!"" To tell the truth was not a great dialogue! Then he makes me: ""Pray Santa Rita da Cascia who is the saint of impossible!"" I prayed that you don't know how much ... obviously with not sufficient intensity, and a breasts, one, but beautiful, a pear ... a beautiful pera William ... here nothing! My mom put my bra and pitched me with the handkerchiefs the missing part. Those two protrudes on my chest made me feel almost a woman! I was also less embarrassed with the courtesy of the males, so much so that often those took courage. One of those Moscardini even came to put a hand on my breasts: a ""washing"" came from Knock Out. ""Cretino, how do you allow yourself?"" I was not angry for the gesture, as for the fact that he had touched my wrong breasts! The one padded with pezza! Finally I also got the missing ... round! I had a beautiful pera William and a queen apple. ""Mom, why do I have a pear William and a queen apple?!"" My mother reassured me: ""Having the breasts and two almost identical is an indication of a lack of originality, of a banal indole."" ""Ah yes?"" ""And then a song also says it:"" My girlfriend is about Villafranca, there is a black tenet and another white, a pointed pyrolino and the other round, my girlfriend is beautiful a end! """" ""Well, then we toast!""",0.0865156720392406,0.9399513006210327,0.9934431314468384,0.943082869052887,0.9846112132072449,0.9834385514259338,0.9957644939422607,0.9931216835975647,0.9652772545814514,0.9055884480476379,0.11593164503574371,0.9541539549827576,0.9612961411476135,0.9639933109283447,0.9928341507911682,0.9714477062225342,0.9962397813796997,0.9939475059509277,0.9599164724349976,0.9771997332572937
"At some point in my life I realized that the work of actress did not drive me crazy, that I didn't like it so much. People don't believe it, they think they are lies. Instead it is true, I would never have chosen this profession, which requires a type of character that I do not have: attendance, arrogance and good elbows. When I realized that I didn't like this job, it was too late, I was already married to Dario and we had our company. If I had not been addressed to this profession by my family, I would have committed myself to the social, I could also have been a lawyer or a doctor.",0.0865156720392406,0.8922622203826904,0.9860137104988098,0.714754581451416,0.5380302667617798,0.9941568374633789,0.6085883975028992,0.9954013228416443,0.9189156293869019,0.39456722140312195,0.448775053024292,0.9591925740242004,0.0025667608715593815,0.761306643486023,0.07149984687566757,0.9749230146408081,0.9943861961364746,0.9906995296478271,0.03624650463461876,0.9782407283782959
"Cinema bored me to death. Early in the morning you got up, they came to take you at five, at six and ten you were ready, at the eleven and a quarter the director was finally presented. Time is not thrown away. I don't regret it, cinema. In the theater, your audience is in front of it.",0.0865156720392406,0.6851949691772461,0.9265598058700562,0.8739998936653137,0.42491671442985535,0.9788128137588501,0.996768593788147,0.19017334282398224,0.931377112865448,0.9448565244674683,0.6108641624450684,0.9530612826347351,0.003908961545675993,0.6655495166778564,0.06283170729875565,0.828292965888977,0.13926982879638672,0.4169122576713562,0.34130337834358215,0.028807107359170914
"I received the threats, when I was already senator. Terrible phrases, like ""splitting all your teeth with beating"". I was very afraid, also because I was seventy -seven years old and I returned home alone at three in the morning, after hours of meeting to the Budget Committee (which God has it in glory).",0.0865156720392406,0.10629824548959732,0.8865918517112732,0.9609588980674744,0.9929819703102112,0.02472653239965439,0.015412681736052036,0.05332780256867409,0.9135207533836365,0.9825918078422546,0.10394621640443802,0.901326596736908,0.9792444109916687,0.9253933429718018,0.05789796635508537,0.559699535369873,0.3677789270877838,0.9777852892875671,0.023623622953891754,0.0022722501307725906
"If I had to be reborn, but I really hope it doesn't happen to me, I would not change a single comma of what I did in my life. With Dario I lived an exaggeratedly happy life, the only thing that at the beginning disturbed me was the unpleasant feeling of being transparent, especially with other women. How many times the famous feminists, leaders of the movement, those who know everything, who speak to you from above, came to the Liberty building. They entered, maybe they saw that I was cleaning the great place with a broom (unusual role for a first actress), it is not that they realized and said at least: ""Hello"". No, they only asked me: ""Where is Dario?"" ""The worst enemy of the woman ... is the woman."" There is no comedy where he did not reiterate the concept.",0.0865156720392406,0.9187869429588318,0.9842539429664612,0.9741412401199341,0.953067421913147,0.9969567656517029,0.9979901909828186,0.985562801361084,0.9352656602859497,0.5940325856208801,0.46627703309059143,0.969977855682373,0.9867364168167114,0.09099157154560089,0.9375386834144592,0.9690508246421814,0.9970718026161194,0.9952254295349121,0.9922739863395691,0.9209404587745667
"When he took the Nobel Prize, Marta Marzotto invented a basket with five hundred red roses. The accompanying ticket said: ""Behind a great man there is always a great woman."" I called her on the phone to thank her, but I also said to her: ""Marta, don't put me behind, it makes me impression, it's as if you arrange to keep her step. Bridges alongside. I would find myself better ». It is strange that an intelligent and witty woman like her has fallen into such banality.",0.0865156720392406,0.9378438591957092,0.9944064617156982,0.8923895359039307,0.8327670693397522,0.7762219905853271,0.9831463694572449,0.7481842041015625,0.8973735570907593,0.5677793025970459,0.48720261454582214,0.9949445724487305,0.0796240046620369,0.9579144716262817,0.5311344861984253,0.8916178941726685,0.9969326257705688,0.9936871528625488,0.6212626695632935,0.8729326725006104
