"Unexcably one of the two asks: ""What dream did you do?"" If I ask, he replies with a voice that I only know. Sleepy. Small. Tender, as if it were, not the eighty -three year old man who is ... but a child. This ""mine"" voice melts with tenderness. I must say that Dario [fo] makes incredible dreams. Several times I had the doubt that ... yes, that there was a real base, but that he, as a skilled screenwriter what he is, enriched them a little. In his dreams there is often me ... we are young ... he cannot call me, he does not remember the number of my mobile phone, at home ... he does not find me ... he does not find our home. Vaga desperate by calling me. Then a man approaches him halfway between the real and the mechanic who flies ... he clings and the flying man hovers in the sky and away that takes him to me ... who are sitting on a rhinos ... Here, at this point of the story I start laughing ... ""Enough, just ... Stop it ... it's too long and now you're inventing."" I no longer remember who said that dreams are the fantastic transposition of our desires, our fears and joys. Here, I hear his voice insists: «No, I swear to you! I dreamed of just like that! """,0.18787074577994645,0.0003540345060173422,0.0017118854448199272,0.0004880330234300345,0.010112856514751911,0.046674903482198715,0.0003406891191843897,0.019519580528140068,0.9831711649894714,0.014255475252866745,0.0001593163760844618,0.037301816046237946,7.62514682719484e-05,0.866066038608551,0.0010945337126031518,0.9852025508880615,0.0010730820940807462,0.23277711868286133,0.164075568318367,0.0001340230810455978
"Jacopo [fo] grew and worked like crazy. The DNA is not said to be water and I must admit that it is an apt expression, since our son loves painting with his father's same passion, but, at least as a boy, when we offered him to enter the company with us to recite roles that Dario would have written specifically for him, he was unwitting like a ferret: «For heaven's sake! Thank you, but I don't want to enjoy the stress that you take to you every time you debut and be a tense like violin strings for a whole season, read beautiful criticisms but also manician infamousness, not to mention living all the time with the censorship attacked behind and on the buttocks like the ticks to the horses ... »In the end as a profession he chose comics and satirical cartoons and published his drawings on Numerous underground magazines.",0.18787074577994645,0.004093370866030455,0.00010250882769469172,0.003881792537868023,5.756136306445114e-05,0.0004098030913155526,8.723299106350169e-05,0.0002010017924476415,0.10399835556745529,0.00011561543215066195,0.0005239372258074582,0.8460763692855835,0.00011583504237933084,0.6950315237045288,0.00023378703917842358,0.0005330480635166168,0.00014558127440977842,0.4122619032859802,9.539927123114467e-05,0.000255610968451947
"It is April 25, the war is over. The partisans parade in Varese for the Empire square. Among them there are guys I know. They were of the first group of fighters who had formed on the mountains of the Cucia Val just after 8 September. They had perceived on Monte Grino and on the Cuvignone. The Germans had attacked them by shooting with heavy artillery, a real massacre, few had saved themselves through the galleries dug in the First World War; They were almost all inhabitants of the valley, the only ones who knew the path of those ancient walkways to the bearer. To celebrate liberation, a lot of people had reversed on the streets: at a certain point I see an armed group come forward from the bottom. With them there was a woman. He was the mother of one of the fallen of Monte Grino. Many recognized it and applauded it. Someone went to hug her. Suddenly she stopped and sat on a wall, nodding others to continue: the emotion was too big and no longer led to walking among the applause and cries. The day after the allies arrive. We had seen them in the afternoon pass through the city on the trucks. They had also arrived in my way. They threw chocolate and cigarettes to us. I blush at the thought of being thrown with others to try to collect something.  In the evening, in the courtyard of my house, great party. A gramophone, [...]. Then I look up, towards the dark window of the first floor: my house. More than seeing her, I understand it: my mother is there, she is looking at us. I know his thoughts, his torment: my brother, deported to a concentration camp in Germany, has not given news for over two years, in a moment I am close to her ashamed of my joy. I get tightened to her.",0.18787074577994645,0.00019266532035544515,0.02934028021991253,0.002061947714537382,0.00045642443001270294,0.7253019213676453,0.8264172673225403,0.9982578754425049,0.39666205644607544,0.0001338685251539573,9.58986856858246e-05,0.0006843381561338902,0.9987256526947021,0.9105861186981201,0.00012851072824560106,0.32014986872673035,0.9777819514274597,0.01677647978067398,0.9956926703453064,5.203362525207922e-05
"""Dario, I think the waters broke ..."" ""The waters?!"" Dario exclaims by finally throwing the great newspaper. A taxi is running. Now we are both excited. We hug us. We occupy half a seat. The taxi driver is worried that the child is born there. We arrived in a minute. Salus clinic. They arrange me in a room. Dario is next to me. The obstetrician, the nurse, all very kind, a little for my baby, a little for the interest that always urges the shows, arrives. Then Latania begins: ""Pushes Lady pushes"". I put all my goodwill ... but nothing happens. Only Dario is on the move, I get a hand decided on the throat, squeezing and pressing. ""Dear, I'm already sick ... do you want to be Chozza?"" Also the nurse: ""What is it?!"" Calm, master of the situation in his role as a future father, replies: ""I have to be careful that the goiter does not come!"" And down to press your hand.",0.18787074577994645,0.00023374271404463798,0.00017946658772416413,0.04062296450138092,7.678240945097059e-05,0.11582695692777634,8.075679215835407e-05,0.9978023767471313,0.0011819637147709727,4.795884160557762e-05,0.0009525801287963986,0.0018980844179168344,8.170882938429713e-05,0.8443382978439331,0.00016917911125347018,0.01509329117834568,0.9899269938468933,0.00022566394181922078,0.16033917665481567,0.0010479773627594113
"I was the one who invited him after the rehearsals to eat something in a restaurant the first time. Dario seemed not to gladly accept that invitation; Then, since I insisted on, he revealed the reason for his reticence: ""I don't have a penny"" he said, ""to be able to free myself from work and come to evidence I had to fire myself from the architecture study where I developed projects"". And I am cheerful: ""I am pleased, I love to feed strays, abandoned and unemployed cats."" We went to a restaurant there on the corner and ordered two portions of salami, bread and a beer. For me water, they are a row. Then we accompanied each other at home. I lived from the parts of Porta Garibaldi, by my sister. Tram were no longer there, so we started on foot. We both told us about our lives, he of his lake, the eldest, and of the Academy in which he had studied; I of my company and tastiest anecdotes. We discovered to laugh like kids in mutual irony; I found it really amusing, that promenade, overflowing with absurd and festive stories. In particular, he came out with a phrase that surprised me: ""It often happens to me,"" he said ""to speak with someone and feel uncomfortable, because the things that I believe intelligent and witty that I am saying, are not collected, and then slowly I convince myself not to possess neither fantasy nor spirit. Instead every now and then, as tonight, I happen to hear the images I propose, and I receive others, from you, from you, who encourage me to let me go to the fantastic ».",0.18787074577994645,0.12159808725118637,0.0009325048886239529,0.00020991050405427814,0.05144612863659859,0.9588457942008972,0.00046800909331068397,0.010793481953442097,0.037181030958890915,0.00021634696167893708,0.00028116258908994496,0.9121088981628418,0.00019651166803669184,0.9930963516235352,0.00021714490139856935,0.0318637415766716,0.0015846278984099627,0.0267676692456007,0.6296058893203735,0.0056382399052381516
"With the advent of sound cinema (1929), my father, my uncle and the whole company understand that ""the puppet theater"" will soon be put in crisis, crushed by this new extraordinary and also a little magical means of entertainment. With great pain of grandfather Pio, they decide a radical change in their program and their condition: ""We will recite our shows, we will go on stage, instead of the puppets"". So the two copper families replace the wooden puppets (real articulated sculptures, three of which are still exhibited at the Museum of the Scala in Milan). They chose the texts, they tried and tried them again, they got the costumes and large seabed painted for them by a scenographer of the scale and debut in a normal theater: the theater of ""Person"", and she, my mom, becomes The first actress. An actress who was pulled on his children during the day, helped them study, dealt with the house, kept the company's administration as if it were that of a normal family ménage. And in the evening, climbing on the stage, here he is transformed into Juliet and Tosca, and the white none of anyone's sons, and the fantina dei miserable, all roles that gradually we daughters and cousins, one following, we would then interpret . I see myself traveling the apprenticeship of theatrians interpreting all the roles that growing up were suitable for my age, male or female they were.",0.18301612650975585,0.00010392742842668667,0.0004923560190945864,0.0017225166084244847,9.873330418486148e-05,0.0007282100268639624,0.001977538922801614,0.5012087225914001,0.9964839816093445,0.6973649263381958,0.0004366435168776661,0.0916782021522522,0.00015016466204542667,0.09156470745801926,9.158378816209733e-05,0.006338876206427813,0.5630312561988831,0.035092853009700775,0.00012427405454218388,0.9973582625389099
"I was desperate because I had no breasts. So I asked my mother: ""Mom, why don't I have breasts?!"" And she: ""Eh, because, as if to say, in short, nature certain times, that is, here ... but you are quiet: in the end everything is balanced ... at least I hope!"" To tell the truth was not a great dialogue! Then he makes me: ""Pray Santa Rita da Cascia who is the saint of impossible!"" I prayed that you don't know how much ... obviously with not sufficient intensity, and a breasts, one, but beautiful, a pear ... a beautiful pera William ... here nothing! My mom put my bra and pitched me with the handkerchiefs the missing part. Those two protrudes on my chest made me feel almost a woman! I was also less embarrassed with the courtesy of the males, so much so that often those took courage. One of those Moscardini even came to put a hand on my breasts: a ""washing"" came from Knock Out. ""Cretino, how do you allow yourself?"" I was not angry for the gesture, as for the fact that he had touched my wrong breasts! The one padded with pezza! Finally I also got the missing ... round! I had a beautiful pera William and a queen apple. ""Mom, why do I have a pear William and a queen apple?!"" My mother reassured me: ""Having the breasts and two almost identical is an indication of a lack of originality, of a banal indole."" ""Ah yes?"" ""And then a song also says it:"" My girlfriend is about Villafranca, there is a black tenet and another white, a pointed pyrolino and the other round, my girlfriend is beautiful a end! """" ""Well, then we toast!""",0.18301612650975585,0.007955485954880714,0.00016706206952221692,0.9995489120483398,0.00997042004019022,0.08865980803966522,0.0017472195904701948,0.9845776557922363,0.9482758641242981,6.761367694707587e-05,0.00021504401229321957,0.9395440220832825,0.00010588835721137002,0.9961369633674622,0.39303648471832275,0.006011888850480318,0.9905597567558289,0.001308712875470519,0.7697901129722595,0.0011726990342140198
"At some point in my life I realized that the work of actress did not drive me crazy, that I didn't like it so much. People don't believe it, they think they are lies. Instead it is true, I would never have chosen this profession, which requires a type of character that I do not have: attendance, arrogance and good elbows. When I realized that I didn't like this job, it was too late, I was already married to Dario and we had our company. If I had not been addressed to this profession by my family, I would have committed myself to the social, I could also have been a lawyer or a doctor.",0.18301612650975585,0.0064949337393045425,0.00010938209743471816,0.004092146176844835,6.473598477896303e-05,0.010583770461380482,8.698207966517657e-05,0.0034657814539968967,0.0025990470312535763,0.00012581550981849432,0.0002917635429184884,0.2207198292016983,0.00013345087063498795,0.011705565266311169,7.956424815347418e-05,0.010428295470774174,0.017996832728385925,0.0003335764922667295,0.002253186423331499,0.9998036026954651
"Cinema bored me to death. Early in the morning you got up, they came to take you at five, at six and ten you were ready, at the eleven and a quarter the director was finally presented. Time is not thrown away. I don't regret it, cinema. In the theater, your audience is in front of it.",0.18301612650975585,3.898072100128047e-05,4.296856059227139e-05,0.0004448119143489748,4.1727696952875704e-05,5.8102763432543725e-05,5.179411527933553e-05,4.0033486584434286e-05,0.004737961571663618,5.574227179749869e-05,7.348934013862163e-05,0.0001662128634052351,5.2752060582861304e-05,0.00031232586479745805,7.034631562419236e-05,0.0019625781569629908,9.998230962082744e-05,8.477817755192518e-05,0.0007944799144752324,6.138023309176788e-05
"I received the threats, when I was already senator. Terrible phrases, like ""splitting all your teeth with beating"". I was very afraid, also because I was seventy -seven years old and I returned home alone at three in the morning, after hours of meeting to the Budget Committee (which God has it in glory).",0.18301612650975585,0.0013458222383633256,0.11881306022405624,0.03135528042912483,0.0018756670178845525,0.9087859988212585,0.03234630450606346,0.00021706774714402854,0.001674208790063858,0.9974345564842224,8.802417869446799e-05,0.00853299256414175,0.9997984766960144,0.048433978110551834,7.720976282143965e-05,0.006015196908265352,0.0005752256256528199,0.06694114208221436,0.8753533363342285,5.0946182454936206e-05
"If I had to be reborn, but I really hope it doesn't happen to me, I would not change a single comma of what I did in my life. With Dario I lived an exaggeratedly happy life, the only thing that at the beginning disturbed me was the unpleasant feeling of being transparent, especially with other women. How many times the famous feminists, leaders of the movement, those who know everything, who speak to you from above, came to the Liberty building. They entered, maybe they saw that I was cleaning the great place with a broom (unusual role for a first actress), it is not that they realized and said at least: ""Hello"". No, they only asked me: ""Where is Dario?"" ""The worst enemy of the woman ... is the woman."" There is no comedy where he did not reiterate the concept.",0.18301612650975585,0.012604908086359501,8.045850700000301e-05,0.0005452788318507373,0.0032546832226216793,0.9990790486335754,0.02532888762652874,0.0002854991762433201,0.0002851301687769592,0.0003661997616291046,0.0001956111955223605,0.9949923753738403,0.041649285703897476,0.9705294966697693,8.26985778985545e-05,0.11912721395492554,0.9990134835243225,0.05845597758889198,0.023785118013620377,0.00786314532160759
"When he took the Nobel Prize, Marta Marzotto invented a basket with five hundred red roses. The accompanying ticket said: ""Behind a great man there is always a great woman."" I called her on the phone to thank her, but I also said to her: ""Marta, don't put me behind, it makes me impression, it's as if you arrange to keep her step. Bridges alongside. I would find myself better ». It is strange that an intelligent and witty woman like her has fallen into such banality.",0.18301612650975585,0.0018692031735554338,9.522022446617484e-05,0.00023882402456365526,0.003439315129071474,0.9650622606277466,0.9873672723770142,0.0027758765500038862,6.358934479067102e-05,0.0009700310183688998,0.00039687808020971715,0.788273811340332,0.00031396662234328687,0.9905715584754944,0.00040962567436508834,0.7158678770065308,0.9966161251068115,0.021055208519101143,0.0029219738207757473,0.0004077240009792149
"Di Pietro contacted me to ask me if I wanted to apply for the 2006 national elections. I had many commitments, so many things to do, it seemed madness to me, and I told him. But he made the news shoot and people began to call. ""You have to go, you have to go,"" they told me. In the end I applied to the list of Italy of values. I took almost five hundred thousand votes, which are many. Precisely out of respect for my voters, and for a sense of responsibility, I remained in the Senate longer than I would have liked. If it had been for me, I would have resigned at least seven months before the government falls. (...) The nineteen badly months of my life. It was a period of great solitude, I was surrounded by asocial people. Finocchiaro greeted me only after a year. I always thought: «I am not the one that comes from Sicily and is called Luisa Rovigotti. I starred in theaters from all over Italy, you can't pretend not to know me! ». It was the decane of the Union and, as a woman, we should have taken poor unfortunate females, who we knew nothing, and rely on someone who teach us something. Finocchiaro passed in front of me as if I were transparent, then when he needed me: ""Francuzza, Francuzza"". In that Senate I made the unimaginable.",0.18301612650975585,0.009063122794032097,0.0013625408755615354,0.3526804447174072,0.00017797134933061898,0.9868198037147522,0.039643723517656326,0.0002810871519614011,0.0014516458613798022,0.00013847571972291917,0.00041282479651272297,0.8968935608863831,0.9998680949211121,0.9097084999084473,8.281270856969059e-05,0.050623469054698944,0.8854816555976868,0.006011121440678835,0.004729875363409519,0.0027862319257110357
"Obviously you have supported the campaigns for divorce and abortion. We joke, divorce and abortion. Of course, we have made all the colors.",0.18117626942694187,0.00010375201236456633,7.334242400247604e-05,0.0033169446978718042,6.036347258486785e-05,0.9889896512031555,0.0004317736020311713,0.23929333686828613,9.561772458255291e-05,8.961006824392825e-05,0.004757223650813103,0.00015339422679971904,0.9998510479927063,0.0023269723169505596,0.03319762647151947,0.005166871938854456,0.9607440829277039,0.004820831585675478,0.0016771190566942096,0.0001394534483551979
"I have never studied ""the art of acting"", and when I hear ""the art of acting"", the term already nervous me. I was born in a family of actors. I staged my mom eight days in my arms. That evening I didn't speak so much ... [...] we recited the subject, following the canvas. The traditional actors, when they came to our company, were forced to be very careful, someone was already saying to the tests: «Sorry but I always recited following a written text. With you I never know when I touch me to tell me my joke. I can't do it ». Too bad, if they had remained with us they would have had an experience capable of changing their lives.",0.18117626942694187,0.00016302689618896693,8.154895476764068e-05,0.0448562353849411,7.480890781152993e-05,0.0023995644878596067,0.0004922400694340467,0.0026145842857658863,0.026109419763088226,9.116679575527087e-05,0.00011582520528463647,0.8249368071556091,0.00013550276344176382,0.004446010570973158,8.16815736470744e-05,0.007807278539985418,0.06392087787389755,0.018207740038633347,0.0003663832030724734,0.9988162517547607
"The exploitation was everywhere, even within the family. Feminism, if understood in its true meaning, is a very high concept, of an invaluable value. The so -called feminists, leaders of the time, turned to modest women, workers, with an high -sounding and meaningless language, imbued with ideologies. Instead, I tried to implement my conception of feminism by bringing our shows to the factories. After each representation, such as ties that I split all the same, there was discussing, and the worker understood. He understood, if you used the right language, otherwise it was like making a hole in the water.",0.18117626942694187,0.02345714345574379,8.707134111318737e-05,7.14506531949155e-05,8.446414722129703e-05,0.004353244788944721,0.04403591901063919,0.0006384438020177186,0.00030818025697954,5.5909709772095084e-05,9.90074549918063e-05,0.0020478907972574234,0.9995409250259399,0.01938365399837494,0.00015753760817460716,0.07689657062292099,0.9732175469398499,0.006743767764419317,4.304033063817769e-05,0.0007122416282072663
"The actors I know make a bizarre thing: before going on stage they touch my hands, because they are so excited that they have frozen, or sweaty hands. An actor would never confirms it, but it is just like that. They can't explain why this is not understood to me. I never have sweaty hands, I never have cold hands, because this is my job. It will seem a little greve, but it is as if the delicatessen, slicing ham, felt a great emotion. He did it many times, he was born by cutting the ham. And I was born in the theater. It is there that I accumulated the luggage, which then allowed me to interpret all the roles.",0.18117626942694187,0.0002100143174175173,5.989026976749301e-05,0.00710736820474267,0.00012958416482433677,0.004041100386530161,0.0021800678223371506,7.500713400077075e-05,0.04035675898194313,0.0003635553875938058,0.0003962423943448812,0.9906050562858582,0.00010852232662728056,0.8606258034706116,0.00015229746350087225,0.019072236493229866,0.00018120788445230573,0.0010576756903901696,0.49631965160369873,0.9061231017112732
"It happens to me like this: as I see a person, after seven minutes I understand if it will give a damn or not. Just as, when I read a theatrical text, I immediately feel where the mistake is. Even on my scripts I write: ""Laughter, here there must be a laugh."" And laugh comes. It will be DNA. Maybe I spent my life acting. I was already reciting in my mother's belly.",0.18117626942694187,7.649322651559487e-05,6.10455681453459e-05,0.008830283768475056,0.00010174259659834206,0.0005913240020163357,9.840226266533136e-05,0.0011702041374519467,0.0033744717948138714,7.53630738472566e-05,0.00023016019258648157,0.7800287008285522,6.526025390485302e-05,0.00033582295873202384,0.00014548659964930266,0.002440889598801732,0.0033211971167474985,0.6925492882728577,0.09515086561441422,0.9928871393203735
"With the unwatched we made a great mistake. On the other hand, we didn't have the means to do better. We should have collected it and turn the scenes again, the rhythm was missing. The audience of that time could not appreciate such a film. Now, however, you look at him and say: ""Ah, what a good movie"". Carlo Lizzani, then, was not a comic film director. And a dear friend of mine, I have admiration for him, but it was not his kind of movie. Six to write the unwatty (perhaps a little too many), with the poor Dario [fo] trying to intervene but was silent: ""This is not theater, we are making a film"". Dario and I have not had the strength to withdraw it or redo the scenes.",0.18117626942694187,0.00012874603271484375,5.6945806136354804e-05,0.0012289058649912477,5.385409531299956e-05,7.342772732954472e-05,0.0001226008462253958,5.323486038832925e-05,0.00044236614485271275,8.134262316161767e-05,0.0016452257987111807,0.000464436539914459,9.152725397143513e-05,0.02136533334851265,7.771378295728937e-05,0.0004114948969800025,9.953235712600872e-05,0.343750923871994,0.000574055768083781,0.0001181257757707499
"I do not bring Rancore to Dario [fo], because at the base there is my greatest defect: that of not having ambition. It is not that Dario has ever thought: ""Franca gives me ideas and I am a caught!"". No, he just didn't come to mind. If I had not been his wife, if I had been another, he would have had to, necessarily, also put my name as an author. Einaudi has published numerous texts by Dario edited by me and initially did not even appear the wording ""edited by Franca Rame"". When I asked Roberto Cerati the explanation of this, he replied: ""We didn't think about it."" The trouble is that I am the wife, and the wife, sometimes, is a home furniture, a picture on the wall, something that is close to you but that you don't see. I know hundreds of outbursts of women on the subject. If I had to be reborn, but I really hope it doesn't happen to me, I would not change a single comma of what I did in my life. With Dario I lived an exaggeratedly happy life, the only thing that at the beginning disturbed me was the unpleasant feeling of being transparent, especially with other women. How many times the famous feminists, leaders of the movement, those who know everything, who speak to you from above, came to the Liberty building. They entered, maybe they saw that I was cleaning the great place with a broom (unusual role for a first actress), it is not that they realized and said at least: ""Hello"". No, they asked me only: ""Where's Dario?"" ""The worst enemy of the woman ... is the woman."" There is no comedy where he has not reiterated the concept.",0.18117626942694187,0.0007610899629071355,0.003351794555783272,0.00019640548271127045,0.00026150300982408226,0.9760777354240417,0.0005816715420223773,0.017535723745822906,0.00013316092372406274,6.513432163046673e-05,9.209888230543584e-05,0.0521826446056366,0.019299989566206932,0.9938417077064514,6.712680624332279e-05,0.007519509177654982,0.9989298582077026,0.9946682453155518,0.0014893888728693128,0.007289268542081118
