text,time,self-determination,home,body,spiritual dimension,life events,historical events,family,childhood and adolescence,aging,meloncholy,self-performance,politics,relation with men,relation with the natural world,relation with reality,relation with women,writing,feelings and moods,profession of the actress
"You cannot touch the pulse to this sick [the Italian theater] without interrogating those who have shown that they know with dignity and consciousness to exercise this troubled art, which will ever have rest, which will never touch a goal, because just one has reached it , another arises different to conquer. So, for us, our life will always be a poor thing even if to the other splendid pairs. A life, which if it is made up of many lives and gives the joy and torment of living them all, tomorrow is nothing more.",0.17904912889935076,0.9388806819915771,0.30998995900154114,0.7280145287513733,0.9252641201019287,0.8801707029342651,0.11991851031780243,0.9090526700019836,0.2156548947095871,0.7604109644889832,0.5765886902809143,0.892445981502533,0.04022778198122978,0.8914435505867004,0.2879480719566345,0.9824997782707214,0.5715028643608093,0.39040496945381165,0.6664755940437317,0.5341689586639404
"I was fourteen, when I introduced myself to the Secretariat of the Academy of the Teatro dei Filodrammatici, to be admitted to the diction and acting courses of our school in Milan. But I had to go back, disappointed and sad, after a kind but firm denial having not yet reached the age prescribed by the regulations for admission (sixteen years). The following year, as if I had already reached that age, with the firmer face, I still knock on that door; And, in the face of so much good and passionate will, here is the first tear to the regulations, dates, principles, customs. [...]",0.17904912889935076,0.9371864795684814,0.4602886140346527,0.45367616415023804,0.7748522162437439,0.9935142993927002,0.7712847590446472,0.5878908634185791,0.9979913234710693,0.9952524900436401,0.7995615005493164,0.8731043934822083,0.02659393660724163,0.7752265930175781,0.11148783564567566,0.9805008769035339,0.37348487973213196,0.8980733752250671,0.9944823384284973,0.6509878039360046
"[The Academy] was like my second and most true home [...] Ophelia Mazzoni lent with an enchantment, I would like to say authoritarian, his teaching; [...] The joy of my first conquest was his judgment [...]. Here in the second year, replace her, Enrico Reinach: good, paternal, elegant. I knew how to find the two veins in me: the dramatic vein and the comic vein; Therefore, I was among its students the only one to which two scenes were entrusted to each essay, a dramatic and a comedian.",0.17904912889935076,0.9821344614028931,0.917695164680481,0.5908908247947693,0.5274959206581116,0.8743789792060852,0.04445652663707733,0.9805007576942444,0.009576600044965744,0.7506455779075623,0.6649824380874634,0.9774269461631775,0.0047721718437969685,0.8796723484992981,0.04600346088409424,0.9720743298530579,0.6840941309928894,0.9956837892532349,0.9868378639221191,0.2214786261320114
"Among the memories of the Academy I cannot between leaving the greatest: the fortune of having had among the spectators, to one of the essays, Eleonora Duse. I didn't even have the good to see her in the face. [...] I had the meaning of his physical presence only when Enrico Reinach, at the end of the essay, told me radiant to have had the hottest congratulations from her for ""her student"".",0.17904912889935076,0.5530921816825867,0.005746238399296999,0.8551566004753113,0.8369432687759399,0.8696084022521973,0.4380953311920166,0.3755790591239929,0.00023588300973642617,0.593658983707428,0.7437099814414978,0.5421814322471619,0.0005294519942253828,0.02272718772292137,0.0004175919748377055,0.9558053016662598,0.989605188369751,0.9913798570632935,0.9813686013221741,0.033766794949769974
"His [by Enrico Reinach] teaching of two years had tightened our knowledge, devoted on my and friendly even towards my relatives on his part. So imagine my surprise, when I learned that my parents had not recommended my entry in art. A flame of anger climbed me to the forehead; A betrayal seemed to me. But he, with his old comedian experience, caressing my cheek with his beautiful hand jagged the little finger: ""Dear, the theater, it is better to see it from the armchair"". He already knew me engaged, and it was grateful to him to see me in the care of a house, rather than among the uncertainties and instability of a stage. [...] The family gripped the brakes more and more, forbidden to participate in any act [...] I also offended the possibility of entering Italian cinematography, [...] but you don't even dare to speak to my parents, although I felt attracted to me by This new and prestigious art form. I was looking forward to becoming of age to declare my aspiration. But the moment was also first [...] with the interest [...] of Sabatino Lopez, who then presided over the shows of the Teatro del Popolo in Milan. He convinced with his authority my parents that being stable theater based in the same city I could be an actress not moving away from home.",0.17904912889935076,0.9294655323028564,0.9704053997993469,0.7397439479827881,0.7707282900810242,0.996703028678894,0.810559093952179,0.9971544742584229,0.972593367099762,0.9844317436218262,0.8898775577545166,0.2458711862564087,0.0030948941130191088,0.9887356162071228,0.20786045491695404,0.9917910695075989,0.9771099090576172,0.09039125591516495,0.9951801896095276,0.9897676110267639
"Ettore Paladini, director of the company, [...] looked at us with good eyes and tellers [...], and hard but illuminated in the face [...] by a light of intelligent goodness. My soul tempon to his discipline. Discipline of soldier, of just, of in love with his work. [...] Virgilio Talli I understood it immediately: exuberant of mind for his actors, [...] exuberant of love for the theater. His cries and his outbursts were not afraid of me. [...] And it was an unparalleled master for me. The attention to detail, albeit very small, was never in him at the expense of the general idea of ​​work.",0.17904912889935076,0.03211778774857521,0.2947547435760498,0.15669097006320953,0.9848911762237549,0.8842914700508118,0.17242732644081116,0.06041755899786949,0.1412414312362671,0.2830466628074646,0.7198907732963562,0.008393269963562489,0.0002848112490028143,0.9975098967552185,0.0003961142210755497,0.9473620653152466,0.0007037554169073701,0.019107136875391006,0.972578763961792,0.0005232352414168417
"Sound by Marco Prague as one of the few mature actresses for a place of responsibility and pre -eminence, I was predestined to tie my youth [...] trained by the two major masters of the prose scene in Italy, [...] to the most beautiful and sublime Impro that a very young and disinterested spirit had to give to our country and to us actors with its high and human participation. While the Duse, around the world, blessed this company, here is that Luigi Pirandello, affected by the criticism of Marco Prague, writes to Talli for me. Following Talli's response, here in Milan a Pirandello place with the precise assignment of writing me first actress. Our first understanding took place like this: without being seen there or being spoken of us.",0.17904912889935076,0.907386839389801,0.4550229012966156,0.19774554669857025,0.8691187500953674,0.9588245153427124,0.6042250394821167,0.39243826270103455,0.06407689303159714,0.04680308699607849,0.7018770575523376,0.8806940913200378,0.05762457102537155,0.06178724020719528,0.01808197982609272,0.9776504635810852,0.9935104846954346,0.9954904317855835,0.7550359964370728,0.7985009551048279
"I arrived in Rome with my mother and immediately ran to the Odescalchi Theater to take my place. The company had already gathered for some time; I [...] I came last. A bald man and with a small pointed beard, in the darkness of the stage, his pale and furrowed face, had jumped up with a portentous agility, in contrast with his appearance, as soon as someone said my name. And a warm and vigorous hand shook mine over and over again, with that cordiality that is only proper to men who know how to give and do good. [...] Curiosity, interest, envy, struggles, had turned on from the beginning; Lotte, I mean, by those who have always been against every noble and disinterested art business in the world of theater. The expectation of my presentation, exacerbated by the delay, was very lively. As with every great enterprise in the first beginning, the first settlement was difficult. [...] It was a triumph. A triumph for Bontempelli, for Luigi Pirandello, for the theater and for me. I cried of consolation and bliss. Never again, afterwards, I had such a full and pure joy.",0.17904912889935076,0.9709836840629578,0.4776129126548767,0.9711856842041016,0.99520343542099,0.9982130527496338,0.9565746188163757,0.9959398508071899,0.9585593342781067,0.8658249974250793,0.9185215830802917,0.8371279835700989,0.005878328811377287,0.9986209869384766,0.11717928946018219,0.9933100342750549,0.2232746034860611,0.9782655239105225,0.9986926317214966,0.6627585291862488
"Only, helped by the watchful and constant love of my father, I took the reins of the first company ""Marta Abba"" in 1929, all of young people led and directed by me.  [...] I followed to carry around my greatest interpretations of the Pirandellian repertoire. [...] Wise and expert men of the theater [...] cataloged my repertoire as a cerebral and only artistic (i.e. anti antommerial). And the voice had spread to the public. Cerebral Marta Abba and great only in Pirandellian art. [...] And so the year after a second company of my formation, with a repertoire that was increasingly increasing of new interpretations, among which I like to remember above all that of Madame Legros, by Penelope di Maugham, the good fairy of Molnar, of our companion of Antoine, and of Anna Karenina taken from the novel of Tolstoi and the Grillo of the hearth taken from the novel by Dickens.",0.18035133625380695,0.9805841445922852,0.6142330765724182,0.0914587676525116,0.814109742641449,0.9861322641372681,0.945646345615387,0.9905893206596375,0.7099438309669495,0.9461119174957275,0.7244912981987,0.6728940010070801,0.00032134406501427293,0.9731304049491882,0.4317234754562378,0.9243945479393005,0.9164364337921143,0.9924678206443787,0.6472166180610657,0.7425724864006042
"Returning to the homeland after so many triumphs the most bitter disappointment awaited us: we no longer knew where to go. For debts contracted due to the reconstruction of the Odescalchi Theater that had to be paid by the State and for the delays that occurred in the payment, the theater had to be abandoned to the dealer of Prince Odescalchi. [...] The war began from the day that the will and passion of eleven young people founded a stable theater in Rome. In fact, the Odescalchi theater was also called ""theater of the Eleven"", and they placed Luigi Pirandello in charge; Covered and insidious struggle by a society that has grabbed the whole monopoly of theater in Italy: theaters, repertoires, companies. In the face of this war, I [...] remained to fight next to Luigi Pirandello, then always exposed to all the revenge of the opponents, feeling that the cause for which it was fought was holy, and all in favor of us actors for the dignity of ours profession and for the honor of Italian theater. From the contracts that companies made with the Compagnia del Teatro d'Arte in Rome, directed by Luigi Pirandello, it was demanded that alongside the name of the Maestro it would imagine as with the diction of writing, unique and only, mine; [...] A company that in all the nations of Europe had been welcomed with all the honors of the highest theaters, was condemned to turn almost only in the province [...] the only hope of salvation, South America. She had been promised to American impresario that our company would have been alone starting that year, 1926, for Argentina.",0.18035133625380695,0.08911703526973724,0.44728878140449524,0.32902687788009644,0.9833952188491821,0.9937467575073242,0.9974430799484253,0.18006333708763123,0.5812519788742065,0.8985417485237122,0.898083508014679,0.3826036751270294,0.9401050806045532,0.8875141143798828,0.00513039855286479,0.9883401989936829,0.8035351634025574,0.9922124147415161,0.9873718023300171,0.6068105101585388
"[In Paris] The tests [of Pirandellian, man, beast and virtue] had to start after a few days, only comforted me the fact that they would last at least a month. But I did not have to forget that the character was all to be recreated in another language and with other accents and other ways. I put, suffering, and with long stops in bed, at the study of the part. I tried the effects, which I gradually obtained, on my only spectator, who was a French company young lady; But the theater tests had to be faced. The outcome was superior to all my expectations.",0.18035133625380695,0.9640799760818481,0.00025442743208259344,0.0017375994939357042,0.35162895917892456,0.4071507155895233,0.00021662289509549737,0.0015247564297169447,0.0025481535121798515,0.10261127352714539,0.27681878209114075,0.20506727695465088,0.00012412157957442105,0.5958808064460754,0.0016078045591711998,0.8322080969810486,0.3839641809463501,0.004933166783303022,0.7414202690124512,0.12548573315143585
"While I was waiting for the tests, it was also necessary to think about dressing this character. [...] I had neither time nor a way of turning from Paris to Italian tailors. [...] And here [Mi] with my good script in his hand from a Parisian tailor. When this read the work I saw it to me before the mortified and disheartened. What figure could he make us to dress a character that the author himself described as awkwardly masked of virtue? He did not see how his work could be necessary. I explained to him that it was very necessary. All the more difficult perhaps, at least it was a question of embarking one of the usual elegant living room clothes. New forms had to be created with a new appropriate style. [...] And so it happened. The representation also the clothes as a full part of the creation of the character obtained the most lively success, so much so that the newspaper ""Excelsior"" dedicated a whole page to comment on this new interpretative complement. The shape of my flat tense hat with a rigid modesty on the eyes, the sinuous tail of the armed black dress of the second act and many other founds had obtained the approval of all the criticism and the flower of the public with the test coming general.",0.18035133625380695,0.964006245136261,0.08686842024326324,0.8936319351196289,0.6850084662437439,0.905131995677948,0.01643492467701435,0.10898543894290924,0.028497884050011635,0.06911781430244446,0.7042694091796875,0.6297526955604553,0.0004371553659439087,0.9401686191558838,0.07597918063402176,0.985453188419342,0.18403886258602142,0.9968130588531494,0.2579590082168579,0.09467972069978714
"The performances followed each other for three months, and the most refined show for taste and quality was undoubtedly ours, the Italian one, in that period of the best Parisian theatrical season. I could easily take advantage of this Parisian success [...], but I made my trunks quickly and fury. It was an almost physical need to return to Italy. After this really difficult victory obtained abroad, I did not ask anyone for the recognition of it, only they wanted to have a remuneration asking to be received by our Duce. [...] I would have told him that, since I was a child, I had formed me to that school of courage and daring and faith, of which Benito Mussolini gave an example in our streets and in our squares in Milan [...] I was received in That solemn living room in Piazza Venezia. [...] He was an exquisite guest: he was interested in the events of the French theater, he also asked me with small things, as of the pay I perceived in Paris, and wanted to know when I would resume acting in Italy. [...] I preferred to turn all my attention and my care to the formation of a beautiful company for the imminent comic year. And taken from Naples [...] I then left for Palermo [...] [E] for some extraordinary performances in Sardinia. [...] But I drew in Rome and once again I was rejected by that same people always adverse to me. [...] But all these oppositions I wanted to win them, also for the desire that animated me to approach me more and more warm breath of the masses. I was rewarded.",0.18035133625380695,0.9882243871688843,0.029410889372229576,0.6336280703544617,0.9794158935546875,0.9945036172866821,0.8919913172721863,0.6584009528160095,0.8857010006904602,0.8878976106643677,0.6459187865257263,0.6398671269416809,0.8957812190055847,0.9935997724533081,0.7411223649978638,0.9853304624557495,0.38106653094291687,0.27616825699806213,0.9944587349891663,0.9851199388504028
"How much best party could have been drawn from me, from my art, from my figure, from my voice, from all my scenic game, was seen in my second film, Teresa Confalonieri, who had a sensational success throughout Italy and which was consecrated by the first prize in the Venice International Film Festival. […] The miracle took place on an evening of magnificent full moon, after a week of thunderous rains; And it was for me as a dream, because the successful successful success could not be bigger and more beautiful.",0.18035133625380695,0.9853934645652771,0.03171851858496666,0.9540387392044067,0.8472192883491516,0.8847916126251221,0.0009554314310662448,0.006374804303050041,0.4397892653942108,0.5804330110549927,0.8273316621780396,0.9943976998329163,0.00012784665159415454,0.5564691424369812,0.995768129825592,0.5552137494087219,0.5431346297264099,0.3763648271560669,0.9731377363204956,0.975752592086792
"What I have said so far for the theater I could start saying it also for cinematography. Until a certain point, seeing me constantly kept out of any attempt to experiment with my figure on the screen, I myself asked myself: «But maybe in the film I will not come well? ». I knew that in all other countries after the advent of the spoken film, most of the actresses and actors of the prose theater had been called to play the new subjects. [...] The doubt about my cinematographic possibilities, gradually began to take root in me so much that only by way of essay or test to myself, allowing to accept a part side by side in a film of German origin of which He wanted to make Italian reproduction. To so much he had reduced me to the distrust of others.",0.18035133625380695,0.9818763136863708,0.28967368602752686,0.9501055479049683,0.5592528581619263,0.9442645907402039,0.552489697933197,0.2673396170139313,0.6811049580574036,0.6183354258537292,0.7829121947288513,0.9961693286895752,0.00014419991930481046,0.9081398248672485,0.018544068560004234,0.9739221334457397,0.5864285826683044,0.9961163401603699,0.9775390625,0.5527525544166565
"The most authoritative critics noticed which purchase made Italian cinema with me, that is, with an artist who did not want in anything and at all to resemble the heroines of the films of across Ocean, with gestures, ways, and bearing and his own personal characters; such as to give a typical imprint to Italian production. Who did Italian criticism said to these things? Who listened to them? [...] Marta Abba after that success and after the consecration of criticism it was never called by anyone.",0.18035133625380695,0.9786978363990784,0.4672616422176361,0.36371251940727234,0.5185704231262207,0.8285657167434692,0.517740786075592,0.013600220903754234,0.0627513974905014,0.2780303359031677,0.614356517791748,0.9892416000366211,9.646568651078269e-05,0.9470178484916687,0.012145478278398514,0.9547671675682068,0.13153916597366333,0.08417990058660507,0.9301217198371887,0.2047034054994583
"This, in summary and summary the history of my artistic career so far. The conclusion that logically and on the basis of the facts must be drawn, unfortunately it is not happy. Not so much for me that [...] I always managed to impose myself [...] as for the conditions of dramatic art in Italy.",0.17808217951096594,0.937221884727478,0.0036986898630857468,0.041294679045677185,0.022614656016230583,0.99607253074646,0.9941331744194031,0.003931690938770771,0.00041933555621653795,0.14959020912647247,0.5049328207969666,0.9934021830558777,0.00011669929517665878,0.7972310781478882,0.00027714265161193907,0.9980819821357727,0.0867420881986618,0.0019956142641603947,0.021590331569314003,0.5471703410148621
"I have lived with my secret for about ten years, and I believe that if I had given all the food I chewed and then vomited I could have saved at least a colony of malnourished children. […] Not I say? I think I saved them the malnourished children, from this drug that cares by smiling, who pretends not to be the same as the others.",0.17808217951096594,0.13197234272956848,0.45048651099205017,0.18550850450992584,0.287784218788147,0.8923017978668213,0.30010923743247986,0.09162161499261856,0.6129153966903687,0.029272383078932762,0.054208796471357346,0.9186508059501648,0.03299026936292648,0.12668438255786896,0.2955659329891205,0.7152801156044006,0.05926385894417763,0.9434770345687866,0.8875875473022461,0.03051437810063362
"I didn't drink enough and I devoured solid foods so how I could think of being able to put back, they are physical laws! [...] Any bulimic in the world must know the right dose of liquids based on what he chooses to swallow and for the most refined even what to drink ... sometimes the water is not enough, better the milk.",0.17808217951096594,0.6656754612922668,0.6810130476951599,0.9740813374519348,0.004569012206047773,0.9595255851745605,0.11532942950725555,0.3973662853240967,0.6905232071876526,0.2555028796195984,0.4392832815647125,0.8590813875198364,0.0007519208593294024,0.8146452307701111,0.9941667914390564,0.9944857954978943,0.03145100176334381,0.7814111709594727,0.0002964060113299638,0.026360029354691505
"I am swollen, the skin pulls, the face is deformed. [...] I have a body that varies in weight day after day, excess liquids shake the already existing water in the thighs above all, it is there that you see more. They are all face and thighs. The face of those like me recognizes from the traits. The part of the jaw widens, the precaution becomes as high as the cheekbones, a sign that the liver is swearing in order to make me stop. I have the glands under the enormous neck, they deface the profile making it lose freshness, I am already old. The thighs, on the other hand, take on a colorful post -exposure to the sun of 14 without protection, tingling and moved reluctantly from the ground. I speak to us, I try to motivate them [...] but they don't answer. They have niagara waterfalls undergo my thighs, and moreover they are also deaf. ""I get shit!"" There are no symptoms for certain visions.",0.17808217951096594,0.06689725071191788,0.735160768032074,0.9976015090942383,0.6914764046669006,0.968146026134491,0.07180039584636688,0.8921071887016296,0.000148391627590172,0.9952358603477478,0.3114456534385681,0.41365474462509155,0.014144444838166237,0.741392195224762,0.9926313757896423,0.9412977695465088,0.8047825694084167,0.10569513589143753,0.8839285373687744,0.17971163988113403
"[The daughter] works on the interiors, I just trust. [...] System things, took space, illuminated the darkness, heated the area that now spits out only what should not remain inside. [...] Slowly, very flat, remodel the strokes, with the feet stops the black holes and do not give up the grip. It is so strong. For nine months it does not stop a second to build me. [...] He works on the destroyed soul, renovates the foundations and what I ask I do, because the right materials are needed this time. What I eat remains there and turns into healthy pieces of me.",0.17808217951096594,0.2608852684497833,0.7809467315673828,0.8924776911735535,0.9313471913337708,0.950344443321228,0.027032097801566124,0.9887915253639221,0.053631339222192764,0.05084311589598656,0.2034550905227661,0.8610334992408752,0.0010455743176862597,0.1391485333442688,0.10426991432905197,0.973319411277771,0.975534200668335,0.1990480273962021,0.6578100323677063,0.0005924533470533788
"Sembro incinta al settimo mese e la cosa non mi dispiace affatto, mi porta in uno stato catartico che mi impone di continuare a recitare la parte della gravida felice. Mi purifico dalla colpa e sogno che tutto quel cibo pari a uno scaffale intero di un vecchio alimentari sia il mio primo figlio e che ad aspettarmi fuori dalla porta ci sia tutto l’amore del mondo. Mi siedo e mi rialzo sentendo la pressione della pancia, fingo di percepire qualcuno dentro e per un attimo mi dona quella pienezza che da sola proprio non riesco a sentire.",0.17808217951096594,0.4457204341888428,0.8688335418701172,0.7366019487380981,0.9958896636962891,0.9546776413917542,0.1270817071199417,0.9955444931983948,0.13815778493881226,0.9507042169570923,0.6138557195663452,0.874457836151123,0.03278682008385658,0.37440821528434753,0.766777753829956,0.9830598831176758,0.9811847805976868,0.9822220206260681,0.994198739528656,0.07004433125257492
