"Per fortuna la sorte, vicino agli ostacoli, spesso ti fa trovare anche una sorpresa, una traccia di vento che inverte la rotta, l’annuncio di una soluzione. E così fu per noi. La moglie di Goffredo Lombardo, il produttore che si era inventato il mio nome d’arte, aveva vissuto un’odissea simile alla mia ed era incappata nella persona giusta. Un uomo, prima che un medico. Si chiamava Hubert de Watteville e dirigeva la clinica di ginecologia dell’Ospedale cantonale di Ginevra. Era un signore alto e molto magro, sulla sessantina, il naso aquilino e i modi aristocratici, un po’ distaccati. All’inizio rimasi delusa, cercavo un padre accogliente più che un asettico professionista. Ma mi sbagliavo. Conoscendolo, avrei trovato in lui uno degli uomini più affettuosi e sensibili che abbia mai in contrato. Lui stesso senza figli, aveva riversato il suo desiderio di paternità nel lavoro, e i bambini che aiutava a nascere erano anche un po’ suoi. Dopo aver studiato a lungo il mio caso, arrivò a conclusioni ben più ottimistiche di quanto mi aspettassi. «Non c’è niente che non vada, lei è una donna normalissima. La prossima volta che rimarrà incinta, dovremo monitorarla da vicino per capire esattamente come intervenire. Vedrà, questa volta andrà tutto bene.»",0.18498741649091244,0.7685167789459229,0.5852006673812866,0.7654576301574707,0.9580541849136353,0.9957373738288879,0.6655798554420471,0.9883330464363098,0.8029345273971558,0.8103941082954407,0.5592473149299622,0.9476302862167358,0.22527359426021576,0.99776691198349,0.969636082649231,0.9975981116294861,0.9914705157279968,0.8253729939460754,0.9761443138122559,0.9031491279602051
"Carlo [Ponti] aveva trentanove anni, ventidue più di me, ed era già un nome, nel pieno della sua folgorante carriera. Come si premurò di dirmi quando venne a presentarsi al termine del concorso, aveva scoperto grandi dive come Gina Lollobrigida, Sylva Koscina, la mia adorata Lucia Bosè. «Facciamo una passeggiata nel parco? È un luogo incantevole, lo chiamano “il giardino delle rose”, sentirà che profumo...» Intanto mi faceva alzare, posandomi sulle spalle il mio leggero scialle di organza. “Ci risiamo” mi dissi, preparandomi dentro di me a respingere le solite avances. In realtà, Carlo fu molto professionale e si guadagnò all’istante la mia fiducia. Mi raccontò dei film che stava facendo, mi chiese di me, sondò le mie intenzioni. «Da dove viene, signorina? Ah, Pozzuoli? Se non sbaglio, c’è un bellissimo anfiteatro romano... Ci sono stato qualche anno fa.» «Sta proprio davanti a casa mia, lo vediamo dalle nostre finestre» gli risposi, grata che avesse trovato un punto comune tra noi. Da subito mi comunicò uno straordinario senso di sicurezza e di familiarità, come se ci conoscessimo da sempre. Ebbi la strana impressione che mi avesse capito, che avesse letto dietro la mia bellezza impetuosa le tracce di un carattere riservato, di un passato difficile, di una gran voglia di fare bene, con serietà e passione. Per me non era un gioco, era molto di più.",0.18498741649091244,0.9216465353965759,0.9781785011291504,0.47543635964393616,0.9625837206840515,0.9584497213363647,0.7024128437042236,0.7639977335929871,0.07768024504184723,0.7948363423347473,0.6120120286941528,0.9585475921630859,0.2689339816570282,0.957421600818634,0.6789145469665527,0.9868848919868469,0.9737907648086548,0.7267399430274963,0.9564936757087708,0.88719242811203
"Tre anni dopo sarebbe scomparso pure Marcello [Mastroianni ndr.]. L’ultima volta che lo vidi fu a Milano. Lui entrava nella sua macchina per andare a teatro a provare Le ultime lune, di Furio Bordon. Io salivo sulla mia, diretta all’aeroporto. Marcello mi lanciò uno sguardo lunghissimo, forse indovinando che non ci saremmo visti mai più. Faccio ancora molta fatica a tornare ai giorni della sua morte. Il mondo parlava, declamava, presenziava, celebrava. Io stavo chiusa nella mia stanza, avvolta dal mio pudore. Non volevo me scolare il mio dolore a quello degli altri, non volevo sbandierare i miei sentimenti a uso e consumo dei media. Me ne stavo da sola, cercando un modo di capire fino in fondo quello che era successo. Il giorno del suo funerale mandai un tappeto di orchidee, perché lo accompagnassero con la loro delicata freschezza. E gli portassero il mio amore di sempre.",0.18498741649091244,0.9904906749725342,0.9822998642921448,0.8571350574493408,0.9958571195602417,0.9971268773078918,0.9483814239501953,0.9402186870574951,0.43649715185165405,0.9395224452018738,0.7662631869316101,0.9874125123023987,0.22793859243392944,0.9965724945068359,0.9714128375053406,0.9976102709770203,0.9413536190986633,0.901761531829834,0.9731382131576538,0.9620113372802734
"Io intanto vivevo la mia vita come potevo, nascosta dietro un velo sottile ma tenace di timidezza. Sì, è diffìcile da credere, ma ero veramente timida, forse anche per via della nostra condizione. Mio padre non c’era e mia madre era troppo bionda, alta, viva, e soprattutto non sposata. La sua bellezza eccentrica e sopra le righe mi metteva in imbarazzo. Sognavo una mamma normale e rassicurante, con i capelli neri, il grembiule stropicciato, le mani rovinate e gli occhi stanchi.",0.18498741649091244,0.8030509352684021,0.6524690389633179,0.9467089176177979,0.9370167255401611,0.9934306144714355,0.36279261112213135,0.9906821250915527,0.9501093626022339,0.8411628603935242,0.7122312784194946,0.9593573808670044,0.11189664900302887,0.8894449472427368,0.9821964502334595,0.9930148124694824,0.9969308376312256,0.865447998046875,0.9728062748908997,0.7506213784217834
"Mentre cominciavo a rilassarmi, mi lasciai scappare una battuta innocente. O forse no.. «Cary mi ha mandato un mazzo di rose gialle, prima che partissi. Giallo gelosia? Quanto è carino...» Carlo si girò di scatto e mi stampò uno schiaffo, sotto gli occhi di tutti. Avvampai, l’impronta bianca dei suoi polpastrelli sulla mia guancia arrossata bruciava di rabbia e di vergogna. Sentii le lacrime scendere a una a una sul viso. Mi sentivo morire, ma dentro di me sapevo che in qualche modo me l’ero cercata. E non me ne pentivo. A vent’anni si deve imparare a vivere, e l’amore di Cary mi aveva dato molto. Forse anche il coraggio di lottare per una vita normale con Carlo. D’altra parte, ero giovane ma non stupida. Intuivo che quello schiaffo, oggi come oggi difficile da capire, era il gesto di un uomo innamorato, che si era visto minacciato da un altro uomo, aveva rischiato di perdermi e solo ora si stava riprendendo dallo spavento, dal dispiacere. Piansi ma non troppo perché l’aeroplano era pieno. La hostess si avvicinò chiedendomi timidamente se avessi bisogno di qualcosa.",0.1862898957915604,0.8241313695907593,0.14434978365898132,0.7623977661132812,0.8552854657173157,0.9951843619346619,0.5954241156578064,0.030794305726885796,0.889552116394043,0.750037670135498,0.8395139575004578,0.9747939109802246,0.02997484616935253,0.9960992932319641,0.9208894968032837,0.9952983856201172,0.9772807359695435,0.8070631623268127,0.9823481440544128,0.9392872452735901
"Tutto a un tratto ero diventata una diva, con un ufficio stampa dedicato a diffondere al meglio la mia immagine, ma dentro di me ero sempre una bambina dagli occhi sgranati che voleva diventare attrice, una donna che voleva sposarsi e avere dei figli, come tutte le altre donne. Vivevo alti e bassi come tutti, e lavoravo con passione e disciplina, come sempre. Crescevo dentro la mia piccola grande favola mentre la costruivo giorno dopo giorno, riga dopo riga, pagina dopo pagina.",0.1862898957915604,0.9376458525657654,0.6656019687652588,0.2617444694042206,0.9015432596206665,0.9802504777908325,0.21573922038078308,0.9607837796211243,0.9137951135635376,0.6510701179504395,0.479210764169693,0.9769406318664551,0.0022452136036008596,0.5801302790641785,0.831218957901001,0.9871490001678467,0.9711824059486389,0.9580892324447632,0.8464887738227844,0.9577991962432861
"La prima a credere in me per Peccato che sia una canaglia fu Suso Cecchi D’Amico, l’unica donna nel parterre dei grandi sceneggiatori dell’epoca. «La quercia che ha fatto fiorire tra i suoi rami tanto cinema italiano» come la definisce Lina Wertmüller. Leggendo i Racconti romani di Moravia, Suso si era imbattuta in una bella vicenda che stava proprio all’inizio della novella II fanatico. Ricordo che ci incontrammo un giorno sul treno. Dopo aver mi intravisto alla stazione, venne nel mio scompartimento e si sedette accanto a me, con una confidenza che mi mise subito a mio agio. «Ho in mente un soggetto che fa per te» disse semplicemente, guardandomi dritta negli occhi. «Perché no?!» replicai subito con il mio solito slancio. Suso aveva lavorato alla storia con Flaiano, Moravia e Continenza, e l’avevano proposta a Blasetti, che all’epoca cercava il soggetto per un film. [...] Dopo quel nostro breve incontro ferroviario Suso, appoggiata da Flaiano e dallo stesso Blasetti, insistette con i produttori fino a ottenere la parte per me.",0.1862898957915604,0.9772046208381653,0.09629345685243607,0.44203177094459534,0.9055758714675903,0.9975793361663818,0.9929363131523132,0.237421914935112,0.5831828713417053,0.630483865737915,0.8541254997253418,0.9866074323654175,0.379051148891449,0.9953845739364624,0.5762650966644287,0.9935505390167236,0.9958648085594177,0.9661241769790649,0.9624500870704651,0.9753567576408386
"Le contrazioni si intensificarono, come fossi in travaglio, ed ero gialla come un limone. Mia madre, che ci aveva raggiunti, si scagliò contro di lui [il ginecologo, ndr.] con tutte le sue forze: «Non vede che faccia ha? Sta perdendo il bambino!». Ma fu inutile. Il suo cocktail non poteva aspettare. Quando alle quattro di mattina i dolori cessarono improvvisamente, capii che era tutto finito. Fu Ines a chiamarlo, di fronte al fatto compiuto. Lui arrivò con calma, verso le sei, e fu a dir poco tranchant: «Signora, lei ha di certo dei bei fianchi, è una donna bellissima, ma non avrà mai un figlio». Le sue parole mi fecero sentire incapace, arida, profondamente inadeguata, e annientarono ogni mia speranza. Altro che favola. La mia vita stava prendendo una deriva triste e senza futuro. A rendere tutto più difficile ci pensarono i giornali, che non persero tempo a sbandierare ai quattro venti il nostro dolore.  «Ora posso tornare sul set a finire il film» dissi a Carlo, appena mise piede nella mia stanza direttamente dall’aeroporto. Cercavo invano di essere brillante, di fare la dura. Il suo sorriso si contrasse in una smorfia, lasciando trapelare tutto il suo senso di impotenza. Solo in quel momento mi lasciai andare, abbandonandomi a un pianto a dirotto che non finì più.",0.1862898957915604,0.9772211909294128,0.7825817465782166,0.7923928499221802,0.9463850855827332,0.9956564903259277,0.7879884243011475,0.9603230953216553,0.8123716711997986,0.9341374635696411,0.9085704684257507,0.9865378737449646,0.20627444982528687,0.9970579147338867,0.8194102644920349,0.9928153157234192,0.9947678446769714,0.876832902431488,0.9799699187278748,0.9318956136703491
"[...] con i soldi guadagnati  un milione di lire , mammina, Maria e io ci trasferimmo in un appartamento più grande in via Balzani e io potei finalmente riscattare l’onore di mia sorella. Mio padre, se mai per un attimo c’era stato, era definitivamente sparito dalla mia vita, non cercavo più di amarlo. Proprio per questo non mi fu diffìcile girargli il cachet di Aida ottenendone in cambio un cognome: per me un guscio vuoto, per mia sorella la salvezza. Maria Villani divenne Maria Scicolone e potè finalmente voltare pagina, tornare a scuola, incominciare a vivere. Inutile forse soffermarsi sul seguito della triste vicenda. Io, comunque, ero salva. Con i miei mezzi, come potevo, avevo ri percorso la nostra storia famigliare, per capire ciò che da bambina mi appariva troppo grande da affrontare. Ed ero arrivata alle mie conclusioni. Non tutti gli uomini erano come Riccardo Scicolone, non tutte le vicende dovevano per forza ripetersi. Al mio fianco volevo una persona diversa, che potesse rendermi davvero felice. Ancora non lo sapevo con certezza, ma la vita presto mi avrebbe dimostrato che io, il mio uomo ideale, l’avevo già incontrato.",0.1862898957915604,0.9350683689117432,0.9073881506919861,0.5809215307235718,0.9385867714881897,0.9971819519996643,0.9675806164741516,0.9979719519615173,0.9204657077789307,0.7519358396530151,0.6455546617507935,0.9741587042808533,0.38984593749046326,0.9963163733482361,0.8711646795272827,0.9961267113685608,0.9677894115447998,0.9732714891433716,0.9423483610153198,0.9432291388511658
"Fu durante le riprese di Una giornata particolare che Riccardo Scicolone morì. Una mattina, mia sorella mi telefonò sul set, in lacrime: «Sofì’, vieni subito, papà sta male». Corsi all’ospedale e intorno al suo letto trovai le donne della sua vita. Mammina, Maria, la sua ultima compagna tedesca. Mi avvicinai e gli strinsi la mano. Lui mi fissava. E io sostenevo il suo sguardo, come paralizzata. Gli sorrisi, poi mi allontanai verso la finestra dove c’era Maria che piangeva. Guardai fuori. Visti dall’alto, macchine, passanti, biciclette sembravano nient’altro che giocattoli. Cercai di piangere anch’io ma non ne fui capace.",0.1862898957915604,0.955695390701294,0.7849536538124084,0.7537841200828552,0.9109126329421997,0.9965611100196838,0.9507274031639099,0.9982923269271851,0.9044114351272583,0.9154025912284851,0.8196277022361755,0.9802994132041931,0.048926305025815964,0.9973596334457397,0.982965350151062,0.9975574016571045,0.9988045692443848,0.8445964455604553,0.9869617819786072,0.875215470790863
"Carlo [Ponti ndr.] aveva saputo che Stanley Kramer, il produttore di Mezzogiorno di fuoco, era in Spagna, dove si stava preparando a girare un dramma in costume sulle guerre napoleoniche. All’inizio, dovevano esserci Brando e la Gardner. Ma Marlon si era tirato indietro, era subentrato Sinatra, che però era in rotta con Ava... insomma, il solito pasticcio hollywoodiano. L’unica certezza era Cary Grant, il quale, tuttavia, per contratto aveva il diritto di approvazione dei partner e non si sarebbe certo accontentato di avere a fianco una quasi sconosciuta, per di più italiana. Carlo, come al solito, non si fece scoraggiare: diede un colpo di telefono a Kramer e lo invitò a Roma per mostrargli La donna del fiume. E il regista, appena finita la proiezione, lo anticipò, prendendolo di sorpresa. «Cosa ne dice di duecentomila dollari per Miss Loren? Penso che sarebbe perfetta per la parte.» Carlo non si scompose, lasciò passare una manciata di secondi e poi replicò fìngendo un certo distacco: «Interessante, mi ci lasci pensare, devo verificare i suoi prossimi impegni, ma in linea di massima direi di sì, si può fare». «È stata la decisione più facile della mia vita» commentò quella sera aspettando che Stanley ci raggiungesse per cena. Era un cachet da star. Ora si trattava di guadagnarselo.",0.1862898957915604,0.9967978000640869,0.4595489799976349,0.6052093505859375,0.7689353823661804,0.9978781938552856,0.9089509844779968,0.051595646888017654,0.3596589267253876,0.6776086688041687,0.8125004172325134,0.970963180065155,0.6134010553359985,0.997850775718689,0.4637517035007477,0.9656104445457458,0.9923878908157349,0.9605655670166016,0.9885595440864563,0.918369472026825
"La prima a credere in me per Peccato che sia una canaglia fu Suso Cecchi D’Amico, l’unica donna nel parterre dei grandi sceneggiatori dell’epoca. «La quercia che ha fatto fiorire tra i suoi rami tanto cinema italiano» come la definisce Lina Wertmüeller. Leggendo i Racconti Romani di Moravia, Suso si era imbattuta in una bella vicenda che stava proprio all’inizio della novella Il fanatico.Ricordo che ci incontrammo un giorno sul treno. Dopo aver mi intravisto alla stazione, venne nel mio scompartimento e si sedette accanto a me, con una confidenza che mi mise subito a mio agio.«Ho in mente un soggetto che fa per te» disse semplicemente, guardandomi dritta negli occhi.«Perché no?!» replicai subito con il mio solito slancio. Suso aveva lavorato alla storia con Flaiano, Moravia e Continenza, e l’avevano proposta a Blasetti, che all’epoca cercava il soggetto per un film. La prima scelta della produzione era stata la LoIlo, che allora era considerata la numero uno. Ma Suso mi aveva visto a Cinecittà, mentre lavoravo con Bolognini a Ci troviamo in galleria, ed era rimasta colpita dalla mia allegria. Nel film ballavo il mambo, che avrei continuato a ballare nella Donna del fiume e in Pane, amore e..., con il mio sfavillante vestito rosso.Dopo quel nostro breve incontro ferroviario Suso, appoggiata da Flaiano e dallo stesso Blasetti, insistette con i produttori finoa ottenere la parte per me.",0.1862898957915604,0.9794866442680359,0.07158076018095016,0.8632753491401672,0.9605575203895569,0.9978019595146179,0.9926366209983826,0.5757271647453308,0.8427737951278687,0.7452547550201416,0.8870068788528442,0.9920049905776978,0.45104265213012695,0.9959831237792969,0.8144683241844177,0.993215024471283,0.9968705177307129,0.8457931876182556,0.9783862233161926,0.9790467023849487
"“Fiducia” sembra quasi una parola d’ordine. Con il tempo imparai che la vera sfida nel nostro mestiere, e forse non solo nel nostro, sta nel trasformare la fiducia degli altri in autostima. E lì che comincia l’esperienza, nel momento in cui impari a credere in te stessa, a far tesoro dei tuoi successi e dei tuoi errori.",0.18323348346166313,0.9151622653007507,0.19294819235801697,0.1739855855703354,0.9058930277824402,0.8363416790962219,0.09838756918907166,0.07615926861763,0.055663563311100006,0.23528796434402466,0.05943997949361801,0.9724856019020081,0.610110342502594,0.6474077105522156,0.07774917036294937,0.9672209620475769,0.19349436461925507,0.27136147022247314,0.239247664809227,0.3180747330188751
"In Peccato che sia una canaglia, io e Marcello [Mastroianni] ci incontrammo per la prima volta in uno splendido bianco e nero e ci innamorammo subito l’uno dell’altra. Cinematograficamente, s’intende. Ricordo ancora la prima volta che lo vidi. Stavo sulla scala del palazzo in cui avremmo girato e lui, da qualche piano più su, mi guardava. «Ciao» mi salutò come fosse per aria. «Ciao» risposi, timida ed emozionata.La nostra fu una sintonia immediata, che rimase intatta sino alla fine, senza mai un’incrinatura. In quel primo set im parammo a conoscerci sullo sfondo della Roma allegra e luminosa del Dopoguerra, dove la gente aveva ripreso a viaggiare, ad andare al mare, a fare il bagno, ad amarsi e a divertirsi. Stavamo bene insieme, Marcello e io. Che coppia! Semplice, bella, vera.",0.18323348346166313,0.97798752784729,0.867805004119873,0.5782209038734436,0.9753110408782959,0.9965316653251648,0.9800398945808411,0.9757194519042969,0.8412609696388245,0.2480136752128601,0.8654682040214539,0.985005795955658,0.007381037343293428,0.9986890554428101,0.9880914092063904,0.9974101781845093,0.9283120632171631,0.19266223907470703,0.9945772886276245,0.9423394799232483
"Mi diedero una cella singola  che aveva, come sottolineò il presidente della Repubblica Pertini, perfino il lusso del televisore  e mi consigliarono di non frequentare le altre detenute: mi trovavo infatti in una situazione delicata che poteva diventare pericolosa. Cercai comunque di trasmettere a quelle ragazze sfortunate affetto, gentilezza, speranza, e quando uscii le salutai una per una. Avevo provato in prima persona, anche se per poco, ciò che alcune di loro avrebbero dovuto vivere per anni e, con l’aiuto delle nove splendide suore che si occupavano di noi, volli che sapessero che non le avrei mai dimenticate. E così è stato. In carcere scoprii che il tempo cambia passo, si gonfia di pensieri bui, diventa amaro. Cercavo di addomesticarlo leggendo, osservando, talvolta cucinando. E soprattutto scrivendo.",0.18323348346166313,0.911767840385437,0.3149767518043518,0.1425982117652893,0.9669395089149475,0.9803926348686218,0.35874176025390625,0.7636559009552002,0.45179468393325806,0.9814097285270691,0.5609219074249268,0.9896281957626343,0.3263108432292938,0.9018089771270752,0.6271041631698608,0.9963270425796509,0.9983322620391846,0.995190441608429,0.9444054961204529,0.8689016699790955
"Oggi, rispetto ai miei tempi, le donne probabilmente sono più fortunate, vengono giudicate sulla base di quello che sanno fare più che sul loro aspetto. Ma, aumentando la possibilità di scegliere, aumentano anche le difficoltà nel bilanciare famiglia e lavoro. Il mondo è più complesso, più esigente, e richiede alle ragazze grandi sacrifìci, proporzionati alle soddisfazioni. Eppure, alla fine, si torna sempre allo stesso punto e ognuna di noi fa i conti con se stessa. [...] L’ho detto tante volte, e lo ripeto anche oggi: sono loro, i miei figli, i miei film migliori. Ed è la loro felicità il premio che mi onora di più.",0.18323348346166313,0.9833431839942932,0.4201223850250244,0.12927506864070892,0.944725513458252,0.9659397006034851,0.27056050300598145,0.9948590993881226,0.06960667669773102,0.675357460975647,0.2860005497932434,0.9051392078399658,0.38173243403434753,0.8560141921043396,0.7848928570747375,0.9938610792160034,0.9947382807731628,0.9411899447441101,0.959284245967865,0.836073100566864
"Lombardo era stato il responsabile del mio battesimo artistico. “Lazzaro” non gli piaceva, e tanto meno “Scicolone”. Gli serviva un cognome corto, facile da pronunciare, che avesse una certa qual allure. Fu così che, fissando un manifesto appeso alle sue spalle in cui campeggiava la bella attrice svedese Marta Torén, fece un giro dell’alfabeto fino a fermarsialla “elle”: «Soren, Toren, Loren... Sì, ci siamo: Sofia Loren!». Già che mi stava ribattezzando, sostituì la “effe” di Sofia con il “ph”, et voilà, un nome da star internazionale. Peccato che a Pozzuoli mi avrebbero chiamato per sempre “Sopìa”, non capendo il perché di questo inutile cambiamento.",0.18323348346166313,0.7035860419273376,0.009012512862682343,0.1257329285144806,0.4921676218509674,0.9908403158187866,0.7463607788085938,0.02173374965786934,0.21051518619060516,0.7678360939025879,0.47005122900009155,0.9613476991653442,0.0040906150825321674,0.9922668933868408,0.1613941788673401,0.918321430683136,0.9962613582611084,0.7946717739105225,0.9157474040985107,0.8580095171928406
"Mi presentai, tutta trafelata, all’indirizzo che Ponti mi aveva dato e mi trovai di fronte a un comando dei carabinieri. Mi caddero le braccia: l’istintiva diffidenza, che forse mi aveva instillato proprio mammina, mi fece subito pensare a un brutto scherzo. “Ecco qua, mi ha preso in giro. Quello fa il produttore come io la ballerina!” Sentivo montare la rabbia mista a un senso amaro di umiliazione. “Come ho potuto credergli! Stupida stupida stupida!” Il pensiero corse subito a mio padre, e ai mezzucci con cui aveva attirato Romilda nelle sue spire. Grazie al cielo, però, non sempre le storie devono ripetersi uguali, e la mia era tutta ancora da scrivere. Ci pensò il giovane carabiniere di leva a rassicurarmi. «Se cerca la casa di produzione PontiDe Laurentiis, è il portone a fianco.» Mi sentii sciocca e infantile, ringraziai con un grande sorriso e mi apprestai a entrare nel cuore del cinema italiano. Di lì a qualche giorno avrei compiuto diciassette anni.",0.18323348346166313,0.8761566281318665,0.935888946056366,0.5693340301513672,0.9725552797317505,0.9976299405097961,0.9808416962623596,0.9427083134651184,0.9906943440437317,0.956836462020874,0.7662354111671448,0.9727983474731445,0.03455644100904465,0.9985458254814148,0.9534353017807007,0.9871084094047546,0.8667581677436829,0.9883135557174683,0.9829390048980713,0.4679892063140869
"Durante le riprese, Carlo mi chiamò per darmi una brutta notizia. Ero in albergo, avevamo finito da poco di girare. «Sophia...» «Che c’è? Perché quella voce?» ...... è morta Marilyn, si è saputo ora. Barbiturici. Parlano di suicidio.»Rimasi muta, appesa al telefono, senza sapere cosa dire, tanto che Carlo si inquietò. Sapeva bene che dietro quella mia facciata rigorosa e determinata si nascondeva una donna emotiva. «Sophia, ci sei?»«Sì, sì, come no, dove vuoi che vada...»Quella morte così precoce, così ambigua, mi turbò nell’intimo e mi fece molto riflettere. Mi lasciai invadere da mille immagini vorticose e confuse. Pensai al senso della bellezza, alla solitudine, al bisogno di sentirsi amati che è nel cuore di ognuno di noi. Rividi quel suo sorriso seducente, velato di nostalgia. Non basta essere la donna più bella del mondo per essere felice. Marilyn era una grande attrice, rimasta schiacciata dal peso del proprio talento, da uomini che le avevano chiesto tutto senza dare niente in cambio, o che avevano preteso di trasformarla secondo i loro gusti. Non era riuscita a trovare la sua strada. Sentii un brivido, come se un’ombra si posasse tutto intorno. Il nostro è un mondo crudele, che si alimenta, si accontenta dell’apparenza e raramente si chiede che cosa ci sia sotto. Per questo sta a noi tenere la favola ancorata alla vita, per non di menticarci chi siamo, da dove veniamo. II fascino di Marilyn aveva finito per distruggerla riducendola a un sex Symbol senza gioia.",0.18323348346166313,0.5624669194221497,0.3079376518726349,0.7304592728614807,0.6306795477867126,0.9283437132835388,0.7449861168861389,0.15378598868846893,0.2854665219783783,0.7940940260887146,0.7411304116249084,0.9077117443084717,0.07019957154989243,0.9919608235359192,0.9835494160652161,0.9493157863616943,0.9791471362113953,0.5323958992958069,0.845622181892395,0.8442039489746094
