"Often the actors are as beautiful as you can see them on the screen. But they are much more unhappy than it appears and is not known. They are unhappy in a more or less the same way, men and women. Because it is equally difficult, for one and the other, to live with the myth of oneself: to become a sex symbol then means, for the rest of life, to continually deal with the anguish of not being up to its own Myth, with the fear of disappointing the people who will meet you on the street, with the anxiety of losing their power of seduction. From anguish and insecurity to neurosis, up, in some cases, to disease and paranoia: the step is relatively short.",0.18111495673656464,0.7632833123207092,0.00013357351417653263,0.9808188676834106,0.0010918214684352279,0.07203982770442963,0.0002077182725770399,0.002128730993717909,0.0006811053026467562,0.0003933883272111416,0.0010302031878381968,0.9980508089065552,0.00013984627730678767,0.8632556796073914,6.843531446065754e-05,0.061254821717739105,0.28789517283439636,0.0004343078762758523,0.9952336549758911,0.5564442873001099
"Thanks to the sky, I never confused myself with the girl who appeared photographed in the newspapers. Otherwise I would have lost my mind. People sometimes are amazed that my friend Alain Delon talks about himself in the third person. The fact is that it usually ignores what a star life means; rumors about our account, nugoli of courtiers, servants who show us the world as a vast satellite. We are most idolated, the more we must be stronger to not lose our identity of being human. I was lucky enough to have always been aware of my identity. When I look at me on the screen, I know it's not really me, but someone who looks like me. I have never confused the roles. And when someone who smiles me, I am simply happy on the street, as if they congratulated me for having worked well. I have never tried to seduce, to lie, I limited myself to trying to make it dream.",0.18111495673656464,0.5396385192871094,6.154269794933498e-05,0.94172602891922,0.0006355319055728614,0.9312614798545837,0.00048364661051891744,0.006808485370129347,0.37483417987823486,0.00018250594439450651,0.00014388139243237674,0.9993364214897156,0.00017420256335753947,0.76960289478302,0.03360340744256973,0.973370373249054,0.9937201738357544,0.004408747889101505,0.10589709877967834,0.12106728553771973
"In 1962, Marilyn Monroe committed suicide. He was thirty -six years old. That news exploded like a bomb in those years of sweet life, like the announcement of a divine curse, of a punishment launched on a woman too beautiful who had played too much with the desire of men ... I was interviewed by some journalists at regard. They asked me if I was afraid of that fate of actress. Why that comparison? It was absurd. We had nothing in common, Marylin and I. I did not feel involved in that death more than any other girl from my generation could be. But I understood the loss, the desperation of Marilyn. Here is a star who had been lost. But she had nothing to cling to! Not only did he miss the great love. The presence of a secretary, of a doctor, of passenger lovers, could nothing against solitude and suffering of childhood, the absence of the family. He had been thrown to the public without anyone who protected it, increasing his fragility. On the contrary, I felt very strong, and above all deeply normal. I owe it to dad, to mom, in Blanche, Bruno, Adrien, and Beppo, our wolf dog. My family gave me security and normal. At home, there was talk of my brothers' electronic studies, in the same way that the filming of my film was talked about. We all had dreams, desires, works. Adrien became Cameraman, but Blanche was unable to follow my footsteps in the cinema. It was difficult to impose another cardinal. In any case, this is what Cristaldi claimed. Of course, my job was a little strange, not only because I earned much more than all the others, but because it continued outside the set, during the evenings in a long dress, the seats by the photographer, the interviews. But I remained Claude, the older sister who had a minister's agenda, and that others treated like a star. The reporters came to interview me on this, on that, but in the family my opinion did not count more than the others. There was not even talk of the famous people I knew. It would have already been a lot if my mother had allowed them to call them ""respectable people"". They had too many money and were too famous. He pretended that they didn't exist. That slightly misunderstood world remained outside the home.",0.18123282748274505,0.0004072931769769639,0.015979034826159477,0.000512094353325665,0.000469415943371132,0.9983083009719849,0.9997531771659851,0.8653596043586731,0.6610649228096008,0.02263605035841465,0.0007007580134086311,0.2668878436088562,0.0003527530061546713,0.9906005859375,9.905364277074113e-05,0.1870078444480896,0.9916397333145142,0.007653588429093361,0.09102268517017365,0.9994463324546814
"Rita Hayworth was shocking. He lived the worst tragedy for a star: a slow decline. Was he already sick of Alzheimer's when I met her? I ignore it. I just know he was deeply unhappy. One day, on the set of the circus, we saw her arrive with bruises on the face. I don't know who had reduced it that way. But I think he had many problems with their children who did not tolerate to see her drink. It was excruciating to meet a goddess reduced to that state. I felt almost uncomfortable, with my twenty -four years old, my smile, my successes. I wanted to hug her, console her. One day, we found ourselves together in front of the lights of the mirrors, for a touch -up between one scene and another. Looking at me he said to me: ""I too was beautiful."" A compliment that did not hide a certain hostility. I was unable to take myself and cried. My emotion touched it. In front of that blinding light, which does not forgive, we dropped the mask. I felt helpless. All you could do is surrender to fate, and perhaps, for a moment, accompany it along its last stretch of road. We will perhaps be surprised to know that the intimate relationships tighten in this way on the set, and that they often end with the last clapperboard. But this is the case. We actors, we have only one family on the scene: the one that the casting has given us.",0.18123282748274505,0.00018246445688419044,0.0002008284063776955,0.008021482266485691,0.00036022617132402956,0.023168178275227547,0.008096358738839626,0.9852502346038818,0.02759283035993576,0.9976950287818909,9.2837777629029e-05,0.9224381446838379,7.193181227194145e-05,0.8448483347892761,8.019556844374165e-05,0.15252187848091125,0.997965395450592,0.00024240888888016343,0.994884192943573,0.9822491407394409
"Visconti had fun causing us. ""Claudine, I don't want fake kisses, fake caresses ..."" I acted as cunning, I played in turn, and Luchino appreciated me more: I didn't fall into the trap, showing him that, despite my smile, mine Sensuality, my apparent sweetness, I was a strong woman. After all, he could only love women of character; Chanel, the Dietrich. On his desk, in Rome, there was only one photo, signed ""I love you"", the blue angel.",0.18123282748274505,0.001312249107286334,7.308033673325554e-05,0.9847868084907532,0.0001905628014355898,0.006291875150054693,0.0006729185697622597,0.04404627904295921,7.84285512054339e-05,6.777403177693486e-05,0.0003440217406023294,0.9920190572738647,0.0001606932928552851,0.9967350363731384,0.00010594583000056446,0.0055575077421963215,0.9997001886367798,0.01837952621281147,0.27902066707611084,0.08314526081085205
"Nobody in the house has ever thought of calling me ""Claudia"", I was Claude, a androgynous name that was well suited to my nature as a male, always sweaty, rowdy, crack, refractory to every female fronzole. The names of Joséphine and roses my grandmothers, also adapted to the colonial style, also include on my registry of registry.",0.18123282748274505,0.01301959902048111,0.0898444652557373,0.877712070941925,6.047663919162005e-05,0.09062634408473969,0.0015198354376479983,0.997073769569397,0.981849730014801,0.015015428885817528,0.03509347885847092,0.05562932789325714,0.00013331667287275195,0.9806349277496338,0.00010983726679114625,0.0030436445958912373,0.9893025755882263,0.007523106876760721,0.00047806891961954534,0.00012997300655115396
"And I had no longer met love, what the girls dream. The great love. On the sets, for everyone I was the manufacturer's young lady. A completely common model of actress. De Laurentiis and Silvana Mangano, David O. Selznick and Jennifer Jones, Carlo Ponti and Sophia Loren could be mentioned ... but also Franco Cristaldi and Claudia Cardinale. I was undoubtedly the only one to have been surprised by this ending, this slow, slow, progressive, metamorphosis of our relationship. Franco had always proceeded to everything, he had always dealt with me. By dint of being like a husband, in the end he had become. Almost. Because he was already married. But at the time of our meeting, he was separated. I have never stolen my husband from anyone. However, that was the freedom I dreamed when, at eighteen, I decided to find the means to raise my son alone? Cristaldi owned many qualities. He was seductive, and I was infinitely grateful to him that I helped me at the time when I felt lost, but spent most of his time in a small three -storey property: his offices. He gave me jewelry, fur, but I had the feeling that he did it more by convention than for an authentic emotional momentum. He continued to buy me. And it was above all this that made me feel uncomfortable, so I was busy to show him that I didn't need anything, I never asked anything, I didn't encourage anything. And then we were almost never alone alone and he.",0.18123282748274505,0.016834881156682968,0.00040079999598674476,0.019265197217464447,5.935700028203428e-05,0.276161253452301,0.00017268283409066498,0.9944792985916138,0.7728334665298462,0.00011394822649890557,0.0002484193828422576,0.03283406421542168,6.289513839874417e-05,0.999738335609436,5.187283386476338e-05,0.000831891258712858,0.9975039958953857,0.0011797341285273433,0.8588449954986572,0.30864042043685913
"Cristaldi had been a lawyer before becoming a producer. Dozens of pages organized my professional life, fixed the amount of my monthly salary, determined preliminarily and regardless of the importance of my cachet collected by the producers. Pages that established the names of the tailors who dressed myself, the expenses that Vides was charged, the following composed of a driver, secretary, press officer. My life was controlled. Step by step. With those articles, those paragraphs, those chapters on which I had placed my signature, I had sold my soul. The pact forced me to give up my free will. I was no longer entitled to my image. The Vides had bought me as a goods: color and length of the hair, measures, everything was written without me being able to affix even the smallest modification. Every decision concerning my personal life had to be taken in agreement with my producers. Cristaldi was good and generous, but it never failed to remind me that he had created me and that consequently I belonged to him. Even today, many years after our separation, many years after his death, I have not forgotten anything.",0.18123282748274505,0.7095264196395874,6.159862095955759e-05,0.001340262359008193,0.007491635158658028,0.9373683333396912,0.0005563513841480017,0.10809219628572464,0.003278927644714713,0.0005793192540295422,9.656784823164344e-05,0.07609127461910248,0.0006610044511035085,0.21751798689365387,4.564796108752489e-05,0.0005884114652872086,0.0007697334513068199,0.9746952056884766,0.0003741468826774508,0.01668570749461651
"Women do not consider me a rival, men speak to me with respect, even if, sometimes, they call me Gina or Sophia. I rarely been attacked, once maybe someone shouted me: ""Takes too much!"" I put an end to the conversation, replying: ""Made your business!"". Probably the fact of never being afraid has protected me, facilitating my life. Today, I have nothing to hide. I'm how they are.",0.18123282748274505,0.1445080190896988,9.629186388337985e-05,0.009749028831720352,5.910857726121321e-05,0.9412531852722168,6.28350317128934e-05,0.01304937805980444,0.0008453706395812333,6.208728154888377e-05,6.291115278145298e-05,0.4683614671230316,0.00018444174202159047,0.999353289604187,6.009605203871615e-05,0.004775276407599449,0.9992578625679016,0.003947794903069735,0.025904113426804543,0.021785307675600052
"To re -establish with the newspaper, each has its rites. I need loneliness, of silence. After the passage in the dressing room, after having made up, like the clown of the circus, Claudia transforms Claude. And return home, where everything is in place. All those who are not strong enough to find the way home, in the perennial earthquake of our careers, risk that their lives turn into tragedies.",0.18123282748274505,0.9796830415725708,0.9994938373565674,0.0009702612878754735,0.008759667165577412,0.9537519812583923,0.0004387994413264096,0.369268000125885,0.0011215762933716178,0.00011564017768250778,0.00013644185673911124,0.9710203409194946,0.008772561326622963,0.017324529588222504,6.117042357800528e-05,0.5504969358444214,0.9138134717941284,0.005269932094961405,0.9875552654266357,0.9888303279876709
"Without needing any confidence, Visconti had understood everything about the violence I hid. He loved to feel that a shadow weighed on the past of his actors, because he added that part of mystery that gave thickness to his characters. The directors are always a little medium. But no one better than Valerio Zurlini guessed what a different girl did, an actress who did not fall into any group, no clique. It is with him that I would turn the girl with the suitcase, my first great role.",0.18076250585727394,0.03273402526974678,8.616832201369107e-05,0.0019463086500763893,0.00014228993677534163,0.0016947208205237985,0.008190150372684002,0.00023057201178744435,0.009094332344830036,0.004148120991885662,0.00029134866781532764,0.7358505725860596,0.00012659234926104546,0.9687804579734802,5.7885368732968345e-05,0.01927248015999794,0.9741655588150024,0.014770506881177425,0.014569614082574844,0.9674883484840393
"When they asked Mastroianni what he preferred to Visconti, who had made her debut in the theater, or of Fellini, who had made him a great star of cinema, replied: «Visconti was the teacher that schoolchildren love and admire, Fellini his partner class ». Visconti was also a teacher for me. I admired his culture, his curiosity that allowed him to be perfectly aware of fashion and in vogue make -up, the songs of Sanremo or the best seller. He was a fan of history, literature, music. A hard master, sometimes sarcastic, ironic, cruel, who did not know how to manifest his love and expressed him with a thousand little gifts. [...] Fellini, on the contrary, was at ease improvising. We called him ""the magician"", because he owned a special genius capable of involving us in his dreams. He did not hear the problems, he put them in front of our eyes, as an integral part of his fantastic.",0.18076250585727394,7.869595719967037e-05,9.599694749340415e-05,0.00016265473095700145,0.0004367587680462748,0.0028107718098908663,0.004655842203646898,0.00016491941642016172,0.03581555560231209,0.0001071991355274804,0.00024558446602895856,0.009220541454851627,0.00011834962788270786,0.7797470688819885,0.00012059236178174615,0.029859231784939766,0.008172229863703251,0.15443772077560425,0.0008795898174867034,0.004835066851228476
"My father had two passions: the watches, who dismantled and reassembled with meticulousness, and the violin, who played to make us fall asleep. I grew up in a family of musicians: my sister practiced with the plan and in singing, Adrien with the guitar. The great exit of the family was for the concert. But no cinema! Of American films, I knew the posters well: how can we not notice the faces of men and women chained in a kiss ... yet, at fifteen, nor I, let alone my sister, younger than one year, were authorized to attend shows against morality. We could dream in front of the photos posted on the panels at the entrance of the rooms. But we girls did not have to know anything about love life. And let's leave ""sexual"" life alone, a word that we would not have pronounced without blushing. And not even the simple functioning of our body. In those days, at school, the reproduction of the Amebe was studied ... and I remember the panic that caught Blanche [the sister] to his first menstruation, the upset cry that he called my father to help, and the slap that earned her that fright ! At our house it was a ritual, a hasty way of teaching the daughters not to talk about those things there. Every month I felt mom saying to dad, with Mol To mysterious, that ""the British had landed"". A no chick that made my brothers caracacular on the windows ... I washing. To me, it was not done ...",0.18076250585727394,5.49594551557675e-05,0.16395248472690582,0.037072762846946716,8.250439714174718e-05,0.9688276052474976,0.07599715888500214,0.9994121193885803,0.9997227191925049,0.0005583723541349173,0.0006559587200172246,0.0002561100700404495,0.006511087529361248,0.9658242464065552,0.00020015693735331297,0.02253555878996849,0.9960883259773254,0.0013407908845692873,0.5799112915992737,6.033962199580856e-05
"In Mayrig (1991), I am thirty -five years old. It is the era in which Armenian's family, who escaped the genocide, arrives in Marseille. In 588 Rue Paradis, released the same year, I have eighty -five and curved path. The magician of the make -up artists, an Italian, had come on purpose from Los Angeles to work on this metamorphosis that required hours of makeup. In the end, looking in the mirror, I was shocked. Was it really me? I would have become like that old lady one day? I don't like to turn to look at the past, but I don't even like to imagine the future. Let's be satisfied to live the present!",0.18076250585727394,0.0015948027139529586,0.0009469247306697071,0.06539351493120193,0.0020922846160829067,0.9975509643554688,0.9787171483039856,0.000338066864060238,0.00611935555934906,0.9996568560600281,0.0002656331635080278,0.9973440766334534,0.013457211665809155,0.0004618859093170613,0.00015134121349547058,0.995094358921051,0.02947559393942356,0.06125921010971069,0.1300705075263977,0.00046070190728642046
"Of course, staying in front of the camera was starting to like me, I had soon understood that it would be my best ally, however I detached myself too ease from my characters, letting the emotions assaulted me with waves, intense but short. For me, cinema was still a job like the others. It is Germi's film that served me from revelation. Pietro did not like to speak, he had a shady character, he expressed himself in a grumpy way, he had to grasp his suggestions on the fly. Still, he knew how to make me understand that you could not arrive on the set with your hands in your pocket and wait, just obeying the director. You had to give yourself, let yourself go. That is to say letting yourself be investing, transforming, slavishing from one's role. And at the price of this abandonment that the actor gives life to a character. This new investment perhaps saved me from the tests I accumulated: there was no place for personal concerns on the set. An actor must be emotionally available. It cannot be subscribed to the problems, from its personal history. ""Virgins"" must be achieved and accept the adventure: let yourself be guided by the director on an unknown land, without fearing the danger. Photogenia was no longer enough for me. But I knew how to listen and I liked to work. Based on these two qualities I built a career that I had not chosen.",0.18076250585727394,0.007373512722551823,5.415288615040481e-05,0.0006950835231691599,8.974011871032417e-05,0.000236844367464073,9.145034709945321e-05,4.889977935818024e-05,0.0004317757557146251,8.285007788799703e-05,0.002873029327020049,0.9862431287765503,8.945680019678548e-05,0.04088940843939781,4.9282323743682355e-05,0.0008065637666732073,0.0003179727355018258,0.00026848248671740294,0.9205754995346069,0.977410078048706
"For me, at that time, the stars were Brigitte Bardot, Sophia Loren, Gina Lollobrigida ... a star was more than a human being, it was a kind of goddess sacred yields from lights, costumes and scenarios, was someone who lived on another planet. I wanted to jump, run, and I raised disheveled and covered with dust ... cinema demanded real women, complete with long nails and lipstick on the lips. I never thought of suffering the transformation that would allow me to be like them. And then I was not in a hurry to become an adult. Cinema was just a game.",0.18076250585727394,0.018468549475073814,6.396223761839792e-05,0.04147031530737877,0.027962125837802887,0.017545301467180252,0.000825940165668726,0.00012907762720715255,0.9916713833808899,0.06167159974575043,0.00011412463209126145,0.012734508141875267,7.583649858133867e-05,0.00046996341552585363,0.002569683128967881,0.9144164323806763,0.9360131025314331,0.0003663731913547963,0.010829946026206017,0.562399685382843
"""Two young sisters lived on the island, Lutka and Liuba, very different from each other: Lutka was beautiful, with a clear and delicate face, the emerald green eyes and long blonde hair that fell soft on the white shoulders such as the milk; Liuba, on the other hand, was ugly, with marked features and the dark complexion; He had long black and ruffled hair, but the eyes were sweet and a kind smile.  Liuba is so good!  They said to the village.  But ... Lutka is so beautiful! """,0.18076250585727394,6.287646101554856e-05,0.004411575384438038,0.001748509705066681,0.00040891882963478565,0.9462214112281799,0.039508480578660965,0.9996985197067261,0.9973334074020386,0.00024908213526941836,0.0003896334965247661,0.00024278626369778067,0.00010388842201791704,0.019025521352887154,0.0002973373921122402,0.011248485185205936,0.9964864253997803,0.011454617604613304,0.006284428760409355,0.0002846316492650658
"«One night, while he was returning to bed, with two beautiful chocolate mustache on the chubby cheeks, he saw the mother who was talking in his study with a gentleman.  Doctor, but is it so serious?  He asked the mother crying.  Yes, his mother is very sick replied the doctor.  He needs care and that encouragement that only a daughter can give. He asked for her, and only her affection and self -sacrifice will perhaps be able to save her. """,0.18076250585727394,0.00017279952589888126,0.0005410004523582757,0.00021281732188072056,0.0032289696391671896,0.29385116696357727,0.00018345857097301632,0.9978265762329102,0.1541958451271057,8.907321171136573e-05,0.0002907397283706814,0.0001697291008895263,9.847802721196786e-05,0.04575405642390251,6.742297409800813e-05,0.136516734957695,0.9931306838989258,0.00023587887699250132,0.004089635331183672,8.41783476062119e-05
"To see me smiling again, Dad Giuseppe built me ​​a small theater, I remember him very well: an axis and a backdrop. It was simple, without puppets, but I created them in my imagination, I pulled the invisible threads and the stories came to life by magic. That theater made me dream, it was my fantastic place. That my future was elsewhere, I felt it. I felt that one day not far away the hour of detachment would come and I feared it. My brothers and playmates warned that I was not like them and sometimes they made me understand, making fun of me. The tender memory of that first small theater of mine always accompanies me and I like to think of it as an omen of the fate that awaited me. Later, much later over the years, I had another small theater: the immense small theater in via Rovello. And this time I was the puppet, a puppet aware that being linked to the wires of Giorgio Strehler was an unparalleled discovery of new horizons: in the effort of work, in the freedom of feelings, in the daily life of life. A life that tells her it seems the plot of a novel.",0.18060310906730592,0.007072200067341328,0.0008979474660009146,0.00017798510089050978,0.008870737627148628,0.9386539459228516,0.0006846809992566705,0.004086441360414028,0.9925532937049866,0.00013125425903126597,0.00013754659448750317,0.9913024306297302,8.642680768389255e-05,0.002319011837244034,0.00012386051821522415,0.8719766736030579,0.0022621003445237875,0.01478856522589922,0.01276364829391241,0.0005805967375636101
"How many times in my life I have met rich men, very rich, but for me the maximum of wealth is my work, the joy of living, the luck of living in a house magically laid in a garden ... while I write, I am looking at poetry, nature, the sky between the trees, the birds that jump from one branch to another, more happiness and wealth than this, what are I looking for?",0.18060310906730592,0.3557770848274231,0.2845369577407837,0.0037319976836442947,0.002940682228654623,0.3578658401966095,7.000252662692219e-05,0.0007366550271399319,0.00010920632485067472,7.317099516512826e-05,0.0001004172008833848,0.0049321395345032215,9.089149534702301e-05,0.998252809047699,0.9940407872200012,0.0317520871758461,0.004153754096478224,0.9093805551528931,0.009370812214910984,0.0001846889208536595
