"Carlo [Ponti] was thirty -nine years old, twenty -two more than me, and it was already a name, in the middle of his dazzling career. As he went carefully to tell me when he came to present himself at the end of the competition, he had discovered great divers such as Gina Lollobrigida, Sylva Koscina, my beloved Lucia Bosè. ""Let's take a walk in the park? It is an enchanting place, they call it ""the garden of the roses"", he will hear what perfume ... »Meanwhile he made me raise, putting my light organic shawl on my shoulders. ""Here we go,"" I said, preparing me inside me to reject the usual advances. In reality, Carlo was very professional and he earned my trust instantly. He told me about the films he was doing, he asked me about me, he sounded my intentions. «Where does Miss come from? Ah, Pozzuoli? If I'm not mistaken, there is a beautiful Roman amphitheater ... I was there a few years ago. "" ""He is right in front of my house, we see him from our windows,"" I replied, grateful who had found a common point between us. Immediately he communicated me an extraordinary sense of security and familiarity, as if we had always known each other. I had the strange impression that he understood me, that he had read behind my impetuous beauty the traces of a reserved character, of a difficult past, of a great desire to do well, with seriousness and passion. For me it was not a game, it was much more.",0.1805174897890538,0.0008652477990835905,0.0008269855752587318,0.002755324123427272,0.00010720710270106792,0.06871294230222702,0.00019055001030210406,0.0033685502130538225,0.004097271710634232,0.637339174747467,0.00021872723300475627,0.066042460501194,8.481853001285344e-05,0.9995511770248413,0.0002384902909398079,0.01546427607536316,0.9957936406135559,0.0023239527363330126,0.005269967019557953,0.9301843643188477
"Three years later Marcello would also disappear [Mastroianni ed.]. The last time I saw him was in Milan. He entered his car to go to the theater to try the last moons, by Furio Bordon. I went up to mine, directed to the airport. Marcello launched me a very long look, perhaps guessing that we would never have seen each other again. I still find it hard to return to the days of his death. The world spoke, declaimed, attended, celebrated. I was closed in my room, surrounded by my modesty. I didn't want to drain my pain to that of others, I didn't want to flag my feelings for the use and consumption of the media. I was alone, looking for a way to fully understand what had happened. On his funeral day I sent an orchid carpet, so that they accompanied him with their delicate freshness. And they brought him my love ever.",0.1805174897890538,4.518125206232071e-05,0.0003332166525069624,0.00039216227014549077,0.0009047716157510877,0.999254584312439,0.9893774390220642,0.99808269739151,0.0023220032453536987,0.0003237971686758101,0.00015449599595740438,0.0002003372646868229,0.00015698182687629014,0.9985358119010925,0.013510228134691715,0.4377102851867676,0.00168519071303308,0.0024660415947437286,0.9632017612457275,4.3300577090121806e-05
"Meanwhile, I lived my life as I could, hid behind a thin but tenacious veil of shyness. Yes, it is difficult to believe, but I was truly shy, perhaps also because of our condition. My father was not there and my mother was too blonde, tall, alive, and above all unmarried. Its eccentric beauty and over the top put me embarrassed. I dreamed of a normal and reassuring mom, with black hair, the stroped apron, the ruined hands and tired eyes.",0.1805174897890538,0.0027372799813747406,0.012739413417875767,0.00016663662972860038,4.6280110836960375e-05,0.9831193089485168,6.999274046393111e-05,0.9990575909614563,0.9996136426925659,6.178693729452789e-05,7.754191756248474e-05,0.9654151201248169,5.096175300423056e-05,0.8961095213890076,5.8742349210660905e-05,0.11369785666465759,0.9972217082977295,0.0006095326389186084,0.9754390716552734,5.3064220992382616e-05
"While I started relaxing, I let myself be brought an innocent joke. Or maybe not .. «Cary sent me a bouquet of yellow roses before I left. Yellow jealousy? How cute it is ... ""Carlo turned off and printed me a slap, under everyone's eyes. In any case, the white imprint of its fingertips on my red cheek burned with anger and shame. I felt the tears go down one by one on the face. I felt I died, but inside me I knew that somehow I was looking for it. And I don't think about it. At twenty years old he must learn to live, and Cary's love had given me a lot. Perhaps also the courage to fight for a normal life with Carlo. On the other hand, I was young but not stupid. I sensed that that slap, today as today difficult to understand, was the gesture of a man in love, who had seen himself threatened by another man, had risked getting lost and only now was he recovering from fear, sorrow. I cried but not too much because the airplane was full. The hostess approached asking me timidly if I needed something.",0.18157032993622124,0.0012501958990469575,9.556716395309195e-05,0.0023430087603628635,0.00010365881462348625,0.9239363670349121,6.118267629062757e-05,0.05616971477866173,0.9807666540145874,0.0005210950621403754,0.00010471648420207202,0.025048471987247467,6.779148679925129e-05,0.9991885423660278,5.253844574326649e-05,0.013265542685985565,0.008201025426387787,0.0032230073120445013,0.9977827668190002,6.992330600041896e-05
"All of a sudden I had become a diva, with a press office dedicated to spreading my image at best, but inside me I was always a shelled girl who wanted to become an actress, a woman who wanted to get married and have children, like all The other women. I lived ups and downs like everyone else, and I worked with passion and discipline, as always. I grew inside my little big fairy tale while I built it day after day, line after line, page after page.",0.18157032993622124,0.9322340488433838,5.921057891100645e-05,0.03290976583957672,6.913465767866e-05,0.21412347257137299,8.368132694158703e-05,0.00033821407123468816,0.615356981754303,0.0009483679314143956,0.0003479053557384759,0.9988212585449219,6.146378291305155e-05,0.0006954071577638388,6.011637015035376e-05,0.005465309601277113,0.9313578009605408,0.03147057071328163,0.013753697276115417,0.9996999502182007
"The first to believe in me for sin that it is a rogue was Suso Cecchi D’Amico, the only woman in the parterre of the great screenwriters of the time. ""The oak that made a lot of Italian cinema flourish among its branches"" as Lina Wertmüller defines it. Reading the Roman tales of Moravia, Suso had come across a beautiful story that was right at the beginning of the new fanatic. I remember that we met one day on the train. After having glimpsed me at the station, he came to my compartment and sat down next to me, with a confidence that immediately put me at ease. ""I have a subject for you in mind,"" he said simply, looking at me straight in the eyes. ""Why not?!"" I replied immediately with my usual momentum. Suso had worked on the story with Flaiano, Moravia and Persenza, and had proposed it to Blasetti, who at the time was looking for the subject for a film. [...] After our short railway meeting Suso, supported by Flaiano and Blasetti himself, insisted with the producers until the part is obtained for me.",0.18157032993622124,0.0009928627405315638,5.161063018022105e-05,0.0007759789004921913,0.00028621635283343494,0.0006333856144919991,0.01683095283806324,5.0194317736895755e-05,0.0009362883865833282,4.771323801833205e-05,0.0002266293013235554,0.0003834740782622248,0.0003748481976799667,0.049465179443359375,0.0001851049019023776,0.00489317299798131,0.042963381856679916,0.9915734529495239,0.00012751018221024424,0.002300677355378866
"The contractions intensified, as if I were in labor, and I was yellow like a lemon. My mother, who had reached us, lashed out against him [the gynecologist, ed.] With all his strength: «Doesn't he see what face he has? He is losing the child! ». But it was useless. His cocktail could not wait. When the pains ceased at four in the morning suddenly, I understood that it was all over. It was Ines who called him, in front of the accomplished fact. He came calmly, towards six, and he was the one to say the least: ""Madam, she certainly has some beautiful hips, she is a beautiful woman, but she will never have a son"". His words made me feel incapable, arid, deeply inadequate, and annihilated all my hope. Other than a fairy tale. My life was taking a sad and without future drift. To make everything more difficult, the newspapers thought about it, who did not take time to flag our pain to the four winds.  ""Now I can return to the set to finish the film,"" I said to Carlo, as soon as he set foot in my room directly from the airport. I was trying in vain to be brilliant, to take the hard. His smile marked in a grimace, letting all his sense of helplessness leak. Only at that moment did I let myself go, abandoning myself to a crush in Dirotto that did not end anymore.",0.18157032993622124,0.003544705919921398,0.00018318931688554585,0.9012386798858643,7.62925628805533e-05,0.9708952307701111,0.00011837483907584101,0.8006830215454102,0.6971891522407532,7.132443715818226e-05,0.00038076814962551,0.10049084573984146,6.681174272671342e-05,0.9229967594146729,7.439927867380902e-05,0.009603629820048809,0.8909315466880798,0.0013877511955797672,0.9929975271224976,0.05576525256037712
"[...] With the money earned one million lire, Mommy, Maria and I moved to a larger apartment in via Balzani and I could finally redeem my sister's honor. My father, if ever for a moment there had been, had definitively disappeared from my life, I no longer tried to love him. Precisely for this reason it was not difficult to turn to Aida's cachet by obtaining a surname in return: for me an empty shell, for my sister salvation. Maria Villani became Maria Scicolone and was finally able to turn the page, return to school, start living. It is perhaps useless to dwell on the sequel to the sad story. However, I was saved. With my means, as I could, I had traveled our family history, to understand what as a child appeared too big to face. And I had come to my conclusions. Not all men were like Riccardo Scicolone, not all the events had to repeat themselves. At my side I wanted a different person, who could make me really happy. I still didn't know with certainty, but life soon would show me that I, my ideal man, had already met him.",0.18157032993622124,0.018327023833990097,0.00034481158945709467,0.00036272371653467417,0.00019651700858958066,0.9415062665939331,0.9276199340820312,0.9997490644454956,0.9786213636398315,0.0009541099425405264,0.00013460105401463807,0.0001269010826945305,0.00012590500409714878,0.9985895752906799,4.62257448816672e-05,0.010693627409636974,0.9969151616096497,0.00501243257895112,0.0008404353284277022,5.32821832166519e-05
"It was during the filming of a particular day that Riccardo Scicolone died. One morning, my sister telephoned me on the set, in tears: ""Sofì ', come immediately, dad is sick."" I ran to the hospital and around his bed I found the women of his life. Mammina, Maria, her last German companion. I approached and walked my hand. He stared at me. And I supported his gaze, as paralyzed. I smiled at him, then I moved away to the window where Maria was crying. I looked out. Seen from above, machines, passers -by, bicycles seemed anything but toys. I tried to cry too but I was not able to.",0.18157032993622124,4.386890941532329e-05,0.00020436423073988408,0.0018439845880493522,0.002843651920557022,0.9993579983711243,0.05243696644902229,0.9996721148490906,0.019356543198227882,0.00011054006608901545,0.00021716434275731444,0.0011246337089687586,0.0001563626719871536,0.6253934502601624,0.013276435434818268,0.9421881437301636,0.9992121458053589,0.002180117182433605,0.9830751419067383,0.004818059038370848
"Carlo [Ponti editor's note] had known that Stanley Kramer, the midday producer of fire, was in Spain, where he was preparing to shoot a drama in costume on Napoleonic wars. At the beginning, there were to be Brando and the Gardner. But Marlon had pulled back, Sinatra had taken over, who was on his course with Ava ... In short, the usual Hollywood mess. The only certainty was Cary Grant, who, however, by contract had the right of approval of the partners and would certainly not have been satisfied with having an almost unknown, moreover Italian. Carlo, as usual, did not be discouraged: he gave Kramer a phone shot and invited him to Rome to show him the river woman. And the director, as soon as the projection ended, anticipated him, taking him by surprise. «What does it say of two hundred thousand dollars for Miss Loren? I think it would be perfect for the part. "" Carlo did not break down, let a handful of seconds passed and then replied by being a certain detachment: ""Interesting, I let me think, I have to verify his next commitments, but in principle I would say yes, it can be done"". ""It was the easiest decision of my life,"" he commented that evening waiting for Stanley to reach us for dinner. It was a star cachet. Now it was a question of earning it.",0.18157032993622124,0.005324350669980049,5.032614353694953e-05,0.049028705805540085,5.6303255405509844e-05,0.0003829563793260604,0.0021977555006742477,9.778625098988414e-05,7.06393038854003e-05,0.00011256765719735995,0.00010583221592241898,0.0008353465818800032,0.0004740642325486988,0.6495323181152344,8.691803668625653e-05,0.002950445283204317,0.3334923982620239,0.0006993083516135812,0.0008434323244728148,0.10400393605232239
"The first to believe in me for sin that it is a rogue was Suso Cecchi D’Amico, the only woman in the parterre of the great screenwriters of the time. ""The oak that made a lot of Italian cinema flourish among its branches"" as Lina Wertmüeller defines it. Reading the Roman tales of Moravia, Suso had come across a beautiful story that was at the beginning of the novella the fanatic. After having glimpsed me at the station, he came to my compartment and sat down next to me, with a confidence that immediately put me at ease. ""I have in mind a subject for you,"" he said simply, looking straight in my eyes. ""Because No?!"" I replied immediately with my usual momentum. Suso had worked on the story with Flaiano, Moravia and Persenza, and had proposed it to Blasetti, who at the time was looking for the subject for a film. The first choice of production had been Loilo, which was then considered number one. But Suso had seen me in Cinecittà, while I was working with Bolognini to we find ourselves in the gallery, and was hit by my joy. In the film I danced the mambo, which I would continue to dance in the river woman and in bread, love and ..., with my sparkling red dress. After that short of our short railway meeting, supported by Flaiano and Blasetti himself, insisted with The producers until the part is obtained for me.",0.18157032993622124,0.0006526972865685821,4.8029782192315906e-05,0.0019910272676497698,0.0001596196525497362,0.0005178400315344334,0.002283667214214802,6.853554805275053e-05,0.00017973218928091228,4.759905641549267e-05,0.00020906876306980848,0.9156518578529358,0.0001995802449528128,0.02886485680937767,0.00020826100080739707,0.0019331859657540917,0.067850761115551,0.9897623658180237,0.0033119414001703262,0.8890650868415833
"""Trust"" almost seems like a password. Over time I learned that the real challenge in our profession, and perhaps not only in ours, is in transforming the trust of others into self -esteem. And there that the experience begins, when you learn to believe in yourself, to treasure your successes and errors.",0.18023863388225436,0.9654439687728882,4.584453927236609e-05,6.981578917475417e-05,0.0022272788919508457,0.019385863095521927,0.00010798790754051879,9.785125439520925e-05,0.0011425388511270285,0.00010106134141096845,8.424295083386824e-05,0.9923295378684998,0.0020550829358398914,0.0028609447181224823,5.276509182294831e-05,0.12236176431179047,0.003139984793961048,0.0031141103245317936,0.00013978040078654885,0.0064441547729074955
"In sin that it is a rogue, Marcello and I [Mastroianni] met for the first time in a splendid black and white and immediately fell in love with each other. Cinematographically, of course. I still remember the first time I saw him. I was on the staircase of the building where we would turn and he, from some floor more, looked at me. ""Hi,"" he greeted me as if it were in the air. ""Hello,"" I replied, shy and excited. Our was an immediate harmony, which remained intact until the end, without ever an incineration. In that first set IM we compare ourselves against the background of the cheerful and luminous Rome of the post -war period, where people had resumed traveling, going to the sea, swimming, loving and having fun. We were fine together, Marcello and me. What a couple! Simple, beautiful, true.",0.18023863388225436,3.848142296192236e-05,0.00013830095122102648,0.00533894170075655,0.000322669162414968,0.9841576814651489,0.9588116407394409,0.9510960578918457,0.003025188110768795,9.297528595197946e-05,0.0005726651870645583,0.0018994234269484878,0.00017914871568791568,0.9996746182441711,0.0003358721442054957,0.05110010877251625,0.03705258294939995,0.001157293445430696,0.9358384609222412,0.0001757354475557804
"They gave me a single cell he had, as the President of the Republic Pertini pointed out, even the luxury of the TV and advised me not to attend the other prisoners: I was in fact in a delicate situation that could become dangerous. However, I tried to transmit to those unfortunate girls affection, kindness, hope, and when I went out I greeted them one by one. I had tried firsthand, even if for a short time, what some of them should have lived for years and, with the help of the nine splendid nuns who dealt with us, wanted that they knew that I would never forget them. And so it was. In prison I discovered that the weather changes step, swells with dark thoughts, becomes bitter. I tried to tame him by reading, observing, sometimes cooking. And above all by writing.",0.18023863388225436,0.000352869596099481,8.353343582712114e-05,0.002087619388476014,0.23143234848976135,0.6692113280296326,0.0006779518444091082,0.8770179748535156,0.0030308824498206377,0.0010115206241607666,0.0002862627152353525,0.0018891800427809358,0.058478325605392456,0.03561682626605034,0.04113643243908882,0.030901048332452774,0.9902088642120361,0.9966553449630737,0.7856808304786682,0.00010723830200731754
"Today, compared to my times, women are probably more fortunate, they are judged on the basis of what they know more than on their appearance. But, increasing the possibility of choosing, the difficulties in balancing family and work also increase. The world is more complex, more demanding, and requires great sacrifice girls, proportionate to satisfaction. Yet, in the end, we always go back to the same point and each of us gives the deal with herself. [...] I said it many times, and I repeat it today: they are my children, my best films. And their happiness is the prize that honors me most.",0.18023863388225436,0.8099146485328674,0.014010651968419552,0.005299938376992941,0.0001233765360666439,0.06307730823755264,9.164401853922755e-05,0.9279271364212036,0.2222469449043274,0.00022716951207257807,0.0001427658280590549,0.10248608142137527,0.00018037360860034823,0.008395400829613209,9.286998101742938e-05,0.004851475358009338,0.9949881434440613,0.007495071738958359,0.0006973469280637801,0.9450281858444214
"Lombardo had been responsible for my artistic baptism. ""Lazzaro"" did not like it, much less ""scicolone"". He needed a short surname, easy to pronounce, that he had a certain as an allure. So it was that, staring at a manifesto hanging behind him in which the beautiful Swedish actress Marta Torén stood out, she made a tour of the alphabet to Torversiala ""Elle"": «Soren, Toren, Loren ... Yes, we are: Sofia Loren ! » While he was renamed me, he replaced Sofia's ""Effe"" with the ""Ph"", et voila, a name as an international star. Too bad that in Pozzuoli they would have called me forever ""sopìa"", not understanding why this useless change.",0.18023863388225436,0.00011124770389869809,0.00010791054228320718,0.08273439109325409,0.00011188687494723126,0.0010912230936810374,0.00046397122787311673,0.040602006018161774,0.48297324776649475,6.698972720187157e-05,0.0002500356931705028,0.8214130997657776,0.00011487130541354418,0.3861173987388611,6.894434773130342e-05,0.0006372799980454147,0.6186099648475647,0.07637414336204529,0.00010642651614034548,0.975937008857727
"I introduced myself, all drew, at the address that Ponti had given me and I found myself in front of a command of the carabinieri. I fell my arms: the instinctive distrust, which perhaps had instilled me with mothers, immediately made me think of a bad joke. “Here's here, she made fun of me. That is the producer like I dancer! "" I felt to mount the mixed anger with a bitter sense of humiliation. “How I could believe him! Stupid stupid stupid! "" The thought immediately ran to my father, and to the Mezzucci with whom he had attracted Romilda in his turns. Thanks to heaven, however, stories do not always have to repeat themselves equal, and mine was still to be written. The young Carabiniere of Leva thought about reassuring me. ""If you are looking for the Pontide Laurentiis production house, it's the door next to it."" I felt shocked and childish, I thanked with a great smile and I was preparing to enter the heart of Italian cinema. From a few days I would have turned seventeen.",0.18023863388225436,0.00028101869975216687,9.674166358308867e-05,0.00024437534739263356,0.0001522592647233978,0.6908267140388489,0.0043241954408586025,0.009033714421093464,0.9995797276496887,0.943332850933075,0.00028861509053967893,0.7090297341346741,0.0061089759692549706,0.8677689433097839,6.43104940536432e-05,0.00656129838898778,0.9475725293159485,0.03822069987654686,0.9781131744384766,0.029847586527466774
"During filming, Carlo called me to give me bad news. I was in the hotel, we had recently finished shooting. ""Sophia ..."" ""What is there? Why that voice? "" ...... Marilyn died, she has been known now. Barbiturates. They speak of suicide. ""I remained silent, hanging on the phone, without knowing what to say, so much so that Carlo stumbled. He knew well that behind my rigorous and determined facade was hiding an emotional woman. ""Sophia, are you there?"" ""Yes, yes, how not, where do you want me to go ..."" that death so early, so ambiguous, disturbed me in the underwear and made me very reflect. I let myself be invaded by a thousand swirling and confused images. I thought about the sense of beauty, solitude, the need to feel loved that is in the heart of each of us. I saw his seductive smile, veiled with nostalgia. It is not enough to be the most beautiful woman in the world to be happy. Marilyn was a great actress, who remained crushed by the weight of her talent, by men who had asked her everything without giving anything in return, or who had claimed to transform her according to their tastes. He hadn't been able to find his way. I felt a shiver, as if a shadow laid all around. Ours is a cruel world, which feeds, is satisfied with the appearance and rarely wonders what is underneath. For this reason, it is up to us to keep the fairy tale anchored to life, not to lie to us who we are, where we come from. Marilyn's charm had ended up destroying her by reducing her to a sex symbol without joy.",0.18023863388225436,0.000547373725567013,0.00013776992273051292,0.9392240643501282,0.0003054742992389947,0.9428420066833496,0.08465955406427383,0.026776496320962906,0.00014786215615458786,0.003367258235812187,0.0006569807301275432,0.9485746026039124,0.00010061720240628347,0.9987740516662598,9.46978252613917e-05,0.8402500748634338,0.9972844123840332,0.0016892194980755448,0.945556640625,0.9836425185203552
"I dream that I am on a beach, at sunset, and the sea is very calm, immense, smooth, similar to an endless blue satin. The sun is as red as the fire and is going down. I suddenly start running on the beach and I run I run I run. Then, always running, I wake up. Moravia reads it like this, ""in the manner of the hot magicians who in the Tertwing the dreams of NabukodonaSor"": the sea is the normality, which I am in vain to reach. The sun is my success. I could be stopped to look at the tranquility of the sea and instead I want to chase my sun. And, like everyone who wants to reach the sun, I have to go a long way, but I do it because that sun, despite being far away, comforts me and illuminates me in my race.",0.18023863388225436,0.8661180734634399,8.070455078268424e-05,0.0011354665039107203,0.07814432680606842,0.9638445973396301,0.00014153147640172392,4.365711720311083e-05,0.003167947521433234,7.539254147559404e-05,0.0009758000378496945,0.9948670268058777,5.599345240625553e-05,0.0003339737595524639,0.9995850324630737,0.9943710565567017,0.00014408382412511855,0.0009864011080935597,0.996661901473999,4.618558887159452e-05
