"Ogni tanto succede a me e Dario di sfogliare pubblicazioni illustrate da foto sul nostro lavoro e quasi all’unisono esclamiamo: «Abbiamo fatto cose da pazzi! Ma dove trovavamo il tempo per dormire?!» In mezzo a tanta baraonda di spettacoli, partecipazione a dibattiti e manifestazioni, interventi nelle fabbriche occupate e nelle università, rappresentazioni all’estero, c’è da chiederci com’è che non si sia esplosi come i palloncini di Carnevale troppo pompati. A ogni modo, non c’era né festa né periodo di vacanza che ci facesse prender fiato: dagli anni Settanta agli anni Ottanta non erava mo dentro una vita, ma piuttosto in una specie di giostra con finale da montagne russe. Oltre a mettere in scena questi spettacoli di satira politica, personalmente io recitavo testi sul tema delle donne in chiave quasi sempre spassosa e altre volte drammatica; Dario continuava a raccogliere e scrivere testi tratti dalla Bibbia, dagli scritti eretici, dai Vangeli apocrifi: il Mistero buffo ormai era recitato a puntate.",0.18793044448830187,0.20320171117782593,0.682420551776886,0.4723052680492401,0.5979875326156616,0.564154326915741,0.2118285447359085,0.3986023962497711,0.9392057061195374,0.6761133074760437,0.789145827293396,0.4950070381164551,0.9670439958572388,0.026673277840018272,0.5893368721008301,0.86478191614151,0.9969806671142578,0.7236605286598206,0.6170848608016968,0.7340171337127686
"Negli anni ’70 abbiamo vissuto «bizzarramente»... Personalmente ho avuto qualche problema con i fascisti... ci hanno messo bombe di qua e di là, così che nessuno a Milano voleva più affittarci una casa. Eravamo tre sbandati che stavano un po’ in albergo, un po’ da mia sorella Pia e un po’ da mia madre a Cernobbio. Con una simile vita allo sbando, da «angoscia perenne», Jacopo [Fo] incominciò a non sentirsi a suo agio nel mondo.",0.18958129710517824,0.19718988239765167,0.9064058661460876,0.15395541489124298,0.33947622776031494,0.7025522589683533,0.916165292263031,0.7821729183197021,0.06436137855052948,0.1543910950422287,0.46962255239486694,0.263889342546463,0.9663877487182617,0.7126895785331726,0.4285620152950287,0.869757890701294,0.7622069120407104,0.4380412995815277,0.5289117097854614,0.15007850527763367
"C’è uno strano chiarore che entra di soppiatto dalla finestra. Non avevo mai assistito a un’alba tanto assurda a Milano. È settembre. Da fuori viene un’aria ancora tiepida. Fra poco sarà giorno. Mia madre sta morendo. Sono qui seduta su una poltrona, la testa appoggiata a un cuscino, ma non riesco a dormire. Gli occhi mi bruciano, ma non ho sonno. Sono rientrata da quattro ore. Stasera in teatro ho recitato senza seguire quello che andavo dicendo... gesti, battute, parole uscivano come registrate: la mia mente stava qui in questa stanza. Mi appoggio meglio alla poltrona. Ho posato in grembo il latte detergente per lo strucco. I kleenex. Me lo passo sul viso; da soli mi escono sospiri lunghi, dolorosi. Di quelli che ti sconquassano la mente. Sto vivendo questo momento come se non capitasse a me. La guardo. Lei è lì che sta faticando a morire.Un rantolo costante da giorni ci segue in ogni stanza. La sua mano che tengo più che posso nella mia, è tiepida... se non fosse per quel respiro strozzato che le esce e le labbra spaccate per l’arsura, potrebbe sembrare una bellissima anziana signora addormentata.",0.18958129710517824,0.25524404644966125,0.48900309205055237,0.3599092662334442,0.5977842211723328,0.6823845505714417,0.015137838199734688,0.5796078443527222,0.33882439136505127,0.6599711775779724,0.6762282848358154,0.46532437205314636,0.010652025230228901,0.38657674193382263,0.3155537545681,0.87574702501297,0.6954479217529297,0.5102730393409729,0.6491547226905823,0.39423850178718567
"Accidenti, ma perché? «Dovrei essere contenta!» mi dico. «SENATRICE! Ma ti rendi conto che onore t’è capitato?»«Sì, sì... senatrice!!!» e mi rifaccio il verso. Non ho mai pensato di arrivare a una carica tanto prestigiosa, non era proprio nei miei programmi! «Onorata, onorata» per carità... Mi sono trovata eletta senza aver mosso un dito. Non mi sento all’altezza... sono spaventata, anche se non lo dico a nessuno. «Non ti senti all’altezza? E allora, quelli che hanno votato per te, t’hanno scelta così, a caso? Proviamo con un’attrice... piazziamoci un bel personaggio decorativo, in quel mausoleo di tromboni! Piantala con 'sta solfa ! Ricordati di tutto il lavoro che hai tirato in piedi nelle carceri, l’organizzare le difese dei ragazzi arrestati per reati politici... sbattuti in galera, torturati... carceri speciali modello tedesco... le centinaia di spettacoli in sostegno delle fabbriche in lotta che hai fatto con Dario...» «Sì, ecco, ecco... adesso gonfiamoci di orgoglio...» «È solo per rinfrescarti la memoria, darti un po’ di sicurezza! Insomma! Ti sei sbattuta per anni solo per darti un tono...?! Come a fare un po’ di footing? Dovresti essere orgogliosa: pensa in quanti ti hanno votata! In quanti hanno avuto fiducia in te. È tutta gente che ti ha scelta con cognizione di causa. Non per caso. Forza!» «Ma vai al diavolo, tu e le tue leccate di gratifica!» Così, in conflitto con me stessa, salgo nell’appartamento.Mi guardo allo specchio: più tirata di così non potrei essere.«Che bello sfottermi con quel sorrisino... mi sento fuori posto... non all’altezza... non adeguata... in più sono vecchia per affrontare una vita nuova.» Be’, non esageriamo... Adesso, a guardarmi bene a tutto campo nello specchio, non mi vedo proprio da buttare! «Oh, per la miseria, alla tua età dovresti sbatter la coda per la gioia, cara senatrice! E anche voltolare su te stessa come in una danza?!» Facciamo conto di dover entrare in scena... sono figlia d’arte e noi della professione montando sul palcoscenico non si trema mai.",0.18958129710517824,0.2763817012310028,0.16493068635463715,0.251549631357193,0.31869256496429443,0.5251903533935547,0.6014642715454102,0.09437312930822372,0.050332967191934586,0.11544981598854065,0.25421836972236633,0.42716044187545776,0.7455978393554688,0.7384706139564514,0.04758695513010025,0.8120014667510986,0.20286887884140015,0.2949232757091522,0.8639519214630127,0.5246845483779907
"Immancabilmente uno dei due chiede: «Che sogno hai fatto?» Se chiedo io, lui mi risponde con una voce che solo io conosco. Assonnata. Piccola. Tenera, come fosse, non l’omone di ottantatré anni che è... ma un bimbo. Questa voce «mia» mi scioglie di tenerezza. Devo dire che Dario [Fo] fa dei sogni incredibili. Più volte ho avuto il dubbio che... sì, che ci fosse una base reale, ma che lui, da abile sceneggiatore qual è, li arricchisse un po’. Nei suoi sogni ci sono spesso io... siamo giovani... non riesce a telefonarmi, non si ricorda il numero del mio cellulare, di casa... non mi trova... non trova la nostra abitazione. Vaga disperato chiamandomi. Poi gli si avvicina un uomo a metà fra il reale e il meccanico che vola... lui si aggrappa e l’uomo volante si libra nel cielo e via che lo porta da me... che sono seduta sopra un rinoceronte... Ecco, a ’sto punto del racconto inizio a ridere... «Basta, basta... smettila... è troppo lungo e ora stai inventando.» Non ricordo più chi diceva che i sogni sono la trasposizione fantastica dei nostri desideri, delle nostre paure e gioie. Ecco, sento la sua voce che insiste: «No, ti giuro! Ho sognato proprio così!»",0.18958129710517824,0.1698080599308014,0.6678317785263062,0.1852777898311615,0.7040441632270813,0.46566808223724365,0.30976152420043945,0.150640606880188,0.9520570635795593,0.19429299235343933,0.56412672996521,0.802741289138794,0.007373700849711895,0.9094594120979309,0.8653525114059448,0.9690393805503845,0.011349009349942207,0.5235667824745178,0.7820600867271423,0.2923891246318817
"Cresceva Jacopo [Fo] e lavorava come un matto. Si dice che il DNA non è acqua e devo ammettere che è un’espressione azzeccata, giacché nostro figlio ama la pittura con la stessa passione di suo padre, ma, almeno da ragazzo, quando gli offrivamo di entrare in compagnia con noi per recitare ruoli che Dario avrebbe scritto appositamente per lui, scantonava come un furetto: «Per carità! Vi ringrazio, ma non voglio godermi lo stress che prende a voi ogni volta che debuttate e stare tesi come corde di violino per tutta una stagione, leggervi belle critiche ma anche infamità rognose, per non parlare poi del vivere tutto il tempo con la censura attaccata alle spalle e sui glutei come le zecche ai cavalli...»Alla fine come professione scelse i fumetti e le vignette satiriche e pubblicò i suoi disegni su numerose riviste underground.",0.18958129710517824,0.40359386801719666,0.3823552429676056,0.35725274682044983,0.38178685307502747,0.2710024118423462,0.011037914082407951,0.3855036199092865,0.610016405582428,0.4108751714229584,0.5068591237068176,0.5193225145339966,0.008186674676835537,0.5230685472488403,0.31996339559555054,0.4271179139614105,0.08742750436067581,0.3820890486240387,0.4219728708267212,0.4334762692451477
"È il 25 aprile, la guerra è finita. A Varese per la piazza Impero sfilano i partigiani. Fra loro ci sono ragazzi che conosco. Erano del primo gruppo di combattenti che si era formato sulle montagne della Val Cuvia appena dopo l’8 settembre. Si erano arroccati sul Monte Grino e sul Cuvignone. I tedeschi li avevano attaccati sparando con artiglierie pesanti, un vero massacro, in pochi si erano salvati attraverso le gallerie scavate nella prima guerra mondiale; erano quasi tutti abitanti della valle, gli unici che conoscevano a menadito il percorso di quegli antichi camminamenti. Per festeggiare la liberazione, per le strade si era rovesciata una marea di gente: a un certo punto dal fondo scorgo venire avanti un gruppo armato. Con loro c’era una donna. Era la madre di uno dei caduti di Monte Grino. In molti la riconoscevano e l’applaudivano. Qualcuno andava ad abbracciarla. A un tratto lei si fermò e si sedette su un muretto, facendo cenno agli altri di proseguire: l’emozione era troppo grande e non ce la faceva più a camminare fra gli applausi e le grida.Il giorno dopo arrivano gli Alleati. Li avevamo visti il pomeriggio transitare per la città sui camion. Erano arrivati anche nella mia strada. Ci buttavano cioccolato e sigarette. Arrossisco al pensiero di essermi buttata con gli altri per tentare di raccogliere qualcosa.  La sera, nel cortile di casa mia, gran festa. Un grammofono, [...]. Poi guardo su, verso la finestra buia del primo piano: casa mia. Più che vederla, l'intuisco: mia madre è lì, ci sta guardando. Conosco i suoi pensieri, il suo tormento: mio fratello, deportato in un campo di concentramento in Germania, non dà notizie da oltre due anni, In un attimo le sono vicina vergognandomi della mia allegria. Mi stringo forte a lei.",0.18958129710517824,0.047618214040994644,0.9712931513786316,0.15228697657585144,0.4874001443386078,0.8550040125846863,0.9714192748069763,0.7287156581878662,0.5355467200279236,0.06802798807621002,0.13029466569423676,0.2994837462902069,0.3432115614414215,0.8301913142204285,0.5683674216270447,0.9437168836593628,0.9548636078834534,0.7216163873672485,0.8075058460235596,0.13524723052978516
"«Dario, credo mi si siano rotte le acque...» «Le acque?!» esclama Dario buttando finalmente il gran giornale. Di corsa un taxi. Ora siamo emozionati tutti e due. Ci stringiamo abbracciati. Occupiamo mezzo sedile. Il taxista è preoccupato che il bimbo nasca lì. Siamo arrivati in un minuto.Clinica Salus. Mi sistemano in una stanza. Dario è accanto a me. Arriva l’ostetrica, le infermiere, tutte gentilissime, un po’ per il mio bambino, un po’ per l’interesse che sollecitano sempre le persone di spettacolo. Poi inizia la litania: «Spinga signora spinga». Io ci metto tutta la mia buona volontà... ma non succede niente. Solo Dario è in movimento, mi posa deciso una mano sulla gola, stringendo e facendo pressione. «Caro, già sto male... vuoi strozzarmi?» Anche l'infermiera: «Ma cosa fa?!» Calmo, padrone della situazione nel suo ruolo di futuro padre, risponde: «Devo stare attento che non le venga il gozzo!» E giù a pigiare la mano.",0.18958129710517824,0.445463091135025,0.44784775376319885,0.3693353533744812,0.41610708832740784,0.6842613816261292,0.10224366188049316,0.9387741684913635,0.873462438583374,0.4433048665523529,0.41754987835884094,0.4619107246398926,0.006380809471011162,0.878367006778717,0.8107141256332397,0.9036693572998047,0.6358331441879272,0.42189300060272217,0.7913809418678284,0.37164223194122314
"Sono stata io a invitarlo dopo le prove a mangiare qualcosa in una trattoria, la prima volta. Dario sembrava non accettare volentieri quell’invito; poi, giacché io insistevo, mi svelò la ragione della sua reticenza: «Non ho un soldo» disse, «per potermi liberare dal lavoro e venire alle prove ho dovuto licenziarmi dallo studio di architettura dove sviluppavo progetti». E io allegra risposi: «Mi fa piacere, adoro nutrire randagi, gatti abbandonati e disoccupati affamati». Andammo in una trattoria lì all’angolo e ordinammo due porzioni di salame, pane e una birra. Per me acqua, sono astemia. Poi ci accompagnammo l’un l’altra a casa. Io abitavo dalle parti di Porta Garibaldi, da mia sorella. Tram non ce n'erano più, quindi ci avviammo a piedi. Ci raccontavamo entrambi delle nostre vite, lui del suo lago, il Maggiore, e dell’Accademia in cui aveva studiato; io della mia compagnia e degli aneddoti più gustosi. Ci scoprimmo a ridere come ragazzini alle reciproche ironie; lo trovavo davvero spassoso, quel lungone, strabordante di racconti assurdi e festosi. In particolare se ne uscì con una frase che mi sorprese: «Mi succede spesso» disse «di parlare con qualcuno e sentirmi a disagio, perché le cose che credo intelligenti e spiritose che vado dicendo, non vengono raccolte, e allora pian piano mi convinco di non possedere né fantasia né spirito. Invece ogni tanto, come stasera, mi capita di sentir apprezzare le immagini che propongo, e di contrappunto ne ricevo altre, da te, che mi incoraggiano a lasciarmi andare nel fantastico».",0.18958129710517824,0.3742348849773407,0.2982150912284851,0.2624063789844513,0.6977179050445557,0.3785509467124939,0.3557063341140747,0.28819170594215393,0.16682957112789154,0.4707982540130615,0.3971990644931793,0.5224971771240234,0.005926517769694328,0.45780059695243835,0.19674403965473175,0.5004901885986328,0.04857509210705757,0.23560844361782074,0.7557807564735413,0.2522088587284088
"Con l’avvento del cinema sonoro (1929), mio padre, mio zio e tutta la compagnia intuiscono che «il teatro delle marionette» sarà presto messo in crisi, schiacciato da questo nuovo straordinario e anche un po’ magico mezzo di spettacolo. Con grande dolore del nonno Pio, decidono un cambiamento radicale del loro programma e della loro condizione: «Reciteremo noi i nostri spettacoli, entreremo in scena noi, al posto delle marionette». Così le due famiglie dei Rame si sostituiscono ai pupazzi di legno (vere e proprie sculture snodate, tre delle quali sono ancora oggi esposte al Museo della Scala di Milano). Hanno scelto i testi, li hanno provati e riprovati, si sono procurati i costumi e grandi fondali dipinti per loro da un amico scenografo della Scala e debuttano in un teatro normale: il teatro di «persona», e lei, la mia mamma, diventa la prima attrice. Un’attrice che di giorno tirava su i figli, li aiutava a studiare, si occupava della casa, teneva l’amministrazione della compagnia come fosse quella di un normale ménage familiare. E alla sera, salendo sul palcoscenico, eccola trasformarsi in Giulietta e Tosca, e la Suora Bianca dei Figli di nessuno, e la Fantina dei Miserabili, tutti ruoli che via via anche noi figlie e cugine, una appresso all’altra, avremmo poi interpretato. Mi vedo a percorrere l’apprendistato dei teatranti interpretando tutti i ruoli che crescendo erano adatti alla mia età, maschili o femminili che fossero.",0.18396827834658325,0.3328869044780731,0.5817258954048157,0.5981364846229553,0.4952043890953064,0.3098146319389343,0.10932662338018417,0.636568546295166,0.7440074682235718,0.6470632553100586,0.655276358127594,0.5981075167655945,0.00862184725701809,0.618148148059845,0.40639540553092957,0.6626085042953491,0.7623764276504517,0.4594295918941498,0.5682205557823181,0.8760747313499451
"Ero disperata perché non avevo seni. Allora ho chiesto a mia madre: «Mamma, perché non ho i seni?!» E lei: «Eh, perché, come dire, insomma, la natura certe volte, cioè, ecco... però stai tranquilla: alla fine tutto si equilibra... almeno spero!» A dir la verità non è stato un gran dialogo! Poi mi fa: «Prega santa Rita da Cascia che è la santa degli impossibili!» Io ho pregato che non sapete quanto... evidentemente con non sufficiente intensità, e mi è spuntato un seno, uno solo, ma bello, una pera... una bella pera William... Di qua niente! La mia mamma mi metteva il reggiseno e mi imbottiva con i fazzoletti la parte mancante. Quelle due sporgenze sul petto mi facevano sentire proprio quasi una donna! Ero anche meno imbarazzata coi corteggiamenti dei maschi, tanto che spesso quelli prendevano coraggio. Uno di quei moscardini arrivò perfino a mettermi una mano sul seno: gli arrivò un «lavadenti» da knock out.«Cretino, come ti permetti?» Non ero arrabbiata tanto per il gesto, quanto per il fatto che mi aveva toccato il seno sbagliato! Quello imbottito di pezza! Finalmente mi è spuntato anche il mancante... rotondo! Avevo una bella pera William e una mela regina.«Mamma, perché ho una pera William e una mela regina?!» Mia madre mi tranquillizzava: «Avere i seni tutt’e due quasi identici è indice di una mancanza di originalità, di un’indole banale».«Ah sì?»«E poi lo dice anche una canzone: ""La mia morosa è di Villafranca, c’ha una tettina nera e un’altra bianca, un pirolino a punta e l’altro tondo, la mia morosa è bella un finimondo!""»«Be’, allora brindiamo!»",0.18396827834658325,0.09547770023345947,0.6021470427513123,0.23517298698425293,0.559912383556366,0.3991221785545349,0.10201501846313477,0.7466827034950256,0.10784006863832474,0.5090319514274597,0.567018449306488,0.39621517062187195,0.013807345181703568,0.6999381184577942,0.9079700112342834,0.787051796913147,0.6560195088386536,0.420442670583725,0.6979911923408508,0.30557936429977417
"A un certo punto della mia vita mi sono accorta che il lavoro di attrice non mi faceva impazzire, che non lo amavo poi così tanto. La gente non ci crede, pensano che siano bugie. Invece è vero, non avrei mai scelto questa professione, che richiede un tipo di carattere che io non ho: presenzialismo, arroganza e buoni gomiti. Quando mi sono accorta che non amavo questo mestiere, era troppo tardi, ero già sposata con Dario e avevamo la nostra compagnia. Se non fossi stata indirizzata a questa professione dalla mia famiglia, mi sarei impegnata nel sociale, avrei potuto anche essere un avvocato o un medico.",0.18396827834658325,0.04832950234413147,0.04137337580323219,0.02601538971066475,0.016943229362368584,0.22153641283512115,0.005670065060257912,0.47584885358810425,0.05412377044558525,0.03680919110774994,0.1063016876578331,0.07502898573875427,0.007005182094871998,0.16747236251831055,0.02729244902729988,0.23205959796905518,0.20052503049373627,0.014553319662809372,0.35358303785324097,0.7229020595550537
"Il cinema mi annoiava a morte. La mattina presto ti alzavi, ti venivano a prendere alle cinque, alle sei e dieci eri già pronta, alle undici e un quarto si presentava finalmente il regista. Non si butta via il tempo così. Non lo rimpiango, il cinema. In teatro, il tuo pubblico è lì davanti.",0.18396827834658325,0.26755520701408386,0.267302930355072,0.12403217703104019,0.10941831767559052,0.050706151872873306,0.017082255333662033,0.07460580766201019,0.050865110009908676,0.20654916763305664,0.2793963849544525,0.426784485578537,0.0036790668964385986,0.2821527421474457,0.10437630116939545,0.6868114471435547,0.014408204704523087,0.2496819943189621,0.2911754250526428,0.39889010787010193
"Le minacce le ho ricevute io, quando ero già senatrice. Frasi terribili, come «spaccarti tutti i denti a bastonate». Ho avuto molta paura, anche perché avevo settantasette anni e tornavo a casa da sola alle tre di notte, dopo ore di riunione alla Commissione Bilancio (che Dio l’abbia in gloria).",0.18396827834658325,0.04948882758617401,0.12818831205368042,0.039102815091609955,0.26786816120147705,0.3147236108779907,0.04352633282542229,0.01147003099322319,0.07640518993139267,0.08147240430116653,0.7077600359916687,0.05463382974267006,0.9335677027702332,0.2644950747489929,0.09150006622076035,0.42033880949020386,0.13612428307533264,0.06962613761425018,0.25822076201438904,0.4421021044254303
"Se dovessi rinascere, ma spero proprio che non mi succeda, non cambierei una sola virgola di quanto ho fatto nella mia vita. Con Dario ho vissuto una vita esageratamente felice, l’unica cosa che all’inizio mi disturbava era la sgradevole sensazione di essere trasparente, specialmente con le altre donne. Quante volte arrivavano in Palazzina Liberty le famose femministe, leaderine del movimento, quelle che sanno tutto, che ti parlano dall’alto in basso. Entravano, magari vedevano che stavo pulendo il grande locale con una scopa (ruolo insolito per una prima attrice), non è che se ne accorgessero e dicessero almeno: «Ciao». No, mi chiedevano solo: «Dov’è Dario?». «La peggior nemica della donna... è la donna». Non c’è commedia dove non abbia ribadito il concetto.",0.18396827834658325,0.07819872349500656,0.05432076007127762,0.03229611739516258,0.1704389899969101,0.6356844305992126,0.015253528021275997,0.25500378012657166,0.02186889760196209,0.11749548465013504,0.8067851662635803,0.29704907536506653,0.011330916546285152,0.04777581989765167,0.03542385250329971,0.86067134141922,0.9747216701507568,0.30067092180252075,0.5439772605895996,0.558185338973999
"Quando prese il premio Nobel, Marta Marzotto m’inviò un cesto con cinquecento rose rosse. Il biglietto d’accompagnamento diceva: «Dietro a un grande uomo c’è sempre una grande donna». L’ho chiamata al telefono per ringraziarla, ma le ho anche detto: «Marta, non mettermi dietro, mi fa impressione, è come se arrancassi per tenere il suo passo. Ponimi al fianco. Mi troverei meglio». È strano che una donna intelligente e spiritosa come lei sia caduta in tanta banalità.",0.18396827834658325,0.17377471923828125,0.1383003294467926,0.09286776185035706,0.26191630959510803,0.16382631659507751,0.09282935410737991,0.08178432285785675,0.020333996042609215,0.19130748510360718,0.3308170437812805,0.2627730667591095,0.02335674688220024,0.40459761023521423,0.10645896941423416,0.3059653639793396,0.6089915037155151,0.12580513954162598,0.2413361668586731,0.31190645694732666
"Di Pietro mi contattò per chiedermi se volevo candidarmi alle elezioni nazionali del 2006. Avevo tanti impegni, tante cose da fare, mi sembrava una follia, e glielo dissi. Ma lui fece girare la notizia e la gente cominciò a telefonare. «Devi andare, devi andare», mi dicevano. Alla fine mi candidai nella lista dell’Italia dei Valori. Presi quasi cinquecentomila voti, che sono tanti. Proprio per rispetto verso i miei elettori, e per un senso di responsabilità, sono rimasta in Senato più a lungo di quanto avrei voluto. Se fosse stato per me, avrei dato le dimissioni almeno sette mesi prima che cadesse il governo. (...) I diciannove mesi più brutti della mia vita. È stato un periodo di grande solitudine, ero circondata da persone asociali. La Finocchiaro mi ha salutata soltanto dopo un anno. Pensavo sempre: «Non sono quella che arriva dalla Sicilia e si chiama Luisa Rovigotti. Ho recitato nei teatri di tutta Italia, non puoi fare finta di non conoscermi!». Era la decana dell’Unione e, come donna, avrebbe dovuto prendere noi povere femmine disgraziate, che non sapevamo niente, e affidarci a qualcuno che ci insegnasse qualche cosa. La Finocchiaro passava davanti a me come se fossi trasparente, poi quando ha avuto bisogno di me: «Francuzza, Francuzza». In quel Senato ho fatto l’inimmaginabile.",0.18396827834658325,0.4179697036743164,0.25272873044013977,0.24640296399593353,0.3448374569416046,0.4100051820278168,0.435057669878006,0.1494101881980896,0.015900641679763794,0.38635727763175964,0.49672821164131165,0.5673565864562988,0.9742704629898071,0.5695188045501709,0.08850961178541183,0.9637094140052795,0.8185235261917114,0.2995480000972748,0.5762890577316284,0.1516847163438797
"Ovviamente hai appoggiato le campagne per il divorzio e per l’aborto. Scherziamo, il divorzio e l’aborto. Certo, ne abbiamo fatte di tutti i colori.",0.1820344110019505,0.257127046585083,0.30541372299194336,0.2510615587234497,0.3014986515045166,0.44187936186790466,0.7883191704750061,0.060408249497413635,0.005692490376532078,0.3229736387729645,0.04552924633026123,0.502590000629425,0.9506514072418213,0.5478743314743042,0.43949639797210693,0.691525936126709,0.03724854066967964,0.4687105715274811,0.4994479715824127,0.19552311301231384
