"Mi presentai, tutta trafelata, all’indirizzo che Ponti mi aveva dato e mi trovai di fronte a un comando dei carabinieri. Mi caddero le braccia: l’istintiva diffidenza, che forse mi aveva instillato proprio mammina, mi fece subito pensare a un brutto scherzo. “Ecco qua, mi ha preso in giro. Quello fa il produttore come io la ballerina!” Sentivo montare la rabbia mista a un senso amaro di umiliazione. “Come ho potuto credergli! Stupida stupida stupida!” Il pensiero corse subito a mio padre, e ai mezzucci con cui aveva attirato Romilda nelle sue spire. Grazie al cielo, però, non sempre le storie devono ripetersi uguali, e la mia era tutta ancora da scrivere. Ci pensò il giovane carabiniere di leva a rassicurarmi. «Se cerca la casa di produzione PontiDe Laurentiis, è il portone a fianco.» Mi sentii sciocca e infantile, ringraziai con un grande sorriso e mi apprestai a entrare nel cuore del cinema italiano. Di lì a qualche giorno avrei compiuto diciassette anni.",0.18312289821915329,0.08168099820613861,0.8320010900497437,0.16033461689949036,0.35349348187446594,0.28919517993927,0.9328711032867432,0.36741945147514343,0.9688571095466614,0.4362977147102356,0.8302050828933716,0.4595648944377899,0.007013159804046154,0.5983111262321472,0.46415647864341736,0.9234809279441833,0.7491808533668518,0.5764164328575134,0.5976120233535767,0.41147133708000183
"Durante le riprese, Carlo mi chiamò per darmi una brutta notizia. Ero in albergo, avevamo finito da poco di girare. «Sophia...» «Che c’è? Perché quella voce?» ...... è morta Marilyn, si è saputo ora. Barbiturici. Parlano di suicidio.»Rimasi muta, appesa al telefono, senza sapere cosa dire, tanto che Carlo si inquietò. Sapeva bene che dietro quella mia facciata rigorosa e determinata si nascondeva una donna emotiva. «Sophia, ci sei?»«Sì, sì, come no, dove vuoi che vada...»Quella morte così precoce, così ambigua, mi turbò nell’intimo e mi fece molto riflettere. Mi lasciai invadere da mille immagini vorticose e confuse. Pensai al senso della bellezza, alla solitudine, al bisogno di sentirsi amati che è nel cuore di ognuno di noi. Rividi quel suo sorriso seducente, velato di nostalgia. Non basta essere la donna più bella del mondo per essere felice. Marilyn era una grande attrice, rimasta schiacciata dal peso del proprio talento, da uomini che le avevano chiesto tutto senza dare niente in cambio, o che avevano preteso di trasformarla secondo i loro gusti. Non era riuscita a trovare la sua strada. Sentii un brivido, come se un’ombra si posasse tutto intorno. Il nostro è un mondo crudele, che si alimenta, si accontenta dell’apparenza e raramente si chiede che cosa ci sia sotto. Per questo sta a noi tenere la favola ancorata alla vita, per non di menticarci chi siamo, da dove veniamo. II fascino di Marilyn aveva finito per distruggerla riducendola a un sex Symbol senza gioia.",0.18312289821915329,0.19486103951931,0.1210361197590828,0.2218739539384842,0.6413925290107727,0.6746136546134949,0.9270555973052979,0.298765629529953,0.014424928463995457,0.27028146386146545,0.6990503668785095,0.38794514536857605,0.00475543225184083,0.41369715332984924,0.6774402856826782,0.9393565654754639,0.8587567806243896,0.39714112877845764,0.9412793517112732,0.16949567198753357
"Sogno che mi trovo su una spiaggia, al tramonto, e il mare è calmissimo, immenso, liscio, simile a uno sterminato raso azzurro. Il sole è rosso come il fuoco e sta andando giù. Io a un tratto mi metto a correre sulla spiaggia e corro corro corro. Poi, sempre correndo, mi sveglio. Moravia lo legge così, «alla maniera dei maghi caldei che in terpretano i sogni di Nabucodonosor»: il mare è la normalità, che cerco invano di raggiungere. Il sole è il mio successo. Io potrei star ferma a guardare la tranquillità del mare e invece voglio rincorrere il mio sole. E, come tutti quelli che vogliono raggiungere il sole, ho da percorrere molta strada, ma lo faccio perché quel sole, pur essendo lontano, mi conforta e mi illumina nella mia corsa.",0.18312289821915329,0.2509441375732422,0.03218524903059006,0.029590940102934837,0.4034436047077179,0.042629849165678024,0.004577046260237694,0.008234862238168716,0.00479894271120429,0.050814513117074966,0.08402993530035019,0.3860650062561035,0.00492462981492281,0.07519400864839554,0.9808428287506104,0.96458899974823,0.0039058940019458532,0.5390472412109375,0.6090809106826782,0.13442352414131165
"Quando, alla fine del febbraio 1962, era arrivata la nomination, non ci volevo credere. «L’Oscar? Il Premio Oscar?» Rileggevo i nomi delle altre candidate, mi passavano davanti Audrey Hepburn e Natalie Wood, Piper Laude e Geraldine Page, e tra me e me dicevo: “Ma che, scherziamo? In più La ciociara è un film italiano, recitato in italiano, quando mai si è visto?”. Eppure, ero lusingata all’idea, mi faceva sentire bene, mi illudevo che essere arrivata a tanto potesse bastarmi. Dentro di me, però, sapevo che non era vero, ogni gradino che salivo, sotto sotto, mi faceva sognare sempre più la vittoria. Forse stavo osando troppo, ma non c’era niente da fare. La speranza e l’ambizione erano parte di me, anche se sapevo che la delusione stava dietro l’angolo e il trionfo era destinato a pochi. Dopo molto tergiversare, avevo deciso di non andare alla pre miazione. Se avessi perso, sarei svenuta. E se avessi vinto, sarei svenuta lo stesso. Non potevo permettermelo, davanti a quella platea, sotto lo sguardo del mondo intero. “Me ne sto a Roma, sul mio divano”, così mi ero detta, e così feci.",0.18916831561364233,0.5432337522506714,0.21853280067443848,0.06607942283153534,0.23031288385391235,0.40136635303497314,0.9254786372184753,0.07917211204767227,0.013495619408786297,0.04428564012050629,0.32209524512290955,0.3478761613368988,0.007312017492949963,0.26447704434394836,0.26632627844810486,0.930275559425354,0.4309464395046234,0.28976839780807495,0.6487823724746704,0.36283251643180847
"Fu Vittorio [De Sica], ancora una volta, a guidarmi in questa avventura: «Cesira è una mamma a tutto tondo. È umile, ha sempre lavorato e vive per la figlia. Il suo approccio alle cose è semplice e diretto. Hai già provato tutto questo sulla tua pelle, Sofì’. Sai benissimo di cosa stiamo parlando. Reciterai senza trucco, e senza trucchi. Sii te stessa, diventa tua madre, e andrà tutto bene». Dopo tanti anni di Hollywood, La ciociara mi riportava a casa, alla durezza della mia infanzia. La guerra, che era rimasta a lungo sepolta dentro di me, ora tornava fuori per dare voce a questa donna ferita, alla sua sofferenza, al suo coraggio. Pensavo a mammina, a come aveva combattuto per difenderci, per procurarci l’acqua e il cibo. A come si doveva sentire quelle notti in cui i soldati marocchini accampati nell’androne bussavano ubriachi alla nostra porta. A come sorvegliava in silenzio, senza farsi notare, i giovani marines americani che venivano nel nostro salotto a bere il brandy. Perché sapeva che il pericolo si annidava ovunque, in qualunque momento, anche dove ci si crede al sicuro. Quando mi presentarono Eleonora Brown, la ragazzina che avevano scelto per fare Rosetta, mi sentii subito responsabile per lei, per noi. Aveva una faccia timida e intelligente e insieme ci aspettava un duro lavoro. Come potevo diventare sua madre? Soffrire per lei? Come potevo aiutarla a fidarsi di me? Il mio istinto mi spinse a guardarla con la dolcezza con cui mi ero sentita guardata da piccola, con l’amore da cui ero stata protetta e accarezzata. E funzionò.",0.18916831561364233,0.12067552655935287,0.4267517030239105,0.17126543819904327,0.28007492423057556,0.7699611186981201,0.6762229204177856,0.9163825511932373,0.9783564805984497,0.08381256461143494,0.1433211714029312,0.31713712215423584,0.02361946366727352,0.6649060249328613,0.12443955987691879,0.8843613862991333,0.9568957090377808,0.6295537352561951,0.842788577079773,0.29808706045150757
"Il 1954 era stato un anno denso di cambiamenti, di sorprese, di crescite veloci e irreversibili. Avevo conosciuto De Sica e Marcello [Mastroianni], ero stata diretta da Blasetti e da Soldati, avevo cantato e recitato con grandi maestri, ero passata dal comico al tragico senza perdere la mia identità e avevo consolidato la mia relazione con Carlo. Stavo diventando una star, e il mondo cominciava a parlare di me. In primavera ero stata per la prima volta a Cannes per presentare Carosello napoletano, l’unico grande film di Ettore Giannini, considerato il solo musical italiano in grado di competere con quelli americani, nel quale avevo fatto una piccola parte cantando, doppiata, ’O surdato ’nnammurato.In giugno ero stata anche a Berlino, dove una foto famosa mi ritrae a fianco di Gina Lollobrigida, insieme a Yvonne De Carlo. A ottobre, al ritorno da Comacchio, fu la volta di Londra, dov fui invitata per il Festival del cinema italiano.",0.18916831561364233,0.06552191078662872,0.14229890704154968,0.06575506180524826,0.030254235491156578,0.06626114249229431,0.11626226454973221,0.14301565289497375,0.03082428127527237,0.15980711579322815,0.10374484956264496,0.24111191928386688,0.0070453728549182415,0.3088110387325287,0.18755057454109192,0.1303168088197708,0.6047351360321045,0.07668199390172958,0.13166704773902893,0.3871314227581024
"Noi ci appartammo un momento, cercando un rifugio dove parlare lontano dai riflettori. Lì, in quell’angolo riparato del set, Marcello mi guardò malizioso, come un ragazzino che l’ha pensata grossa. Io lo fissavo divertita, temendo il peggio. «Che dici, Sophia, rifacciamo il nostro spogliarello?» «Sei proprio una canaglia...» risposi fingendomi scioccata. In realtà, l’idea mi stuzzicava assai. Mi ero lasciata alle spalle l’insicurezza di una volta, non avevo più bisogno degli esperti del Crazy Horse, la lezione di De Sica la portavo ormai dentro di me. Quanto al passare degli anni, avevo imparato con l’esperienza a fare del tempo il mio alleato migliore: non lo contrastavo, non lo subivo, vivevo ogni giorno per quello che era, lasciando, come Monna Lisa, che la mia bellezza maturasse in pace. Io e Marcello tornammo da Altman con la certezza di essere sulla strada giusta. Lui ci guardò, capì e gridò: «Azione!». Nonostante il destino ci avesse separati nel lavoro, nella geografia, nelle consuetudini, tutto questo per incanto svanì nel momento di girare. Fummo per qualche ora di nuovo giovanissimi, pronti a mordere la vita, a volerci bene. Lo spogliarello di Mara in Ieri, oggi, domani, rifatto un trentennio dopo sulle stesse languide note di Abatjour, accoglie con un sorriso lo scorrere dell’età e scopre nella vulnerabilità di ognuno di noi il vero succo dell’esistenza.",0.18916831561364233,0.4184773564338684,0.2670474946498871,0.3086784780025482,0.9704172015190125,0.791516125202179,0.10379229485988617,0.4795953929424286,0.9793999195098877,0.5529577732086182,0.8183347582817078,0.5584743618965149,0.07253159582614899,0.8823413848876953,0.9792746305465698,0.9852792620658875,0.7350574135780334,0.3493877947330475,0.8032768368721008,0.5200482606887817
"«Si infili questo» mi disse il tecnico tendendomi un costume da bagno, con modi così bruschi che mi lasciarono senza fiato. E pensare che ero lì con il produttore. “Chissà come mi tratterebbero se fossi qui da sola” mi chiesi con orrore. Mi cambiai dietro il paravento e tornai davanti a loro. Mi sentivo nuda, e la mia timidezza bruciava come una ferita. Indifferenti, i cameramen mi allungarono una sigaretta, ordinandomi di accenderla e poi di camminare avanti e indietro, guardando l’obiettivo. Non avevo mai fumato, né mi ero mai trovata da sola davanti a una macchina da presa. Mi sembrava di essere del tutto inadeguata, e l’operatore pareva d’accordo con me. «Dotto’, è impossibile da fotografare. Ha un viso troppo corto, una bocca troppo larga, un naso troppo lungo!» Come sempre, apparivo di nuovo “troppo”. Eppure ero così, che colpa ne avevo?",0.18916831561364233,0.3154069483280182,0.16221757233142853,0.30197933316230774,0.07390938699245453,0.04975442588329315,0.006375903729349375,0.0076188817620277405,0.011117345653474331,0.3277985751628876,0.5735432505607605,0.3519521653652191,0.004654855467379093,0.5031308531761169,0.019149955362081528,0.7624431848526001,0.028943827375769615,0.1410697102546692,0.5350918173789978,0.08034435659646988
"\u003cp style=""textalign:justify;""\u003ePer anni e anni avevo tenuto un diario personale, un recinto protetto dove lasciarmi andare completamente a me stessa, quasi fosse una piccola cinepresa interiore davanti alla quale recitare finalmente tutta la mia parte. Avevo cominciato in prigione, e non avevo più smesso. Nella solitudine della scrittura trovavo conforto e compagnia e scoprivo venature della mia voce che non conoscevo. Mi sentivo al sicuro nella mia intimità, come se solo lì potessi essere davvero a casa. Ma la vita, si sa, va a gradini, e una mattina di primavera, all’improvviso, osservandomi allo specchio ebbi paura. “Che cosa succederà al mio diario quando non ci sarò più?” mi dissi guardando per un attimo oltre. Sono una donna che, seppure emotiva e talvolta vulnerabile, sa prendere le sue decisioni. «Non ci sono per nessuno!» dissi a Ines e a Ninni e mi ritirai in camera mia. Guardai a lungo quel quaderno nero, dalla copertina rigida, che era stato compagno di tanti pensieri, di tante emozio ni. Lo sfogliai lievemente, senza fretta. Girando le pagine, sentivo il profumo degli anni, avvertivo i miei cambi di umore dalle differenze della grafìa, ora aspra, ora nervosa, ora più distesa. Finalmente, andai in bagno e presi una scatoletta di fiammiferi. Bastò un piccolo gesto e le mie parole divennero fuoco, e poi cenere. Non ebbi rimpianti ma solo, a tratti, un po’ di nostalgia. E non smisi di scrivere. Da quella volta, però, ogni fine dell’anno mi affido a un fiammifero, come fosse il magico strumento di un piccolo rito tra me e me.",0.18916831561364233,0.646677553653717,0.7749707102775574,0.6266577243804932,0.7408877015113831,0.6447802782058716,0.07363156229257584,0.36739587783813477,0.4887952208518982,0.7007296085357666,0.6783447265625,0.685353696346283,0.005093778483569622,0.6580798029899597,0.5237453579902649,0.7674634456634521,0.5923839807510376,0.7064927220344543,0.899380087852478,0.6911900043487549
"Più passa il tempo, e più mi viene da parlare in napoletano. Forse perché in napoletano mi esprimo meglio, riesco a dire cose che non posso dire in italiano, tanto meno in inglese o in francese. Ci metto così tanto amore, in questa lingua, che pure i miei figli mi capiscono quando la parlo, e ora perfino i nipotini. Lo stesso vale per i piatti della tradizione, che mi riportano a casa, nella cucina di via Solfatara. Lì trascorrevo le mie giornate, tra i profumi e gli aromi della povertà. Lì il canto di mammà e il calore della stufa mi facevano compagnia e, quando c’erano i soldi, il ragù borbottava nella pentola. Oggi non cucino spesso, mangio poco, sempre presa tra mille pensieri. Ma quando arrivano i miei figli dall’America e mi chiedono una ricetta speciale, mi rintano nel mio regno e mi sento di nuovo a Pozzuoli. L’impresa che mi dà più soddisfazione è la Genovese, quei cinque chili di cipolle rosolate fino a diventare mosce, e dentro gli involtini di carne, a cuocere per quattro ore. In questa vita diventata così veloce, quattro ore sono un tempo infinito, quello che mi occorre a risalire gli anni fino alla mia infanzia lontana.",0.18916831561364233,0.11516822129487991,0.6503015756607056,0.055150292813777924,0.5687910914421082,0.8464516401290894,0.02340148389339447,0.9397968053817749,0.9442071318626404,0.21598634123802185,0.1704917848110199,0.32766419649124146,0.0107780946418643,0.6925287246704102,0.4662729501724243,0.8454082012176514,0.023630741983652115,0.4041675627231598,0.945259690284729,0.36466845870018005
"Il vero paradosso è che anche Giuliana [Fiastri], la prima moglie di Carlo [Ponti], desiderava la sua libertà e, da avvocato, studiava la situazione in cerca di una via d’uscita. Tre volte i Ponti chiesero l’annullamento alla Sacra Rota, e tre volte fu loro negato. L’unica soluzione per toglierci se non altro dall’impiccio della bigamia sembrava essere l’annullamento del matrimonio messicano, cosa che comunque rappresentava più un passo indietro che un passo avanti. Soffrivo tanto, ma nel fondo del mio cuore avevo la coscienza pulita e, per quanto fossi sconvolta da tutte le accuse pubbliche e private che ci piovevano addosso, sapevo di essere nel giusto. Mi sentivo sposata, e questo doveva bastarmi, anche se non era sempre facile vivere alla gogna, bollata di infamia. Sulle porte delle chiese stavano affissi dei manifesti che mettevano all’indice i miei film e nel contempo invitavano i fedeli a pregare per le nostre anime peccatrici. Eravamo sommersi di lettere spesso feroci, la peggiore delle quali arrivò da un gruppo di donne di Pozzuoli. Sentirmi attaccata dalla mia città, dal cuore della mia infanzia, della mia terra, mi causò una ferita profonda, da cui ci misi molto a riprendermi. L’Italia si divideva tra chi era con noi e chi era contro di noi. Era l’Italia di Coppi e della Dama bianca, di Rossellini e della Bergman, un’Italia bigotta che non aveva un lungo futuro. Dieci anni ancora, e tutto si sarebbe risolto con il referendum sul divorzio. Allora però eravamo ancora lontani e non ci restava che subire senza farci annientare.",0.18916831561364233,0.2008364349603653,0.24734824895858765,0.23484498262405396,0.5597403049468994,0.8978558778762817,0.9858535528182983,0.8652806878089905,0.7602830529212952,0.32823625206947327,0.8849267363548279,0.07840517163276672,0.9385376572608948,0.6493648290634155,0.36693745851516724,0.9860973358154297,0.9495564699172974,0.401010125875473,0.7781584858894348,0.204193577170372
"Tutte le tappe della mia vita e della mia carriera sono segnate dalla mia accanita volontà di conquistare protezione e sicurezza. Ho dovuto molto lottare, specialmente sul piano della mia vita privata, ma ogni volta ho conquistato quello che volevo, e non si è mai trattato di capricci o di chimere. Il cibo è il simbolo della sicurezza, assieme al tetto che ci ripara. Perciò è un simbolo che, accompagnandomi sempre, è diventato sacro per me.",0.18233858468011022,0.0061905658803880215,0.017998522147536278,0.018047498539090157,0.12113327533006668,0.49622318148612976,0.006765655241906643,0.008057298138737679,0.049234796315431595,0.010973937809467316,0.02150169387459755,0.05166157707571983,0.00926130823791027,0.03744795545935631,0.023407747969031334,0.1611768901348114,0.0032793835271149874,0.016238633543252945,0.10903103649616241,0.019799532368779182
"Anche l’uomo, oggi, può instaurare un nuovo amabile rapporto, risolvere un malinteso, una ruggine coniugale «prendendo la moglie per la gola». Che l’uomo si metta ogni tanto ai fornelli, e si diverta a cucinare, e possa menar vanto di un piatto ben riuscito: ecco un bel quadro di spensieratezza e serenità familiare. [...] Gli uomini che si dicono «all’antica», ma che nel passato non hanno imparato niente e per il presente si limitano a ignorare che la donna ormai lavora ed è presente in ogni campo dell’attività sociale  quegli uomini saranno urtati, se non scandalizzati, da queste mie riflessioni. ""Come"" diranno  ""un uomo in grembiule, e fra i fornelli, proprio come una donnetta di casa!"" Ebbene, sì. Anzi sono proprio loro, con le loro idee inadeguate all’evolvere della società, che avrebbero più bisogno di questa, diciamo, terapeutica culinaria. Con le loro idee, infatti, i loro ménages familiari devono pullulare di problemi, e come! Proprio a loro, cioè a questi mariti ancora riottosi all’immagine della donna moderna, io rivolgo il mio invito a frugare e a provare fra le mie ricette. Me ne saranno grati, scommetto qualsiasi cosa.",0.18233858468011022,0.03522812947630882,0.1976839005947113,0.08615107834339142,0.22629639506340027,0.5208860635757446,0.0033625727519392967,0.9667765498161316,0.09223057329654694,0.07962681353092194,0.7527249455451965,0.21468326449394226,0.0028391394298523664,0.9308288097381592,0.10203973948955536,0.9786471724510193,0.952759861946106,0.23446185886859894,0.7515565156936646,0.3838949203491211
"Andando indietro agli anni della mia primissima infanzia, quando c’era la guerra, mi convinco sempre più che pur nell’orrore e nelle difficoltà di quel periodo io ho incontrato due cose, due certezze di cui un bambino ha assoluto bisogno per vivere: protezione e nutrimento. Sembra assurdo parlare dell’una e dell’altro quando tutti i giorni, ora per ora, si viveva sotto le bombe e le stragi e si aveva fame da mattina a sera. Ma lì, a Pozzuoli, dove io stavo con mia madre e i miei nonni, ogni giorno accadeva un rituale che riusciva ad appagare quei due bisogni di certezza. Ogni sera si aspettava che passasse l’ultimo treno, e poi tutta la gente del paese si riversava dentro un lungo tunnel ferroviario, dove il prossimo treno sarebbe passato soltanto all’alba seguente. Andavamo lì dentro carichi di coperte e di qualsiasi straccio che potesse tenerci caldi, si formavano giacigli e ci si buttava a dormire. Un’aria chiusa e pesante, e tanta umanità spaventata. Ma in quelle ore sotto il tunnel ci si sentiva protetti, e non soltanto perché lo si credeva a prova di bombe, ma perché eravamo tutti là, gli uni accanto agli altri, a respirare la stessa aria, a farci coraggio, a trovare  persino  il gioco e lo scherzo. A me pareva di avere acquistato una famiglia enorme, i miei angeli protettori moltiplicati per dieci, per cento: sicura e protetta, con una percezione così precisa come mai più avrei avuto nella vita. Oggi capisco che quel tunnel, in fondo, era per me la pace del nascituro nel grembo materno.",0.18233858468011022,0.028435109183192253,0.0381283275783062,0.023057030513882637,0.9652942419052124,0.8737382888793945,0.40251263976097107,0.9343041181564331,0.9882667660713196,0.011195346713066101,0.03627602756023407,0.049813538789749146,0.007520776707679033,0.2910158634185791,0.8764806985855103,0.9857572317123413,0.011919787153601646,0.2650015652179718,0.8804917931556702,0.05645403265953064
"[Su Franco Interlenghi] Fu infatti proprio in quel momento della nostra vita che decidemmo di non fare più film insieme, riproponendo ogni volta la solita coppia anche sugli schermi. Non potevo rimanere per l'eternità “l'ingenua numero uno” e lui per sempre il ragazzino dei suoi esordi. Scegliemmo di incanalarci in altre storie, con altra gente, proprio per cercare nuovi personaggi più adatti ai tempi ai quali andavamo incontro. Era una scelta necessaria.",0.18233858468011022,0.05356675013899803,0.1564120203256607,0.05921633914113045,0.04231813922524452,0.34492453932762146,0.6671503186225891,0.3244324028491974,0.6943894624710083,0.15584231913089752,0.23174136877059937,0.2779758870601654,0.0048084924928843975,0.5669097304344177,0.08536386489868164,0.3935639560222626,0.5757610201835632,0.15879178047180176,0.09095016121864319,0.28107592463493347
"[Su Stelvio Cipriani] Il nostro feeling dipese da me e dal mio bisogno di libertà. Stelvio fu bravo a capire quali fossero le mie esigenze in quel preciso momento, e così si comportò sempre come io da tempo avrei desiderato da un uomo, permettendomi di fare tutto ciò che mi sembrasse giusto per me. A dire il vero, non che facessi granché. Però mi bastava l'idea di poter essere autonoma, di avere la possibilità di gestire il mio tempo e di non sentirmi più soffocare.",0.18233858468011022,0.6862218379974365,0.050717614591121674,0.043012890964746475,0.2230364829301834,0.1904345154762268,0.03379420191049576,0.09451687335968018,0.019470540806651115,0.06527554243803024,0.10060591250658035,0.2235110104084015,0.01024153083562851,0.9159186482429504,0.030060026794672012,0.863288938999176,0.006748970597982407,0.3094905614852905,0.6898826956748962,0.06450299918651581
"A un certo punto della mia carriera mi ribellai a questa immagine ingenua “acqua e sapone”, perché ogni cosa ha la sua epoca e un cambiamento avviene quando meno te lo aspetti. Mi accorsi di non poter più essere quella che veniva pilotata e messa lì come se fosse un burattino. Avevo bisogno di affermarmi come persona e non più come colei che va guidata, dai genitori prima e da un marito dopo. Cominciai a dire la mia e fu un trauma in famiglia, perché Franco non mi conosceva sotto l'aspetto di donna reattiva e autonoma, ma io non ne potevo più e dovevo cambiare per forza, in qualsiasi modo.",0.18233858468011022,0.7031873464584351,0.06869079917669296,0.06775446236133575,0.20196476578712463,0.8247221112251282,0.8169008493423462,0.9275590181350708,0.9421593546867371,0.7591361999511719,0.3650696873664856,0.36617419123649597,0.007302451878786087,0.7306071519851685,0.19409950077533722,0.963686466217041,0.8928393125534058,0.24785521626472473,0.5931228399276733,0.4785311818122864
"Naturalmente, anche Franco era coinvolto in queste mie scelte. Sebbene non venisse mai sul set, evitando di esporsi ufficialmente, lavorava prima sul copione, quando c'era la lettura del personaggio, e in base a quello, una volta stabiliti i termini e firmato il contratto, eliminava le scene di nudo. Se la produzione accettava, stava tranquillo, perché io ero tutelata dalla mia firma e da quella della produzione.",0.18233858468011022,0.02543591894209385,0.32783252000808716,0.3862684369087219,0.297379732131958,0.05294409394264221,0.011116898618638515,0.08765066415071487,0.00849603395909071,0.4053893983364105,0.3491515815258026,0.3363308012485504,0.02272830158472061,0.655068039894104,0.20160198211669922,0.6828464865684509,0.033336181193590164,0.4680817127227783,0.36669015884399414,0.3011287450790405
