"«Vivevano nell'isola due giovani sorelle, Lutka e Liuba, assai diverse l'una dall'altra: Lutka era bellissima, con un volto chiaro e delicato, gli occhi verde smeraldo e lunghi capelli biondi che le cadevano morbidi sulle spalle bianche come il latte; Liuba invece era bruttina, coi lineamenti marcati e la carnagione scura; aveva lunghi capelli neri e arruffati, ma gli occhi erano dolci e il sorriso gentile.  Liuba è tanto buona!  dicevano al villaggio.  Ma... Lutka è così bella!»",0.18094799970276654,0.028231201693415642,0.033900804817676544,0.034340228885412216,0.015566272661089897,0.015316925942897797,0.006279912311583757,0.2520220875740051,0.7693464756011963,0.015011657029390335,0.07190949469804764,0.04014038294553757,0.0035192009527236223,0.21191838383674622,0.030710598453879356,0.06561829149723053,0.5926771759986877,0.14641323685646057,0.07382741570472717,0.20934277772903442
"«Una notte, mentre stava tornando a letto, con due bei baffi di cioccolata sulle guance paffute, vide la mamma che stava parlando nel suo studio con un signore.  Dottore, ma è così grave?  chiese la mamma piangendo.  Sì, sua madre è molto malata  rispose il medico.  Ha bisogno di cure e di quell'incoraggiamento che solo una figlia può dare. Ha chiesto di lei, e solamente il suo affetto e la sua abnegazione potranno forse salvarla.»",0.18094799970276654,0.011086423881351948,0.020026884973049164,0.054591987282037735,0.04107159003615379,0.20805571973323822,0.003688730299472809,0.7303065061569214,0.5669472217559814,0.05066467449069023,0.6656090617179871,0.01811191998422146,0.0027533911634236574,0.5856212973594666,0.027241840958595276,0.8818110227584839,0.834079921245575,0.5034472942352295,0.11754727363586426,0.3306998908519745
"Per vedermi sorridere di nuovo, papà Giuseppe mi costruì un piccolo teatrino, lo ricordo benissimo: un'asse e un fondale. Era semplice, senza marionette, ma io le creavo nella mia fantasia, tiravo dei fili invisibili e le storie prendevano vita per magia. Quel teatro mi faceva sognare, era il mio luogo fantastico. Che il mio futuro fosse altrove, lo avvertivo. Io sentivo che un giorno non lontano sarebbe arrivata l'ora del distacco e la temevo. I miei fratelli e i miei compagni di giochi avvertivano che non ero come loro e a volte me lo facevano capire, prendendomi in giro. Il tenero ricordo di quel mio primo piccolo teatro mi accompagna sempre e mi piace pensarlo come presagio del destino che mi attendeva. Più tardi, molto più avanti negli anni, ho avuto un altro Piccolo Teatro: l'immenso Piccolo Teatro di via Rovello. E questa volta la marionetta ero io, una marionetta consapevole che essere legata ai fili di Giorgio Strehler era un'ineguagliabile scoperta di nuovi orizzonti: nella fatica del lavoro, nella libertà dei sentimenti, nella quotidianità della vita. Una vita che a raccontarla sembra la trama di un romanzo.",0.18179076770320535,0.3380245268344879,0.29908230900764465,0.3182126581668854,0.8632300496101379,0.7614063024520874,0.6500561833381653,0.3425489664077759,0.21648789942264557,0.2972852289676666,0.06544940173625946,0.5859342217445374,0.00384921720251441,0.5241978764533997,0.4390259385108948,0.929142951965332,0.049145787954330444,0.2595684826374054,0.7306626439094543,0.45911067724227905
"Quante volte nella vita mi sono venuti incontro uomini ricchi, ricchissimi, ma per me il massimo della ricchezza è il mio lavoro, la gioia di vivere, la fortuna di abitare in una casa posata magicamente in un giardino... Io, mentre scrivo, sto guardando la poesia, la natura, il cielo tra gli alberi, gli uccellini che saltano da un ramo all'altro, più felicità e ricchezza di questa, cosa vado cercando?",0.18179076770320535,0.018385227769613266,0.967258870601654,0.018056480213999748,0.4160729646682739,0.5345469117164612,0.00336471782065928,0.02549840696156025,0.0074053010903298855,0.010422932915389538,0.012135510332882404,0.04536905884742737,0.0028558436315506697,0.8835412263870239,0.9939566254615784,0.9823213815689087,0.008585717529058456,0.17340970039367676,0.715312659740448,0.1299707442522049
"Conosco persone che sostengono che un'attrice dovrebbe dedicarsi solo al suo lavoro e non innamorarsi o avere una vita privata. No. Io voglio avere la mia vita. Voglio essere una persona semplice, fragile, anche disperata, senza la veste della divina dannunziana... Si pensi pure al personaggio che vedete alle prime della Scala o che posso sembrare anche adesso, mentre scrivo. Io so chi sono. Per me l'importante è che, davanti alla macchina da presa o sul palcoscenico, io possa entrare nei recessi più intimi della mia sensibilità per immedesimarmi nei personaggi a un grado così profondo da consentire al pubblico di condividerli con me. Pubblico che poi è libero di amare, di criticare o di distruggere. Io vedo il mio lavoro solo come un atto d'amore. E dico di più: tra cinema e teatro amo di più il teatro.",0.18179076770320535,0.30282193422317505,0.39601317048072815,0.33356747031211853,0.6528890132904053,0.32779452204704285,0.009326836094260216,0.6822590827941895,0.049577243626117706,0.4792153239250183,0.5050122737884521,0.8370980620384216,0.0035802223719656467,0.5853626728057861,0.17607663571834564,0.675171434879303,0.8253551721572876,0.6141176819801331,0.9135996699333191,0.9368100762367249
"Quel che si prova ogni sera recitando davanti a un pubblico è una grande emozione, un profondo amore e un'infinita paura di non sapere dare fino in fondo quello che si ha dentro, cosa che, quando succede, ti avvilisce e ti fa sentire inutile. Ma quando tra pubblico e attore si stabilisce quel fluido fatto di magia, indescrivibile, delirante, allora il delirio è portato alla sfrenatezza più grandiosa. Non potete nemmeno immaginare quanto sia bello recitare, quanto sia stato bello interpretare i personaggi che ho vissuto e sofferto in questi anni. Anche se a volte ne sono uscita a pezzi, trascinandomi dietro brandelli di vita mia e dei miei personaggi. A volte mi domando chi io sia veramente e se, magari, a forza di essere persone diverse, non abbia, alla fine, perso me stessa. Ma la risposta è no: ho dato forma e concretezza alle parole scritte nei copioni per renderle carne che pulsa, che respira, oso dire di averle incarnate.",0.18179076770320535,0.3540584444999695,0.41901344060897827,0.7948818802833557,0.8751590847969055,0.46059396862983704,0.007979213260114193,0.16506965458393097,0.0036530031356960535,0.317059189081192,0.24672730267047882,0.6231005191802979,0.0026839019265025854,0.27799397706985474,0.20748183131217957,0.6185421347618103,0.09022106230258942,0.5289247035980225,0.8714113831520081,0.5992112755775452
"La gente è portata a vedere in noi attori creature un po' diverse e un po' strane, ma in fondo io sono una donna come tutte le altre, con tutte le sue contraddizioni, le sue paure, le sue solitudini e i suoi dolori. Una donna con la sua gioia e la sua disperazione di vivere. Forse non sono semplice così come mi giudico io, ma certamente sono più semplice di quanto gli altri possano giudicarmi.",0.18179076770320535,0.11447077989578247,0.03533921390771866,0.027463944628834724,0.05226299539208412,0.21555784344673157,0.004801930859684944,0.09180918335914612,0.015462514013051987,0.01641036383807659,0.11421360075473785,0.1242118552327156,0.008082297630608082,0.1915857344865799,0.1084044948220253,0.5170196294784546,0.7613482475280762,0.1521272212266922,0.23290884494781494,0.2950472831726074
"Raggomitolata in un fiocco di neve sono nata a Milano, il primo gennaio, nell'ora del tramonto. Dopo una lunga discesa dal cielo, scivolai in un camino e giù mi trovai tra le braccoa amorevoli e dolci di una contadina lombarda che mi diede subito un po' del suo latte, e ne volli ancora e ancora... poi mi coprì con una calda coperta di lana... ma pungeva!",0.18179076770320535,0.0643690973520279,0.2963736653327942,0.08204523473978043,0.10780909657478333,0.1770065426826477,0.28427255153656006,0.30507299304008484,0.7973265647888184,0.06674351543188095,0.3602277934551239,0.17945560812950134,0.00950763002038002,0.20068490505218506,0.38946762681007385,0.361054927110672,0.31296390295028687,0.24004656076431274,0.4957233667373657,0.20747017860412598
"Mamma Rina allattava me e la sua bambina di nome Uliva [...] Mia madre avrà di certo pensato al mio mantenimento, ma era troppo giovane per accudire una figlia: si era appena diplomata al Conservatorio in pianoforte e stava tentando di affermarsi. In sette anni venne a trovarmi solo due volte [...]. Mi dicevano che era la zia Olga, una signora molto bella che però sentivo essere molto diversa dalle persone con cui ero abituata a vivere. [...] Truccata, elegante, odorava di fiori: mi faceva uno strano effetto, con lei mi sentivo a disagio. La sua immagine mi provocava un'angoscia oscura e indefinibile. La guardavo con terrore. Seppure bella, a me sembrava una donna orrenda; in quei sette anni mi portò un solo regalo: non un giocattolo, ma una scatola di biscotti. L'unica bambola della mia infanzia me l'aveva fatta mamma Rina mettendo insieme un po' di stracci. Adoravo quella bambola cucita con tanto amore.",0.18179076770320535,0.1605817973613739,0.14861232042312622,0.10290654748678207,0.293998122215271,0.25399884581565857,0.005593500100076199,0.8558774590492249,0.9781633019447327,0.06484173983335495,0.3754696846008301,0.30932027101516724,0.004155812319368124,0.47995057702064514,0.11786802858114243,0.41102859377861023,0.8707486391067505,0.5231394171714783,0.8392044901847839,0.32966914772987366
"Riuscii a raggiungere il bar, avrei bevuto qualcosa per poter poi fingere di stare male, una scusa come un'altra per andarmene. Ma Zanuck mi si avvicinò e mi mise brutalmente le mani addosso proprio mentre stavo bevendo un sorso di whisky: sciaff! Gli sbattei con disprezzo il whisky in faccia. Sapevo benissimo che sarebbe stata la fine della mia carriera hollywoodiana, ma quale soddisfazione, quale gioia. Il piacere di tirare addosso quel whisky a questo cretino mi stava molto più a cuore. Solamente perché era il grande produttore Zanuck io sarei dovuta stare lì ai suoi piedi, essere la sua schiava, diventare la sua amante? Dovevo permettere che si vantasse di avere una donna italiana, una francese, un'altra di chissà dove?! Gli gettai il whisky in faccia con un tale gusto ma con un tale gusto che arrivai a dirgli: ""Mi fai schifo"". E dopo averlo mandato al diavolo, presi la porta.Mi fece chiamare dopo due giorni. Pensai fosse strano che aspettasse così a lungo, avrà voluto prepararsi un discorso. Lo raggiunsi alla Fox nel suo bellissimo ufficio in boiserie, con tutte le vetrine contenenti libri pregiati e premi di polo. Lui era elegantissimo, con i pantaloni alla zuava e gli stivali, sembrava pronto per andare a una partita; camminava su e giù per la stanza e a un certo momento si fermò e mi disse: ""Don't you know that I can make you the greatest star in the world or I can destroy you just like that?"" (Non sai che posso renderti la star più grande del mondo o posso distruggerti in un attimo?). Risposi: ""È proprio quello che voglio, voglio essere distrutta just like that"". Glielo dissi così, in faccia. ""Goodbye. We don't have anything more to say"" (Addio. Non abbiamo altro da dirci). E così finì. Ci tenevo, quale attore non tiene a una carriera a Hollywood? Avevo girato film che avevano avuto un gran successo. Ma non volevo accettare la corte del produttore.",0.18179076770320535,0.16820111870765686,0.05929113179445267,0.03673494979739189,0.17658661305904388,0.20884789526462555,0.02804582379758358,0.03071817196905613,0.007788444869220257,0.0659680888056755,0.5982019901275635,0.6320757865905762,0.005040319636464119,0.40152791142463684,0.04077141731977463,0.6589388847351074,0.3216158151626587,0.26720863580703735,0.6244305968284607,0.26139283180236816
"A Torino i nonni avevano un palco al Regio e mi portavano sempre con loro: il mio battesimo è stato l'Elettra di Strauss, un'opera complicata e misteriosa per una bambina di otto anni ma io ne rimasi affascinata. Ero cresciuta con la musica e per me ogni volta che andavo a teatro ad ascoltare concerti era come andare a una festa. Ancora oggi, mentre leggo o studio, ascolto la musica: le note mi aiutano a far scorrere meglio la mia memoria.",0.18275676690973341,0.15098696947097778,0.3426991403102875,0.2764813005924225,0.1803322285413742,0.09681388735771179,0.032693468034267426,0.09382105618715286,0.37512660026550293,0.4268198609352112,0.32135531306266785,0.37152430415153503,0.005546770989894867,0.3330049216747284,0.13823093473911285,0.17291051149368286,0.04552644491195679,0.19012975692749023,0.19046366214752197,0.2912484109401703
"Il giorno dopo mi iscrissero dalle suore, alla scuola elementare di piazza Vittorio, un edificio antico, con un giardino grande e pieno di alberi dove, appena potevo e nessuno mi vedeva, mi toglievo le scarpe e camminavo scalza sull'erba perché volevo sentire i sassolini e la frescura sotto i miei piedi, come quando abitavo in campagna. Era un'operazione che facevo di nascosto perché le suore non l'avrebbero approvata dal momento che volevano fare di me una signorinella educandomi secondo il miglior galateo, proprio io che venivo dalla campagna e parlavo dialètti E una cretina di compagna non andò a fare la spia?! La odiai: per colpa sua venni messa sotto sorveglianza e da quel momento non potei più camminare senza scarpe. Avrei voluto punirla mettendole un sassolino in bocca come avevo già fatto a Rivolta d'Adda a una bambina che mi ave va preso in giro.",0.18275676690973341,0.06124047935009003,0.06617437303066254,0.08188015222549438,0.23696951568126678,0.4726196825504303,0.037286318838596344,0.4075416624546051,0.8806304931640625,0.1215420737862587,0.5575857758522034,0.35177597403526306,0.019616391509771347,0.5856873989105225,0.7265574932098389,0.8276979923248291,0.6528969407081604,0.4400422275066376,0.5246586799621582,0.32686272263526917
"In quei miei primi giorni nella capitale lo zio si offrì di accompagnarmi a vedere e a conoscere la città. Il suo lavoro gli permetteva di avere alcune giornate libere, le mie cuginette erano a scuola e lui mi fece da chaperon. Prendemmo la sua macchina e per prima cosa volle farmi vedere il cupolone di San Pietro dal buco di una serratura. L'idea mi fece ridere, incredula, ma ci avviammo. Dopo un po' ci fermammo e mi disse: ""Fa' due o tre passi e ti troverai in una piazzetta magica che è stata dedicata ai Cavalieri di Malta. Vai, te la lascio scoprire da sola e poi mi dirai le tue impressioni"". Ci andai e restai incantata. Davanti a un vecchio giardino di cipressi, oleandri e rose, un architetto in stato di grazia aveva fatto costruire un lungo muretto di marmo bianco alto circa due metri. In basso, ai lati, due panchine dello stesso marmo; in alto, a destra, un fregio scolpito dove si appoggia una base che porta una grande bellissima stele di marmo scanalato, bianchissimo, con uno stemma maestoso che emana scintille di fuoco. Al centro, invece, si erge un'edicola votiva con fregi di una grazia ineffabile, affiancata da due meravigliosi obelischi che svetta no verso il cielo, e i cipressi ondulano leggeri, come a coronare tanta bellezza.",0.18275676690973341,0.10008552670478821,0.4047604501247406,0.13500486314296722,0.5777482390403748,0.1152944564819336,0.10029642283916473,0.07299043238162994,0.14054259657859802,0.06147383153438568,0.07069738954305649,0.3515477478504181,0.004432775545865297,0.17703084647655487,0.6216645836830139,0.9422381520271301,0.018477151170372963,0.12048282474279404,0.34463319182395935,0.22842319309711456
"Durante la bella stagione, e rigorosamente dopo aver finito i compiti, avevamo il permesso di spingerci fino allo zoo dei giardini pubblici. Noi giravamo un po' attorno agli animali, li guardavamo fantasticando di riuscire un giorno a liberarli tutti, poi ci allontanavamo nel parco perdendoci nei nostri inseguimenti da indiani. Uno dei miei compagni di giochi veniva da Trieste e, dopo la morte del padre, era venuto a vivere a Milano con la madre, una violoncellista, al 55 di corso Buenos Aires, vicinissimo a casa mia. Si chiamava Giorgio. Giorgio Strehler. Molti anni dopo e in un'altra situazione mi ha guardata negli occhi e mi ha detto: ""Ma allora tu sei quel la bambina che parlava solo dialetto"". ""Sì"" risposi sorridendo. ""L'unica bambina in mezzo a tre ragazzi. Ero già innamorato di te"". Questo ricordo ci intenerì moltissimo. È uno dei tanti fili misteriosi che mi hanno guidato nella vita, come se il caso si divertisse a farmi cadere proprio in quegli spazi che sarebbero poi diventati i luoghi intorno ai quali avrei vissuto in futuro il mio destino. E se è il caso a fare questo... il caso la sa lunga.",0.18275676690973341,0.3664632737636566,0.3659214377403259,0.05341881513595581,0.9489123225212097,0.9779713749885559,0.434000700712204,0.8760308027267456,0.8209143280982971,0.08041219413280487,0.3942500948905945,0.1551934778690338,0.005746383219957352,0.9408131241798401,0.991628110408783,0.9847680926322937,0.42161035537719727,0.5108044147491455,0.8811097145080566,0.47765910625457764
"Tornai a Hollywood, e andai ad abitare con Dick [Richard Basehart] in una bellissima casa al numero 8 di North Palm Drive dove trascorsi alcuni dei momenti più belli della mia vita. Jackie nacque e quando lo portai a casa, in pieno ottobre, le rose lungo il vialetto all'ingresso erano sbocciate con mille fiori bianchi. Amavo cantargli le ninne nanne, tenerlo in braccio. Volevo essere la mamma più dolce del mondo. Avevamo molti amici, uno di questi era nientemeno che Charlie Chaplin. Lui e Dick si vedevano quasi ogni giorno anche solo per fare una partita a tennis; spesso veniva da noi a colazione con sua moglie Oona O'Neill, la figlia del grande drammaturgo. Un giorno Chaplin mi aveva detto: ""Valentina, sarai la protagonista del mio prossimo film"". Era Luci della ribalta (Limelight) ma fui costretta a dirgli di no perché avrei partorito dopo pochi mesi. Spesso andavamo da Cary Grant; ci invitava nel pomeriggio a prendere un tè oppure veniva a pranzo da noi con William Wyler, il regista di Vacanze romane, e Gregory Peck.",0.18275676690973341,0.140072301030159,0.26324978470802307,0.10104674845933914,0.07960635423660278,0.7850634455680847,0.3955269157886505,0.6816380620002747,0.5175325870513916,0.06993117183446884,0.061494238674640656,0.2489081621170044,0.014712473377585411,0.5904577970504761,0.11576443910598755,0.16501294076442719,0.5816891193389893,0.1933729201555252,0.441603422164917,0.2748049795627594
"L'11 dicembre 1967 ero a Ginevra da Jackie [il figlio]. Mi alzai prima delle sette per tornare a Milano con il treno del le 8.30, accesi la radio e sentii: ""Le cornee di De Sabata sono state donate..."". I suoi occhi verdi come il mare in tempesta, sempre velati di nostalgia e a tratti attraversati da bagliori di acciaio non c'erano più. Victor era stato colpito in volo. Morì durante la notte, all'una, e lo seppi dalle casse di una radio. Scivolai a terra colpita dal dolore e dal senso di colpa. Per ché quel giorno non ero salita ad abbracciarlo? Perché non avevo saputo portargli un po' di gioia? Erano passati cinquantanni dal suo primo ingresso alla Scala nel 1917; per l'estremo saluto i maestri strumentisti vollero interpretare la stessa Marcia funebre che Victor aveva diretto al funerale di Toscanini, ma non vollero che un altro direttore d'orchestra lo sostituisse perché nessuno poteva raggiungere la sua altezza. Dissero: ""Per il Maestro suoniamo noi"", e tutta l'orchestra della Scala strappò l'anima di chi era lì ad ascoltarli.",0.18275676690973341,0.21688511967658997,0.26342064142227173,0.34570732712745667,0.530968427658081,0.5235077738761902,0.9790698885917664,0.27782684564590454,0.028428001329302788,0.4804132878780365,0.49705713987350464,0.5495913624763489,0.0036278332117944956,0.7271325588226318,0.6690645813941956,0.9507820010185242,0.020915789529681206,0.4771811366081238,0.7682552337646484,0.6087270379066467
"Ogni notte d'inverno, rientrando dalle prove e dagli spettacoli, preparavo la cioccolata calda e stavamo lì, Giorgio [Strehler] e io, a berci la nostra tazza uno di fronte all'altra. Era un momento così bello. Lui ne andava  matto, lo faceva tornare bambino tanto che non resisteva e, quando l'aveva finita, si leccava la tazza per bene. Ma in fondo Giorgio era un bambino. Faceva lo stesso pure ai ristoranti, di nascosto, e io mi divertivo un mucchio a imitarlo. Che Giorgio fosse un bambino era chiaro a tutti: aveva lo specchio del bagno coperto con un asciugamano e si faceva la barba a memoria, senza guardarsi. Io, tutte le mattine, glielo tiravo via e lui, puntualmente, si arrabbiava. Non sopportava di vedersi. Bello com'era. Ma era fatto così. Con i nostri due caratterini discutevamo spesso, ma in fondo era solo un gioco: mi rincorreva e io mi rinchiudevo nell'ascensore, premevo l'alt e restavo bloccata tra un piano e l'altro. Lo sentivo urlare, voleva raggiungermi e io me ne stavo ferma lì, per farlo incazzare ancora di più. Appena lo sentivo sbattere la porta di casa, facevo ripartire l'ascensore, correvo ad affacciarmi alla finestra e urlavo: ""Giorgio, mi chiamavi?"".Una volta era così arrabbiato che diede un pugno tanto forte alla parete dell'ascensore da lasciarci un buco: credo ci sia ancora. Il problema è che non mi ricordo nemmeno il motivo: per me, per il lavoro, per le tasse. O perché l'Inter aveva perso?",0.18275676690973341,0.1248382031917572,0.2924925684928894,0.0877489298582077,0.24518080055713654,0.3923676311969757,0.3125433325767517,0.5408943295478821,0.7601001262664795,0.11729136854410172,0.18084651231765747,0.46401360630989075,0.006347084883600473,0.7345827221870422,0.0459805428981781,0.8850653767585754,0.014080403372645378,0.4991762936115265,0.52396559715271,0.26651161909103394
"Ma torniamo alle cose serie: a me le scarpe piacciono da pazzi ! Trovo che la scarpa in sé sia un oggetto meraviglioso. Sgomberiamo subito il campo da possibili equivoci: la scarpa vera deve avere il tacco. Il tacco è imprescindibile, essenziale, fondamentale, di più: è la scarpa. È una questione filosofica, direi ontologica: la scarpainsé, il noumeno della scarpa, ha il tacco. Alto: sotto i sette centimetri non viene neanche preso in considerazione. Infatti la cosiddetta ballerina non è da ritenersi scarpa vera, scarpa fino in fondo. Forse solo Audrey Hepburn è riuscita a essere incantevole con quel le cosette insulse ai piedi, e in ogni caso anche lei stava meglio con un po’ di tacco. Altrimenti rischiava sempre l’effetto Sabrina, che non a caso non è certo il suo film migliore.",0.18275676690973341,0.30385318398475647,0.1101316437125206,0.08675095438957214,0.49356675148010254,0.04136887565255165,0.005600637756288052,0.015036032535135746,0.016780927777290344,0.05465593561530113,0.17127543687820435,0.6749246716499329,0.002768451115116477,0.24416176974773407,0.06940820813179016,0.5617122054100037,0.28980526328086853,0.06562533229589462,0.3560667932033539,0.5675101280212402
"Ai musicisti invidio la grazia, e soprattutto la libertà. Io nel mio mestiere sono totalmente condizionata dalla parola, limitata dalla lingua; loro possono suonare dappertutto, per qualunque pubblico, con qualunque collega, incontrato magari un’ora prima: basta uno sguardo, una partitura, un diapason. Felicemente apolidi, liberi da barriere nazionali, etniche o ideologiche: ha ragione Daniel Barenboim, la musica sveglia il tempo. E lo doma, lo dilata, lo scandisce, lo culla.",0.1821805201470852,0.5938746929168701,0.5942497253417969,0.5532606244087219,0.41985228657722473,0.2207961529493332,0.008017783053219318,0.46747633814811707,0.3091947138309479,0.6859784722328186,0.6051641702651978,0.7195723056793213,0.020153958350419998,0.44533300399780273,0.34736281633377075,0.4328633248806,0.1421777904033661,0.39731571078300476,0.51251220703125,0.7731748819351196
"Chissà se riesco a spiegarmi quando dico che sono stata fortunata: in entrambi i casi c’era quella che tecnicamente viene definita “incompatibilità con la vita”. La scelta l’aveva già fatta la natura, o il caso, o come diavolo lo vogliamo chiamare. Io ho dovuto solo decidere di anticipare un evento già sancito. Come dice De André: non ho creato dolore. Ma c’è un solo aggettivo che mi viene in mente se ripenso a quei giorni: devastante, è stato devastante. E pensare che io  cretina  credevo che in un certo senso il mondo dovesse ringraziarmi, perché prendendo quella decisione mi facevo carico di un dolore che altrimenti avrebbe gravato sugli altri: su mio marito, sulla figlia che già avevo, su mia madre, sulla società. E invece così me lo prendevo tutto io. Che nessuno si azzardi a dire che le donne abortiscono con leggerezza. Non è mai così, mai, e soprattutto quando si tratta di un aborto terapeutico. Daresti qualunque cosa perché in quel momento qualcuno ti dicesse: «Vada avanti, signora, che poi si aggiusta tutto...». Qualunque cosa.",0.1821805201470852,0.40624579787254333,0.06890448927879333,0.17781619727611542,0.3714047968387604,0.9138739705085754,0.009393167681992054,0.6469942927360535,0.027878984808921814,0.300405353307724,0.6169896721839905,0.024760525673627853,0.0058355568908154964,0.11070611327886581,0.9472312927246094,0.9732576608657837,0.9314780235290527,0.20293383300304413,0.6452366709709167,0.09679804742336273
