text,time,autodeterminazione,casa,corpo,dimensione spirituale,eventi della vita,eventi storici,famiglia,infanzia e adolescenza,invecchiamento,malinconia,performance di sé,politica,relazione con gli uomini,relazione con il mondo naturale,relazione con la realtà,relazione con le donne,scrivere,sentimenti e stati d animo,mestiere dell’attrice
"Non si può toccare il polso a questo ammalato [il Teatro italiano] senza interrogare chi ha dimostrato di sapere con dignità e coscienza esercitare questa travagliata nostra arte, che non avrà mai riposo, che non toccherà mai una mèta, perché appena una ne abbia raggiunta, un’altra ne sorge diversa da conquistare. Sicché, per noi, la nostra vita sarà sempre una povera cosa anche se agli altri paia splendida. Una vita, che se è fatta di tante vite e dà la gioia e il tormento di viverle tutte, domani poi non è più niente.",0.18207481666468084,0.2169334888458252,0.1705065816640854,0.18759934604167938,0.4675460457801819,0.905841588973999,0.03924556449055672,0.14409099519252777,0.044516757130622864,0.4461852014064789,0.620953381061554,0.4772215783596039,0.005962654948234558,0.34395715594291687,0.3201655447483063,0.9659461975097656,0.12169595807790756,0.1391160786151886,0.4035974442958832,0.45410794019699097
"Avevo quattordici anni, quando mi presentai alla segreteria dell’Accademia del Teatro dei Filodrammatici, per essere ammessa ai corsi di dizione e di recitazione di questa nostra scuola di Milano. Ma dovetti tornarmene indietro, delusa e triste, dopo un gentile ma fermo diniego non avendo ancora raggiunto l’età prescritta dai regolamenti per l’ammissione (sedici anni). L’anno dopo, come se avessi già raggiunto quell’età, col viso più fermo, bussai ancora a quella porta; e, di fronte a tanta buona e appassionata volontà, ecco il primo strappo ai regolamenti, alle date, ai principi, alle consuetudini. […]",0.18207481666468084,0.34322410821914673,0.3729947507381439,0.32515400648117065,0.29365676641464233,0.15059122443199158,0.07400229573249817,0.13942019641399384,0.43162453174591064,0.48712149262428284,0.36177968978881836,0.4545864760875702,0.015767861157655716,0.4777809679508209,0.17934705317020416,0.5206921100616455,0.06866827607154846,0.3906199634075165,0.3974171280860901,0.4222121834754944
"[L’ Accademia] fu come una mia seconda e più vera casa […] Ofelia Mazzoni prestava con un incanto, vorrei dire autoritario, il suo insegnamento; […] La gioia della mia prima conquista fu il suo giudizio […]. Ecco poi nel secondo anno, sostituirsi a lei, Enrico Reinach: buono, paterno, signorile. Seppe trovare in me le due vene: la vena drammatica e quella comica; perciò, io fui tra le sue allieve l’unica alla quale a ogni saggio fossero affidate due scene, una drammatica e una comica.",0.18207481666468084,0.43103888630867004,0.7569429874420166,0.2432464212179184,0.25115767121315,0.24338611960411072,0.07643170654773712,0.17393572628498077,0.35879847407341003,0.3221489489078522,0.44472625851631165,0.580399215221405,0.007298285607248545,0.4336387813091278,0.09919366985559464,0.32442721724510193,0.3573504090309143,0.2513117790222168,0.2713612914085388,0.6386496424674988
"Tra i ricordi dell’Accademia non posso tra lasciare il più grande: la ventura di avere avuto tra le spettatrici, a uno dei saggi, Eleonora Duse. Non ebbi neanche il bene di vederla in viso. […] Ebbi il senso della sua presenza fisica solo quando Enrico Reinach, alla fine del saggio, mi disse raggiante d’aver avuto da lei le più calde congratulazioni per «la sua allieva ».",0.18207481666468084,0.10099692642688751,0.23853161931037903,0.17539742588996887,0.33376622200012207,0.20392976701259613,0.40032958984375,0.10665912926197052,0.7727828621864319,0.17358636856079102,0.13421423733234406,0.641342282295227,0.008845552802085876,0.5974563360214233,0.18262776732444763,0.671427309513092,0.9169658422470093,0.3378066122531891,0.48054757714271545,0.317308247089386
"Il suo [di Enrico Reinach] insegnamento di due anni aveva stretta vieppiù la nostra conoscenza, devota da parte mia e amichevole anche verso i miei parenti da parte sua. Immaginarsi quindi la mia sorpresa, quando venni a sapere che ai miei genitori egli aveva sconsigliato la mia entrata in arte. Una fiamma di collera mi salì alla fronte; mi parve un tradimento. Ma lui, con la sua vecchia esperienza di comico, carezzandomi la guancia con la sua bella mano ingioiellata al mignolo: «Cara, il teatro, è meglio vederlo dalla poltrona». Mi sapeva già fidanzata, e gli era più grato vedermi tra le cure di una casa, anziché tra le incertezze e instabilità di un palcoscenico. […] La famiglia stringeva sempre più i freni, proibizione di partecipare a qualunque recita […] mi si offerse allora anche la possibilità di entrare nella cinematografia italiana, […] ma non osai neanche farne parola ai miei, benché mi sentissi attratta da questa nuova e prestigiosa forma d’arte. Attendevo con ansia di divenire maggiorenne per dichiarare la mia aspirazione. Ma il momento venne anche prima […] con l’interesse […] di Sabatino Lopez, che allora presiedeva agli spettacoli del Teatro del Popolo di Milano. Egli convinse con la sua autorità i miei genitori che trattandosi di teatro stabile con sede nella stessa città io potevo far l’attrice non allontanandomi da casa.",0.18207481666468084,0.22793693840503693,0.8831198811531067,0.22888372838497162,0.1034451574087143,0.10898158699274063,0.024707140401005745,0.7647954225540161,0.0972265675663948,0.18086235225200653,0.308520644903183,0.46631553769111633,0.0034137468319386244,0.46122923493385315,0.08083721995353699,0.5452010035514832,0.3001181185245514,0.08827690035104752,0.4546607732772827,0.6263168454170227
"Ettore Paladini, direttore della Compagnia, […] ci guardava con occhi buoni e scrutatori […], e duro ma illuminato in viso […] da una luce di intelligente bontà. La mia anima si temprò alla sua disciplina. Disciplina di soldato, di giusto, di innamorato del suo lavoro. […] Virgilio Talli io lo compresi subito: esuberante d’animo per i suoi attori, […] esuberante d’amore per il teatro. Non mi facevano paura le sue grida e le sue sfuriate. […] E fu per me Maestro impareggiabile. La cura del particolare, pur minutissima, non era mai in lui a scapito dell’idea generale del lavoro.",0.18207481666468084,0.2973964214324951,0.3370557725429535,0.3474047780036926,0.5751681923866272,0.0381990484893322,0.008550455793738365,0.040933605283498764,0.007077289279550314,0.2031073272228241,0.025273703038692474,0.6308023929595947,0.004394989460706711,0.7319814562797546,0.03259763494133949,0.5978839993476868,0.012726915068924427,0.24083486199378967,0.7731904983520508,0.4334165155887604
"Additata da Marco Praga come una delle poche attrici mature per un posto di responsabilità e di preminenza, io ero predestinata a legare la mia giovinezza […] addestrata dai due maggiori maestri della scena di prosa in Italia, […] alla più bella e sublime impresa che uno spirito giovanissimo e disinteressato doveva regalare al nostro Paese e a noi attori con la sua alta e umana partecipazione. Mentre la Duse, in giro per il mondo, benediceva a questa impresa, ecco che Luigi Pirandello, interessato dalla critica di Marco Praga, scrive a Talli per me. In seguito alla risposta di Talli, ecco a Milano un messo di Pirandello col preciso incarico di scritturarmi prima attrice. La nostra prima intesa avvenne così: senza esserci veduti né esserci parlati.",0.18207481666468084,0.5026505589485168,0.5215819478034973,0.43239083886146545,0.5141148567199707,0.1782165914773941,0.06329622119665146,0.2255985140800476,0.2765108346939087,0.4955677092075348,0.493903249502182,0.5366997122764587,0.038722045719623566,0.701714038848877,0.45153430104255676,0.7252187132835388,0.2475338876247406,0.6182911396026611,0.43453553318977356,0.7943773865699768
"Arrivai a Roma con mia madre e corsi subito al Teatro Odescalchi per prendere il mio posto. La Compagnia era già riunita da qualche tempo; io […] arrivavo ultima. Un uomo calvo e con una piccola barba a punta, nell’oscurità del palcoscenico, il viso pallido e solcato, era balzato in piedi con una agilità portentosa, in contrasto col suo aspetto, appena qualcuno disse il mio nome. E una mano calda e vigorosa scosse più e più volte la mia, con quella cordialità che è propria soltanto agli uomini che sanno dare e fare il bene. […] Curiosità, interesse, invidie, lotte, si erano accese fin da principio; lotte, intendo dire, da parte di chi è stato sempre contrario a ogni nobile e disinteressata impresa d’arte nel mondo del teatro. L’attesa della mia presentazione, acuita dal ritardo, era vivissima. Come per ogni grande impresa ai primi inizi, il primo assestamento era difficile. […] Fu un trionfo. Un trionfo per Bontempelli, per Luigi Pirandello, per il Teatro e per me. Piangevo di consolazione e di beatitudine. Mai più, dopo, ebbi una così piena e pura gioia.",0.18207481666468084,0.2190910428762436,0.33191758394241333,0.2833288908004761,0.13075776398181915,0.061503615230321884,0.03639932721853256,0.10110215097665787,0.01896529830992222,0.13805177807807922,0.271685391664505,0.6790276169776917,0.002783785108476877,0.4844145178794861,0.014705059118568897,0.2883882224559784,0.04465627297759056,0.07117081433534622,0.2687532901763916,0.41531938314437866
"Sola, aiutata dal vigile e costante amore di mio padre, io presi le redini della prima Compagnia « Marta Abba » nel 1929, tutta di giovani guidati e diretti da me.  […] Seguitai a portare in giro le mie maggiori interpretazioni del repertorio pirandelliano. […] uomini sapienti ed esperti del teatro […] catalogavano il mio repertorio come cerebrale e soltanto artistico (vale a dire anticommerciale). E la voce s’era propagata nel pubblico. Cerebrale Marta Abba e grande soltanto nell’arte pirandelliana. […] E così l’anno dopo una seconda Compagnia di mia formazione, con un repertorio che si andava sempre più accrescendo di nuove interpretazioni, tra le quali mi piace ricordare soprattutto quella di Madame Legros, di Penelope di Maugham, di La buona fata di Molnar, di La nostra compagna di Antoine, e di Anna Karenina tratta dal romanzo di Tolstoi e del Grillo del focolare tratto dal romanzo di Dickens.",0.18254086398519576,0.44126826524734497,0.5165613293647766,0.4661221504211426,0.543795108795166,0.17663989961147308,0.00926631037145853,0.3608490824699402,0.11219635605812073,0.511297345161438,0.4941302239894867,0.6072478294372559,0.024976298213005066,0.5567933917045593,0.384197860956192,0.4350816011428833,0.6869641542434692,0.49690768122673035,0.3582378029823303,0.6720112562179565
"Ritornando in Patria dopo tanti trionfi ci aspettava la più amara delusione: non sapevamo più dove andare. Per i debiti contratti a causa della ricostruzione del Teatro Odescalchi che dovevano essere pagati dallo Stato e per i ritardi intervenuti nel pagamento, il Teatro si dovette abbandonare al concessionario del Principe Odescalchi. […] La guerra cominciò fin dal giorno che la volontà e la passione di undici giovani fondarono un teatro stabile a Roma. Infatti il Teatro Odescalchi era detto anche «Teatro degli Undici », e vi posero a capo Luigi Pirandello; lotta coperta e insidiosa da parte di una società che s’era accaparrato tutto il monopolio del teatro in Italia: teatri, repertorio, Compagnie. Di fronte a questa guerra io […] rimasi a lottare accanto a Luigi Pirandello, esposta poi sempre a tutte le vendette degli avversari, sentendo che la causa per cui si combatteva era santa, e tutta in favore di noi attori per la dignità della nostra professione e per l'onore del Teatro Italiano. Fin dai contratti che le imprese facevano con la Compagnia del Teatro d’Arte di Roma, diretta da Luigi Pirandello, si esigeva che accanto al nome del Maestro figurasse come con dizione di scrittura, unico e solo, il mio; […] Una Compagnia che in tutte le nazioni d’Europa era stata accolta con tutti gli onori dei massimi teatri, fu condannata a girare quasi soltanto nella provincia […] Unica speranza di salvezza l’America del Sud. Era stato promesso all’impresario americano che la nostra Compagnia sarebbe stata sola a partire quell’anno, 1926, per l’Argentina.",0.18254086398519576,0.14315463602542877,0.4780881106853485,0.4050285816192627,0.5440691113471985,0.4098148047924042,0.9591856002807617,0.16996383666992188,0.189714252948761,0.421586275100708,0.5279637575149536,0.5037580132484436,0.021128160879015923,0.4965568482875824,0.20933739840984344,0.943046510219574,0.02324732579290867,0.44104114174842834,0.7228618860244751,0.31386616826057434
"[A Parigi] Le prove [del pirandelliano L’uomo, la bestia e la virtù] dovevano iniziarsi dopo pochi giorni, mi confortava soltanto il fatto che sarebbero durate almeno un mese. Ma non dovevo dimenticare che il personaggio era tutto da ricreare in un’altra lingua e con altri accenti e altri modi. Mi misi, sofferente, e con lunghe soste a letto, allo studio della parte. Provavo gli effetti, che man mano ottenevo, sulla mia unica spettatrice, che era una signorina francese di Compagnia; ma bisognava affrontare le prove in teatro. L’esito fu superiore a ogni mia aspettativa.",0.18254086398519576,0.12813743948936462,0.20178529620170593,0.2958877980709076,0.33898767828941345,0.15100248157978058,0.21063537895679474,0.05884195864200592,0.009331484325230122,0.24465198814868927,0.5836246013641357,0.5835123658180237,0.005822618026286364,0.4599098265171051,0.14654745161533356,0.679111659526825,0.5406138300895691,0.20980219542980194,0.28420862555503845,0.5622547268867493
"Mentre attendevo alle prove bisognava anche pensare a vestire questo personaggio. […] Non avevo né tempo né modo di rivolgermi da Parigi a sarti italiani. […]  Ed ecco[mi] con il mio bravo copione in mano da un sarto parigino. Quando questo lesse il lavoro me lo vidi restar davanti tra mortificato e avvilito. Che figura ci poteva far lui a vestire un personaggio che l’autore stesso descriveva come goffamente mascherato di virtù? Non vedeva come la sua opera potesse essere necessaria. Gli spiegai che essa era invece necessarissima. Tanto più difficile forse, quanto meno si trattava d’imbastire uno dei soliti abiti eleganti da salotto. Bisognava creare nuove forme con un nuovo a appropriato stile. […] E così avvenne. Alla rappresentazione anche gli abiti come parte integrale della creazione dei personaggio ottennero il più vivo successo, tanto che il giornale «Excelsior» dedicò un’intera pagina per commentare questo nuovo complemento interpretativo. La forma del mio cappello a tesa piatta con pudica rigida ve letta sugli occhi, la sinuosa coda dell’ermetico vestito nero del secondo atto e tante altre trovate avevano ottenuto l’approvazione di tutta la critica e del fior fiore del pubblico con venuto alla prova generale.",0.18254086398519576,0.07259687036275864,0.6043804883956909,0.659335732460022,0.5240691304206848,0.13304953277111053,0.017729295417666435,0.6191805005073547,0.008629780262708664,0.39819738268852234,0.37860172986984253,0.7180052399635315,0.018151137977838516,0.8039474487304688,0.5279613733291626,0.7610301971435547,0.21318243443965912,0.42950791120529175,0.7079797387123108,0.46007028222084045
"Le recite si susseguirono per tre mesi, e lo spettacolo più raffinato per gusto e per qualità fu indubbiamente il nostro, quello italiano, in quel periodo della migliore stagione teatrale parigina. Avrei potuto facilmente approfittare di questo successo parigino […], ma io feci in fretta e furia i miei bauli. Era un bisogno quasi fisico di tornarmene in Italia. Dopo questa veramente difficile vittoria ottenuta all’estero, io non chiesi a nessuno il riconoscimento di essa, solo volli averne un compenso chiedendo di essere ricevuta dal nostro Duce. […] Gli avrei detto che, fin da bambina, io m’ero formata a quella scuola di coraggio e di ardimento e di fede, di cui Benito Mussolini dava esempio nelle nostre strade e nelle nostre piazze di Milano […] Fui ricevuta in quel solenne salone di Piazza Venezia. […] Fu ospite squisito: s’interessò delle vicende del teatro francese, mi domandò anche di piccole cose, come della paga da me percepita a Parigi, e volle sapere quando avrei ripreso a recitare in Italia. […] Preferii volgere tutta la mia attenzione e le mie cure alla formazione di una bella Compagnia per l'imminente anno comico. E ripresi da Napoli […] Partii poi per Palermo […] [e] per alcune recite straordinarie in Sardegna. […] Ma anelavo a Roma e ancora una volta ne fui respinta da quella stessa gente a me sempre avversa. […] Ma tutte queste contrarietà io volli vincerle, anche per il desiderio che mi animava di accostarmi sempre più al caldo respiro delle masse. Ne fui ricompensata.",0.18254086398519576,0.05951439589262009,0.22549103200435638,0.20349328219890594,0.15003357827663422,0.21423672139644623,0.7043654322624207,0.09922406822443008,0.4291098713874817,0.10403956472873688,0.22257158160209656,0.903124988079071,0.008903777226805687,0.6353588700294495,0.043468307703733444,0.8005078434944153,0.01094179879873991,0.3210104703903198,0.502389132976532,0.4078754782676697
"Quanto miglior partito si sarebbe potuto trarre da me, dalla mia arte, dalla mia figura, dalla mia voce, da tutto il mio giuoco scenico, si vide nel secondo mio film, Teresa Confalonieri, che ebbe in tutta l’Italia un successo clamoroso e che fu consacrato dal primo premio nel Festival Internazionale Cinematografico di Venezia. […] Il miracolo avvenne in una sera di magnifica luna piena, dopo una settimana di piogge scroscianti; e fu per me come un sogno, perché il successo sel’avessi sognato non poteva essere più grande e più bello.",0.18254086398519576,0.3056502342224121,0.145916149020195,0.15136346220970154,0.196592316031456,0.18094058334827423,0.028127385303378105,0.051979873329401016,0.005071584600955248,0.2830964922904968,0.2488972544670105,0.4654632806777954,0.4610573947429657,0.22464916110038757,0.11306414008140564,0.5359164476394653,0.1254502534866333,0.07657276839017868,0.43663910031318665,0.5963233709335327
"Quanto finora ho detto per il teatro potrei cominciare a dirlo anche per la cinematografia. Fino a un certo punto vedendomi costantemente tenuta fuori da ogni tentativo di esperimento della mia figura sullo schermo, io stessa mi domandai: «Ma forse in film io non verrò bene? ». Sapevo che in tutti gli altri paesi dopo l ’avvento del film parlato, la maggior parte delle attrici e degli attori del teatro di prosa erano stati chiamati a interpretare i nuovi soggetti. […] il dubbio sulle mie possibilità cinematografiche, a poco a poco cominciò a radicarsi in me talmente, che solo a titolo di saggio o di prova a me stessa, consentii ad accettare una parte di fianco in un film di origine tedesca di cui si voleva fare la riproduzione italiana. A tanto mi aveva ridotta la diffidenza altrui.",0.18254086398519576,0.4934527575969696,0.5861489176750183,0.4726661443710327,0.30245456099510193,0.01337492372840643,0.01739967241883278,0.20697638392448425,0.004114232026040554,0.6485621333122253,0.6358034014701843,0.6810524463653564,0.003276425413787365,0.533337414264679,0.10922252386808395,0.615032970905304,0.19381149113178253,0.04706975072622299,0.3845788538455963,0.5767949819564819
"I più autorevoli critici notarono quale acquisto aveva fatto la cinematografia italiana con me, cioè con una artista che non voleva in nulla e per nulla somigliare le eroine dei films d’oltre oceano, con gesti, modi, e portamento e caratteri suoi propri personali; tali da dare una tipica impronta alla produzione italiana. A chi disse queste cose la critica italiana? Chi le ascoltò? […] Marta Abba dopo quel successo e dopo la consacrazione della critica non è stata mai chiamata da nessuno.",0.18254086398519576,0.3022821247577667,0.34395891427993774,0.21632090210914612,0.1522630751132965,0.07072774320840836,0.030039116740226746,0.16019560396671295,0.006339543499052525,0.20520521700382233,0.42641234397888184,0.48271408677101135,0.003995189443230629,0.28049618005752563,0.2616979479789734,0.5386883616447449,0.26715087890625,0.27112260460853577,0.39344942569732666,0.503715991973877
"Questa, in riassunto e per sommi tratti la storia della mia carriera artistica fin qui. La conclusione che logicamente e in base ai fatti se ne deve trarre, non è purtroppo lieta. Non tanto per me che […] in fondo sono riuscita sempre a impormi […] quanto per le condizioni dell’arte drammatica in Italia.",0.1792312511242926,0.4534185528755188,0.502275824546814,0.36188042163848877,0.5366225242614746,0.22172710299491882,0.12613987922668457,0.16444683074951172,0.03934887796640396,0.5920553803443909,0.657163143157959,0.6424162983894348,0.0033659141045063734,0.5249463319778442,0.47551724314689636,0.7466656565666199,0.317058801651001,0.2829107940196991,0.21557584404945374,0.4543136954307556
"vivo con il mio segreto da circa dieci anni, e credo che se avessi regalato tutto il cibo che ho masticato e poi vomitato avrei potuto salvare almeno una colonia di bambini malnutriti. […] Macché dico? Penso di averli salvati i bambini malnutriti, da questa droga che ti frega sorridendo, che finge di non essere uguale alle altre.",0.1792312511242926,0.3191770911216736,0.1642361432313919,0.051385436207056046,0.559408962726593,0.810477614402771,0.894533097743988,0.37718260288238525,0.11405102163553238,0.15171507000923157,0.7008691430091858,0.16022367775440216,0.4506414234638214,0.8551439046859741,0.9568568468093872,0.9654550552368164,0.011801715940237045,0.6600846648216248,0.8320955038070679,0.2866947650909424
"Non ho bevuto abbastanza e ho divorato cibi solidi quindi come potevo pensare di riuscire a rimettere, sono leggi fisiche! […] qualsiasi bulimica al mondo deve conoscere la giusta dose di liquidi in base a cosa sceglie di ingurgitare e per le più raffinate anche cosa bere… certe volte l’acqua non basta, meglio il latte.",0.1792312511242926,0.07909049093723297,0.054962173104286194,0.14645881950855255,0.024269016459584236,0.013993769884109497,0.002884241519495845,0.012705977074801922,0.007117556873708963,0.3134986460208893,0.33767709136009216,0.2259044349193573,0.005475825630128384,0.08660628646612167,0.14598461985588074,0.26242709159851074,0.014076955616474152,0.1134415864944458,0.06440915912389755,0.2352910041809082
"Sono gonfia, la pelle tira, la faccia è deforme. […] Ho un corpo che varia di peso giorno dopo giorno, i liquidi in eccesso agitano l’acqua già esistente nelle cosce soprattutto, è lì che si vede di più. Sono tutta faccia e cosce. Il viso di quelle come me si riconosce dai tratti. La parte della mascella si allarga, la zona perioculare diventa alta come gli zigomi, segno che il fegato sta bestemmiando pur di farmi smettere. Ho le ghiandole sotto il collo enormi, deturpano il profilo facendogli perdere freschezza, sono già vecchia. Le cosce invece, assumono un colorito post esposizione al sole delle 14 senza protezione, formicolano e si spostano da terra malvolentieri. Ci parlo, cerco di motivarle […] ma loro non rispondono. Hanno le cascate del Niagara sottopelle le mie cosce, e per di più a quanto pare sono pure sorde. “Faccio cagare!” Non esistono sintomi per certe visioni.",0.1792312511242926,0.37429285049438477,0.5414460897445679,0.9791099429130554,0.488508015871048,0.3315022587776184,0.010335823521018028,0.14857704937458038,0.025423172861337662,0.8222854733467102,0.8062230348587036,0.4402526915073395,0.015385228209197521,0.3716631531715393,0.8429548740386963,0.7824375629425049,0.6028066277503967,0.3644322454929352,0.5115195512771606,0.4627743661403656
"[La figlia] lavora sugli interni, io mi fido e basta. […] Sistema le cose, ha preso spazio, ha illuminato il buio, scaldato la zona che ora sputa fuori solo quello che non deve restare dentro. […] Piano, pianissimo, rimodella i tratti, con i piedini tappa i buchi neri e non molla la presa. È così forte. Per nove mesi non smette un secondo di costruirmi. […] lavora sull’anima distrutta, ristruttura le fondamenta e quello che chiede io le do, perché servono materiali giusti questa volta. Quello che mangio resta lì e si trasforma in pezzi sani di me.",0.1792312511242926,0.2861243188381195,0.28460848331451416,0.32298871874809265,0.2077614963054657,0.08923501521348953,0.0033783838152885437,0.5589404702186584,0.6038052439689636,0.18345510959625244,0.17984575033187866,0.343608558177948,0.003950104583054781,0.43524104356765747,0.1978367120027542,0.5921437740325928,0.7179120779037476,0.10138998925685883,0.4421095848083496,0.279995858669281
"Sembro incinta al settimo mese e la cosa non mi dispiace affatto, mi porta in uno stato catartico che mi impone di continuare a recitare la parte della gravida felice. Mi purifico dalla colpa e sogno che tutto quel cibo pari a uno scaffale intero di un vecchio alimentari sia il mio primo figlio e che ad aspettarmi fuori dalla porta ci sia tutto l’amore del mondo. Mi siedo e mi rialzo sentendo la pressione della pancia, fingo di percepire qualcuno dentro e per un attimo mi dona quella pienezza che da sola proprio non riesco a sentire.",0.1792312511242926,0.05197625979781151,0.5635300278663635,0.05951589345932007,0.908403217792511,0.2714386284351349,0.003240325255319476,0.9856284856796265,0.7359384894371033,0.06327366828918457,0.0274442657828331,0.08100613206624985,0.003198775229975581,0.38812223076820374,0.9238240122795105,0.960410475730896,0.9204232692718506,0.2305297553539276,0.927795946598053,0.3980351686477661
